status_id,status_message,link_name,status_type,status_link,status_published,num_reactions,num_comments,num_shares,num_likes,num_loves,num_wows,num_hahas,num_sads,num_angrys
86680728811_10154601204348812,"Donald J. Trump said the U.S. has to ""fix our own mess"" before helping NATO allies.",Trump Would Review Whether to Help NATO Allies in Crisis,link,http://abcn.ws/29XfHV5,2016-07-21 01:13:07,1675,392,106,1304,125,45,36,12,153
86680728811_10154601167203812,"Tesla CEO Elon Musk's ""master plan"" includes a way for owners to add their cars to the automaker's ride-sharing fleet to earn money while their owners are busy.","'Master Plan' for Tesla Focuses on Autonomous Driving, Ride Sharing",link,http://abcn.ws/2adIqnC,2016-07-21 00:46:21,162,24,22,151,6,5,0,0,0
86680728811_10154601113623812,19-year-old faces up to 5 years in prison for taking part in illegal rally that sparked massive student-led pro-democracy street protests.,Hong Kong Teen Protest Leader Guilty of Unlawful Assembly,link,http://abcn.ws/29VjEfz,2016-07-21 00:17:49,267,32,25,172,3,15,2,42,33
86680728811_10154601046453812,"Nearly 200,000 tons of hot dogs, corn dogs recalled over concerns of listeria contamination.","Listeria Fear Prompts 186,000-Ton Hot Dog, Corn Dog Recall",link,http://abcn.ws/2aarHDA,2016-07-20 23:55:16,833,361,3507,549,4,193,6,19,62
86680728811_10154600980193812,"Ted Cruz mentioned Donald J. Trump's name just once during his address, while Marco Rubio referenced him twice and Scott Walker did so five times.",Donald Trump's GOP Rivals Wrestle With Supporting His Nomination,link,http://abcn.ws/2adVzNw,2016-07-20 23:30:20,386,201,31,239,8,3,114,1,21
86680728811_10154600947173812,Some Democrats responded to House Speaker Paul Ryan's selfie with Capitol Hill interns with photos of their summer interns.,House Democrats Troll Speaker Paul Ryan for Instagram Photo With Interns,link,http://abcn.ws/2avGshG,2016-07-20 23:17:20,4156,331,239,3354,552,12,218,5,15
86680728811_10154600946378812,,Good Morning America,video,https://www.facebook.com/GoodMorningAmerica/videos/10153764457537061/,2016-07-20 23:17:00,160,38,0,125,4,0,13,1,17
86680728811_10154600847018812,"Donald J. Trump on Ted Cruz's GOP Convention speech: ""I saw his speech two hours early but let him speak anyway. No big deal!"" http://abcn.ws/29X1UO0",Timeline Photos,photo,https://www.facebook.com/ABCNews/photos/a.10150095914943812.286215.86680728811/10154600847018812/?type=3,2016-07-20 22:51:14,570,239,55,370,28,9,142,1,20
86680728811_10154600800408812,"Video shows Ted Cruz's wife, Heidi, escorted out of GOP Convention amid fears for her safety after her husband's speech. ""Trump folks were physically approaching and confrontationally yelling,"" ex-Virginia Attorney General Ken Cuccinelli told ABC News. http://abcn.ws/29OFSuQ",Heidi Cruz Escorted Out of GOP Convention,video,https://www.facebook.com/ABCNews/videos/10154600800408812/,2016-07-20 22:26:34,1808,859,626,814,16,461,249,128,140
86680728811_10154600785803812,"Donald J. Trump's running mate Mike Pence criticized Hillary Clinton and praised the changes that Trump will bring if elected. ""The choice could not be more clear.""","Pence Introduces Himself as 'a Christian, a Conservative and a Republican'",link,http://abcn.ws/29WYJGi,2016-07-20 22:19:29,1058,242,65,777,84,9,135,9,44
86680728811_10154600758108812,"Ted Cruz's wife, Heidi, escorted out of GOP Convention because ""Trump folks were physically approaching and confrontationally yelling,"" former Virginia Attorney General Ken Cuccinelli told ABC News.",Ted Cruz Booed off RNC Stage After Failing to Endorse Trump,link,http://abcn.ws/2acw4iU,2016-07-20 22:09:44,1286,316,247,806,31,144,228,33,44
86680728811_10154600754193812,"Mike Pence: ""It's been a heartbreaking time for the women and men in our law enforcement community...we will always stand with those who stand on the thin blue line of law enforcement in America!"" http://abcn.ws/2acuRbr",Mike Pence: 'We Will Always Stand With Law Enforcement',video,https://www.facebook.com/ABCNews/videos/10154600754193812/,2016-07-20 22:08:17,1726,138,168,1478,175,6,38,6,23
86680728811_10154600736018812,"Mike Pence on Donald J. Trump's children: ""You can't fake good kids! How about his amazing children."" http://abcn.ws/2acuRbr #GOPConvention",Mike Pence: 'You Can't Fake Good Kids!',video,https://www.facebook.com/ABCNews/videos/10154600736018812/,2016-07-20 21:58:37,2644,444,149,2030,245,11,302,9,47
86680728811_10154600735543812,"Eric Trump: Donald J. Trump ""shattered the expectations of every political pundit"" in his rise to win the Republican nomination.",Eric Trump Highlights Father's Passion for Helping Others,link,http://abcn.ws/29WWrqM,2016-07-20 21:57:25,1129,237,34,832,107,4,160,2,24
86680728811_10154600720198812,"Mike Pence introduces mother at RNC: ""Would you join me in welcoming the light of my life, my mom, Nancy!"" http://abcn.ws/2acuRbr",Mike Pence Introduces Mother at RNC,video,https://www.facebook.com/ABCNews/videos/10154600720198812/,2016-07-20 21:48:42,1192,140,150,996,135,4,48,2,7
86680728811_10154600716153812,"Mike Pence says Donald J. Trump is ""a man known for a large personality...so I guess he was just looking for some balance on the ticket."" http://abcn.ws/2acuRbr",Trump's VP Pick Mike Pence Speaks at RNC,video,https://www.facebook.com/ABCNews/videos/10154600716153812/,2016-07-20 21:47:12,851,133,53,655,56,8,111,3,18
86680728811_10154600705973812,"Mike Pence at RNC: ""I accept your nomination to run and serve as Vice President of the United States of America!"" http://abcn.ws/2acuRbr",Trump's VP Pick Mike Pence Accepts VP Nomination,video,https://www.facebook.com/ABCNews/videos/10154600705973812/,2016-07-20 21:43:45,1052,210,118,803,102,5,40,9,93
86680728811_10154600700388812,"Watch the full speech: Ted Cruz roundly booed after failing to endorse Donald J. Trump at GOP Convention and telling delegates to ""vote your conscience"" in November. http://abcn.ws/29V6GOO",FULL SPEECH: Ted Cruz Booed for Failing to Endorse Donald Trum...,video,https://www.facebook.com/ABCNews/videos/10154600700388812/,2016-07-20 21:42:47,1125,369,244,679,61,28,231,10,116
86680728811_10154600677443812,"Eric Holder has a new job: He's been hired by Airbnb to develop a ""world-class anti-discrimination policy.""",Airbnb Hires Former U.S. Attorney General Eric Holder,link,http://abcn.ws/29UCHmb,2016-07-20 21:28:45,501,88,64,388,12,32,58,1,10
86680728811_10154600656128812,"Eric Trump: ""Dad - you are my hero, you are my best friend, you are the next president of the United States."" http://abcn.ws/29N5ETY",Eric Trump: 'Dad You Are My Hero',video,https://www.facebook.com/ABCNews/videos/10154600656128812/,2016-07-20 21:21:29,6945,1041,448,4993,662,27,1000,46,217
86680728811_10154600647463812,,ABC News Politics,video,https://www.facebook.com/ABCNewsPolitics/videos/988609604570599/,2016-07-20 21:17:26,493,146,0,371,10,23,44,7,38
86680728811_10154600637393812,"Eric Trump says his father ""turned dreams into reality his entire career. It's what he does. It's who he is."" http://abcn.ws/29N5ETY",Eric Trump Says His Father Turns Dreams Into Reality,video,https://www.facebook.com/ABCNews/videos/10154600637393812/,2016-07-20 21:13:22,990,327,109,697,81,7,157,4,44
86680728811_10154600631963812,"Eric Trump: ""It's time for a president with common sense, it's time for a president who understands the art of a deal and appreciates the value of a dollar."" http://abcn.ws/29N5ETY",Eric Trump: 'It's Time For a President With Common Sense',video,https://www.facebook.com/ABCNews/videos/10154600631963812/,2016-07-20 21:11:17,769,208,68,523,49,7,159,3,28
86680728811_10154600626828812,"BREAKING: Ted Cruz booed at RNC after he fails to endorse Donald J. Trump and says to ""vote your conscience."" #GOPConvention",Ted Cruz Booed for Failing to Endorse Donald Trump at RNC,link,http://abcn.ws/29WRKwZ,2016-07-20 21:08:41,10949,1724,984,7257,476,200,2328,71,617
86680728811_10154600606793812,Crowd chants 'Endorse Trump!' to Ted Cruz after Cruz fails to endorse Donald J. Trump for president. http://abcn.ws/29PQHfx,Crowd Chants 'Endorse Trump' to Ted Cruz,video,https://www.facebook.com/ABCNews/videos/10154600606793812/,2016-07-20 21:02:03,1874,498,180,1086,40,34,551,11,152
86680728811_10154600592958812,"Ted Cruz at #GOPConvention: ""Don't stay home in November...vote your conscience."" http://abcn.ws/29PQHfx",Ted Cruz Tells America to 'Vote Your Conscience',video,https://www.facebook.com/ABCNews/videos/10154600592958812/,2016-07-20 20:56:19,824,269,507,581,57,13,134,2,37
86680728811_10154600592143812,"The theme of Scott Walker's speech - ""America deserves better"" - was repeated by convention delegates throughout his speech.",Scott Walker Throws Support Behind Donald Trump in RNC Speech,link,http://abcn.ws/2aawkgD,2016-07-20 20:54:37,686,205,72,529,43,3,83,4,24
86680728811_10154600570828812,DOJ bulletin suggests anger towards police could be morphing into organized effort to target officers - especially by street gangs.,Justice Department: Street Gangs Targeting Law Enforcement Officers,link,http://abcn.ws/2adFcAI,2016-07-20 20:44:27,1108,316,413,497,10,24,10,186,381
86680728811_10154600548293812,"Ted Cruz: ""I want to congratulate Donald J. Trump for winning the nomination last night."" http://abcn.ws/29MZseE #GOPConvention",Cruz Congratulates Trump on Winning GOP Nomination,video,https://www.facebook.com/ABCNews/videos/10154600548293812/,2016-07-20 20:36:34,373,165,23,236,12,7,65,5,48
86680728811_10154600510163812,"WATCH LIVE: Ted Cruz, Eric Trump, Newt Gingrich and Donald J. Trump's running mate Mike Pence are set to take the stage during day 3 of the #GOPConvention.",Day 3 of Republican National Convention,video,https://www.facebook.com/ABCNews/videos/10154600510163812/,2016-07-20 20:32:07,11238,12406,1054,7873,986,150,349,169,1711
86680728811_10154600509133812,,ABC News Politics,video,https://www.facebook.com/ABCNewsPolitics/videos/988584384573121/,2016-07-20 20:21:22,551,157,0,400,15,4,62,3,67
86680728811_10154600498528812,"Gambling debts at Vegas casinos, posh penthouses in New York, sprawling mansions in L.A., paintings by Monet and Van Gogh and a private jet were all paid for with money stolen from innocent people, according to the feds.","U.S. Seeks $1 Billion in Mansions, Paintings and Major Assets From Massive Malaysian Scheme",link,http://abcn.ws/29Ogmpu,2016-07-20 20:15:20,645,27,121,475,6,94,5,7,58
86680728811_10154600462793812,Southwest Airlines flights across the U.S. held up while airline works to fix glitch that affected 'multiple technology systems.',Computer Glitch Causes Nationwide Delays for Southwest Passengers,link,http://abcn.ws/29MV1Re,2016-07-20 19:53:10,146,28,59,102,0,35,5,0,4
86680728811_10154600435873812,,ABC News Politics,video,https://www.facebook.com/ABCNewsPolitics/videos/988567024574857/,2016-07-20 19:37:13,161,12,0,152,4,1,2,1,1
86680728811_10154600415028812,"Donald J. Trump's campaign made several overtures to John Kasich about potentially becoming Trump's running mate, senior Kasich advisers told ABC News.","Trump Campaign Made VP Overtures to John Kasich, Kasich Advisors Say",link,http://abcn.ws/29UENmh,2016-07-20 19:25:27,192,125,18,142,1,10,35,2,2
86680728811_10154600372763812,"Donald J. Trump shooting back at criticism that erupted after Melania Trump's convention speech, saying the uproar was ""very unfair.""",Donald Trump Calls Uproar About Melania's Speech 'Very Unfair',link,http://abcn.ws/29USaXJ,2016-07-20 19:02:08,1339,763,79,695,46,16,543,4,35
86680728811_10154600365978812,"Republican National Convention has proper license that grants it the right to play Queen's ""We Are the Champions,"" ABC News has learned.","Queen May Dislike Trump, But Artists Have Limited Say in Music Use",link,http://abcn.ws/2aahHKt,2016-07-20 18:57:25,1198,243,114,774,46,25,163,16,174
86680728811_10154600272708812,Day 3 of the #GOPConvention begins and we have full coverage right here on Facebook! Florida Gov. Rick Scott is set to speak.,,video,https://www.facebook.com/ABCNews/videos/10154600272708812/,2016-07-20 18:35:31,9041,10882,915,6713,833,101,218,112,1064
86680728811_10154600310358812,"Rep. Mark Takai has died after battle with pancreatic cancer, Hawaii congressman's office confirms.",Freshman Hawaii Rep. Mark Takai Dies After Battle With Cancer,link,http://abcn.ws/2avpxw4,2016-07-20 18:30:49,2263,91,147,689,12,46,1,1510,5
86680728811_10154600260363812,"Two officers received minor injuries during protests, with multiple protesters arrested, according to Cleveland Police. Authorities say 17 have been arrested.","2 Officers Assaulted in Protests Outside GOP Convention, Police Say",link,http://abcn.ws/2avwLjs,2016-07-20 18:08:32,146,40,39,85,0,9,1,25,26
86680728811_10154600184383812,The White House: Pres. Barack Obama has been in touch with Florida Gov. Rick Scott about 'suspected case of mosquito transmission of Zika.' http://abcn.ws/29WvDql,Timeline Photos,photo,https://www.facebook.com/ABCNews/photos/a.10150095914943812.286215.86680728811/10154600184383812/?type=3,2016-07-20 17:43:38,74,17,49,55,1,9,2,6,1
86680728811_10154600178863812,"After 14 million votes were cast for Donald J. Trump during primary season, the toughest challenge the Never Trump movement couldn't overcome was identifying an alternative candidate to rally around.",Why the Never Trump Movement Failed at the Republican National Convention,link,http://abcn.ws/2aa3k90,2016-07-20 17:41:22,325,123,39,232,4,4,51,19,15
86680728811_10154600169198812,"Donald J. Trump on Melania Trump's speechwriter: ""She made a mistake. You know, people make mistakes...we all make mistakes."" http://abcn.ws/2adj3SU",Donald Trump on Melania's Speechwriter: 'She Made a Mistake',video,https://www.facebook.com/ABCNews/videos/10154600169198812/,2016-07-20 17:38:53,4671,1288,681,3033,113,64,1160,10,291
86680728811_10154600126518812,"Secret Service investigating a Donald J. Trump adviser who said in a radio interview that presumptive Hillary Clinton should be ""shot for treason"" on a ""firing line.""",Secret Service Investigating Trump Adviser for Alleged Clinton Threat,link,http://abcn.ws/2aa1mW6,2016-07-20 17:20:31,3414,1350,967,2060,70,529,399,48,308
86680728811_10154600074953812,Donald J. Trump landed by helicopter not far from the Republican National Convention in downtown Cleveland ahead of the third night of the convention.,Donald Trump Arrives by Helicopter for Day 3 of RNC,link,http://abcn.ws/2auTzQp,2016-07-20 17:00:02,566,159,25,438,50,3,24,1,50
86680728811_10154599996093812,,ABC News Politics,video,https://www.facebook.com/ABCNewsPolitics/videos/988491421249084/,2016-07-20 16:30:51,520,90,0,461,11,7,14,1,26
86680728811_10154599964973812,"Heartbreaking images of what has been dubbed the ""world's saddest polar bear,"" housed at a Chinese mega-mall, has sparked international outrage. ""This is a bear that suffers for what? For selfies? For shopping?""",'World's Saddest Polar Bear' Suffers for Selfies at Chinese Shopping Center,link,http://abcn.ws/2a9b8bb,2016-07-20 16:19:45,17336,1287,2716,3150,29,68,12,7070,7007
86680728811_10154599876843812,"Mysterious booming noise in a small California town has residents baffled, and has sparked many conspiracy theories.",Mysterious Booms Have Small California Town Looking to the Sky,link,http://abcn.ws/29Mgqtv,2016-07-20 15:53:44,472,102,197,394,4,66,6,2,0
86680728811_10154599692123812,Newlywed couple from the UK celebrating after learning that an experimental treatment they took a chance on has erased all signs of cancer in the husband.,Experimental Cancer Treatment Erases Signs of Newlywed's Leukemia,link,http://abcn.ws/2acHrUX,2016-07-20 15:32:52,22095,227,2518,17925,2507,1629,11,21,2
86680728811_10154599530483812,We're touring a grow house at a Colorado marijuana company and talking about the barriers it faces as the industry continues to grow. Ask your questions in the comments below!,,video,https://www.facebook.com/ABCNews/videos/10154599530483812/,2016-07-20 15:16:19,2255,598,483,1853,265,87,20,6,24
86680728811_10154599614403812,Street artist installs 6-inch tall concrete wall around Donald J. Trump's Hollywood Walk of Fame star.,Street Artist Builds 'Wall' Around Donald Trump's Hollywood Walk of Fame Star,link,http://abcn.ws/29UalIM,2016-07-20 15:11:12,37848,1972,7489,23006,1724,184,12762,25,147
86680728811_10154599527068812,Deadly attacks on law enforcement in Dallas and Baton Rouge have drawn national attention to the dangers of being a cop. But former NYPD Commissioner Ray Kelly doesn't think the current climate impacts officers' productivity at work.,"Cops Won't Be Deterred, Says Former NYPD Commissioner",link,http://abcn.ws/2auTYlO,2016-07-20 14:42:44,228,52,15,202,12,10,0,4,0
86680728811_10154599443318812,"Texas father heartbroken over the death of his teenage son who was shot and killed by a friend who had been at their home for a sleepover. ""He died in my arms.""",Teen Dies in Dad's Arms After Allegedly Shot by Friend at Sleepover,link,http://abcn.ws/2auT5tz,2016-07-20 14:13:12,5755,345,532,1368,14,346,2,3914,111
86680728811_10154599365228812,Parents of 2-year-old boy killed by a gator at Walt Disney World in Florida say the pain of losing their son gets worse each day.,Parents of Boy Killed by Gator: 'Pain Gets Worse' Each Day,link,http://abcn.ws/29NQj1J,2016-07-20 13:48:43,4328,326,121,1246,92,10,1,2970,9
86680728811_10154599302103812,"Virginia mom of 3 is now a mom of 9 after honoring her friend's dying wish to adopt her children. ""We started dancing as soon as the judge made his ruling. It was like winning the Super Bowl for us.""",Mom of 3 Adopts Friend's 6 Kids After Her Death,link,http://abcn.ws/2acCxag,2016-07-20 13:24:28,86993,1437,5076,69608,15399,1632,47,305,2
86680728811_10154599299408812,Donald J. Trump is greeted by family and VP nominee Mike Pence upon arrival in Cleveland. http://abcn.ws/29VZxeu,Donald Trump Arrives in Cleveland,video,https://www.facebook.com/ABCNews/videos/10154599299408812/,2016-07-20 13:24:24,2018,342,119,1643,128,10,46,9,182
86680728811_10154599242503812,"TO THE RESCUE: Strangers come together to flip convertible over and rescue driver who lost control of his car. ""Everyone was in shock. There were people crying. There were people hugging each other."" http://abcn.ws/29VOJgw",Group of Strangers Flip Crashed Convertible to Rescue Driver,video,https://www.facebook.com/ABCNews/videos/10154599242503812/,2016-07-20 13:01:36,50745,1830,24827,38600,4866,7060,84,127,8
86680728811_10154599170333812,Florida investigating whether a Zika virus infection could be the first time the virus has been transmitted within the continental U.S. through infected mosquitoes.,Florida Investigates Possible First US Case of Local Zika Transmission,link,http://abcn.ws/2acsbre,2016-07-20 12:35:47,225,37,109,153,0,41,2,27,2
86680728811_10154599111753812,Everything you need to know about Day 3 at the #GOPConvention: abcn.ws/2a0nHEZ,Everything You Need to Know About Day 3 at the RNC,video,https://www.facebook.com/ABCNews/videos/10154599111753812/,2016-07-20 12:12:50,136,115,17,118,2,0,10,0,6
86680728811_10154599040618812,"ABC News' Cokie Roberts and Ann Compton are on the convention floor in the Quicken Loans Arena in Cleveland talking memorable moments from conventions past, and what they'll be watching for on night three of the #GOPConvention: http://abcn.ws/29NG3Xh",,video,https://www.facebook.com/ABCNews/videos/10154599040618812/,2016-07-20 12:06:27,765,292,56,676,34,3,14,4,34
86680728811_10154599087328812,,This Week,video,https://www.facebook.com/ThisWeekABC/videos/1135334373176670/,2016-07-20 12:01:54,431,31,0,408,11,3,8,0,1
86680728811_10154599051273812,In-house writer with the Donald J. Trump campaign steps forward with apology for Melania Trump's speech and tries to resign - but Trump camp rejects resignation.,Melania Trump's Speechwriter Comes Forward to Apologize,link,http://abcn.ws/2acrtu1,2016-07-20 11:50:17,2977,959,657,1995,61,110,746,25,40
86680728811_10154599047008812,"47 years later, artifacts from Neil Armstrong's moon landing to go on display at the National Air and Space Museum, Smithsonian Institution.",Armstrong's Moon Landing Artifacts Go on Display at Smithsonian,link,http://abcn.ws/29TFdcf,2016-07-20 11:48:29,717,36,88,680,29,4,4,0,0
86680728811_10154599000398812,"JUST IN: Donald J. Trump staffer takes responsibility for Melania Trump's speech and offers to resign, but Trump camp rejects her resignation. abcn.ws/2acqDgN",Timeline Photos,photo,https://www.facebook.com/ABCNews/photos/a.10150095914943812.286215.86680728811/10154599000398812/?type=3,2016-07-20 11:33:25,4759,1690,5876,3471,204,135,889,9,51
86680728811_10154598983638812,"MAN ON THE MOON: On this day 47 years ago, astronaut Neil Armstrong became the first man to ever set foot on the moon. Relive that incredible moment in history. http://abcn.ws/29NwMhO",Neil Armstrong Becomes First Man to Walk on the Moon,video,https://www.facebook.com/ABCNews/videos/10154598983638812/,2016-07-20 11:30:00,4807,195,1754,4337,303,153,8,5,1
86680728811_10154598927203812,HSBC executive and former HSBC executive charged with conspiring to defraud client.,HSBC Banker Arrested at JFK in Foreign Exchange Probe,link,http://abcn.ws/29VyFvd,2016-07-20 11:08:32,195,16,30,161,0,17,10,0,7
86680728811_10154598883398812,STRAIT TALK: ABC News' Matthew Dowd and Lz Granderson are at a Cleveland barbershop breaking down the first half of the #GOPConvention and previewing the fireworks to come:,,video,https://www.facebook.com/ABCNews/videos/10154598883398812/,2016-07-20 11:00:12,4682,1072,381,4119,337,34,117,13,62
86680728811_10154598883158812,"Mountain goat in Alaska jumped into the ocean to get away from crowds snapping its picture, and the animal drowned when it couldn't get back to land because of the crush of people on shore.",Goat Drowns Trying to Escape Alaska Crowds Taking Its Photo,link,http://abcn.ws/2aujCY8,2016-07-20 10:49:04,7649,759,959,924,12,76,22,3340,3275
86680728811_10154598829538812,"On this day 47 years ago, astronaut Neil Armstrong became the first man to ever set foot on the moon. http://abcn.ws/2ab0BxB",47 Years Ago Neil Armstrong Became 1st Man to Set Foot on Moon,video,https://www.facebook.com/ABCNews/videos/10154598829538812/,2016-07-20 10:29:05,14230,388,5040,13199,728,281,16,3,3
86680728811_10154598784893812,"Turkey demands resignation of every single university dean, expanding the government purge after attempted coup.",Turkey Demands Resignation of All University Deans,link,http://abcn.ws/29LSC95,2016-07-20 10:06:49,198,68,53,125,0,31,3,8,31
86680728811_10154598707908812,"""I wrote every single word of my speech myself...I think sometimes when you write from the heart, and I'll certainly deliver it from the heart, the product will be what it will be.""",Eric Trump Using 'Zero' Speechwriters for RNC Speech,link,http://abcn.ws/29VbUHG,2016-07-20 09:34:08,1604,459,74,1205,125,8,243,6,17
86680728811_10154598657128812,"Cast and crew of 'Rogue One' open up about upcoming movie -- a grittier, darker film than Star Wars fans may be used to.","'Rogue One' Cast Talks Keeping Secrets, Darth Vader Goosebumps",link,http://abcn.ws/29Oroul,2016-07-20 09:11:11,236,13,39,216,13,7,0,0,0
86680728811_10154598644008812,"Mother mourning the loss of her 4-year-old son shares message to parents: ""Go hug your babies right now. Soak in their smell, look at the innocent sparkle in their eyes that is lost somewhere between childhood and adulthood.""",Grieving Mom's Advice After Toddler's Death: 'Hold Your Babies Tight',link,http://abcn.ws/2abX3Yw,2016-07-20 09:04:50,8730,182,925,4583,649,10,0,3482,6
86680728811_10154598592248812,"Australian government releases photos of wing flap believed to belong to the missing airliner from Malaysia Airlines Flight 370, discovered on Pemba Island near Tanzania.",New Photos Show Wing Flap Believed to be From Missing MH370,link,http://abcn.ws/2abRfhZ,2016-07-20 08:41:56,89,7,24,85,0,4,0,0,0
86680728811_10154598551848812,,ABC News Politics,video,https://www.facebook.com/ABCNewsPolitics/videos/988246727940220/,2016-07-20 08:22:05,530,59,0,485,5,5,19,4,12
86680728811_10154598489938812,"""We're talking about 50 words out of fourteen hundred. They're part of the speech but the speech itself talks about her immigrant status, her love of country, her love of husband. These are her stories, these are her messages.""",Trump Campaign Chairman Stands By Defense of Melania Trump,link,http://abcn.ws/29TmnSN,2016-07-20 07:58:21,1925,823,151,1337,115,18,392,4,59
86680728811_10154598419668812,"""I just did it so the kids could take their mind off what they're doing. So they could get out of their room and walk over to the playroom and have a little bit fun.""",Construction Worker Plays Real-Life Game of 'Where's Waldo?' With Kids in Hospital,link,http://abcn.ws/2a9x8Ro,2016-07-20 07:36:43,3895,22,283,3248,614,8,25,0,0
86680728811_10154598356483812,"16-year-old California teen flies over 8,000 miles around the continental U.S. in just 13 days after learning how to fly.","California Teen Flies More Than 8,000 Miles Around the Country",link,http://abcn.ws/2a8VKgp,2016-07-20 07:13:15,6524,132,299,5860,328,327,6,1,2
86680728811_10154598298623812,"Construction worker plays real-life game of ""Where's Waldo?"" with kids in hospital. ""It just makes them forget all their worries and their pain for a few minutes, which is tremendous."" http://abcn.ws/29MtI5P",Construction Worker Plays Real-Life Game of 'Where's Waldo?' W...,video,https://www.facebook.com/ABCNews/videos/10154598298623812/,2016-07-20 06:50:07,17422,152,2593,14307,2963,32,118,2,0
