status_id,status_message,link_name,status_type,status_link,status_published,num_reactions,num_comments,num_shares,num_likes,num_loves,num_wows,num_hahas,num_sads,num_angrys
86680728811_10154598240273812,Sweltering heat will engulf more than half of the country in this summer's latest heat wave.,Major Heat Wave to Spread From Plains to East Coast This Week,link,http://abcn.ws/29KpMWM,2016-07-20 06:28:07,2842,297,4837,1828,25,637,11,270,71
86680728811_10154598154343812,"Night after Melania Trump delivered speech lines nearly identical to Michelle Obama's, Donald Trump Jr.  appeared to recycle one published months earlier by his convention-night speechwriter.",Donald Trump Jr. Delivers Recycled Speech Line at RNC,link,http://abcn.ws/2a7yIVq,2016-07-20 05:55:01,1622,938,265,742,23,103,679,15,60
86680728811_10154598112078812,"Brandon Potter and his wife Debbie are endlessly thankful for Facebook, a metal detector and one stranger's generosity. ""This blew my mind.""",Stranger Responds to Facebook 'Hail Mary' and Finds Woman's Lost Wedding Ring,link,http://abcn.ws/2a98nYQ,2016-07-20 05:30:27,6524,48,218,5797,549,173,4,1,0
86680728811_10154598055593812,The Australian government released several photos of a wing flap believed to belong to the missing airliner from Malaysia Airlines Flight 370.,New Photos Show Wing Flap Believed to be From Missing MH370,link,http://abcn.ws/2a7Up86,2016-07-20 04:54:21,200,8,27,163,2,25,0,10,0
86680728811_10154598020993812,"81-year-old owner of an animal safari park in New York was killed by an antelope from the park in a ""tragic accident"" that has left his family in shock.","Safari Owner 'Trampled' to Death by Antelope in Park, Officials Say",link,http://abcn.ws/29TbPEd,2016-07-20 04:30:14,675,52,60,324,3,87,8,252,1
86680728811_10154597941068812,Did Hillary Clinton lie about her own name? Is she an 'apologist' for Boko Haram? ABC News is fact-checking selected speakers at the 2016 Republican National Convention.,Republican Convention 2016: Fact-Checking the Speakers,link,http://abcn.ws/2ab2abz,2016-07-20 03:52:41,465,272,117,323,6,6,105,3,22
86680728811_10154597911888812,"Bus surveillance video shows suspect jumping onto a bus to flee police, then trying to grab one officer's weapon before being shot dead by another.",Video Shows Carjacking Suspect Being Shot by Officer on Oklahoma City Bus,link,http://abcn.ws/29Smjqz,2016-07-20 03:31:05,1018,230,91,764,26,157,37,20,14
86680728811_10154597852308812,"Video shows wall of dust blamed in chain-reaction crash on Interstate 8 near Casa Grande, Arizona. No one was seriously injured. http://abcn.ws/29Uoy9W","Semi Trucks Crash as Dangerous Dust Blows Near Casa Grande, Ar...",video,https://www.facebook.com/ABCNews/videos/10154597852308812/,2016-07-20 02:58:02,1826,92,907,1107,15,673,6,24,1
86680728811_10154597826353812,"About 250,000 children in northeast Nigeria are severely malnourished and many face death, UNICEF warns.",UNICEF: 134 Nigerian Children Could Die Every Day From Malnutrition Without Aid,link,http://abcn.ws/29LNWN4,2016-07-20 02:34:07,3467,500,918,1023,16,32,7,2148,241
86680728811_10154597779228812,Southern California waters that draw visitors from around the world are off-limits thanks to a multimillion-gallon sewage spill.,Los Angeles-Area Sewage Spill Brings Closure of Popular Beach Waters,link,http://abcn.ws/29SM9Xe,2016-07-20 02:02:56,236,30,109,140,1,37,5,34,19
86680728811_10154597746873812,"Big-name Republicans met to talk about foreign policy at a panel discussion in Cleveland, but there was one name that didn't come up: Donald J. Trump.",Trump's Name Absent When It Comes to Foreign Policy Talk at RNC Panel,link,http://abcn.ws/29KphMg,2016-07-20 01:41:52,385,166,31,236,9,27,101,2,10
86680728811_10154597705353812,"NYPD investigating after shots fired from a moving vehicle at pair of officers, narrowly missing them.","Police: Shots Fired at NYPD Officers, Narrowly Missing Them",link,http://abcn.ws/29SQMET,2016-07-20 01:17:51,1339,118,333,428,3,65,6,259,578
86680728811_10154597662828812,"Texas man's video of himself flying off water slide and falling down a rocky cliff goes viral after he posts clip to Facebook. ""Too dang old to be going down water slides."" http://abcn.ws/29SOaXJ",Texas Man Recovering After Flying Off Water Slide,video,https://www.facebook.com/ABCNews/videos/10154597662828812/,2016-07-20 00:54:34,11389,1699,5622,5112,33,5081,895,233,35
86680728811_10154597624948812,"Melania Trump inspired so many women to snap up the $2,190 dress she wore Monday, the retailer sold out within hours of her appearance.","Pouf, It's Gone: Melania Trump's $2,200 RNC Dress Sells Out",link,http://abcn.ws/2a9qiyu,2016-07-20 00:31:08,2139,1041,138,1490,137,73,362,16,61
86680728811_10154597582258812,"Driver who crashed into patrol car told officers he was distracted by 'Pokemon Go,' Baltimore Police Department reports. http://abcn.ws/2asOZC9",Driver Playing 'Pokemon Go' Crashes Into Baltimore Police Patr...,video,https://www.facebook.com/ABCNews/videos/10154597582258812/,2016-07-20 00:06:59,4854,1038,4670,2525,18,871,1081,86,273
86680728811_10154597492608812,"International Olympic Committee exploring ""legal options"" around whether to ban Russia from the Rio games over a ""shocking"" state-sponsored cover-up of doping by Russian athletes.",IOC Calls for Block on Russia Hosting Sports Events,link,http://abcn.ws/2a5ThBT,2016-07-19 23:41:01,196,15,28,173,4,15,2,0,2
86680728811_10154597445673812,"Moving photo from site of memorial to slain Baton Rouge police officers: ABC News' Lana Zak says boy appeared alone, knelt and then prayed. http://abcn.ws/29TI0DO",Timeline Photos,photo,https://www.facebook.com/ABCNews/photos/a.10150095914943812.286215.86680728811/10154597445673812/?type=3,2016-07-19 23:20:38,13535,141,821,9434,1756,18,5,2314,8
86680728811_10154597419428812,,ABC News Politics,link,http://abcn.ws/2a9DTpy,2016-07-19 23:08:12,184,115,0,130,10,1,30,2,11
86680728811_10154597387468812,"Donald Trump Jr. lit a fire under the Republican National Convention crowd, laying into Hillary Clinton and praising his father as the ""only"" choice for president.",Trump Jr. Rouses Convention Crowd By Bashing Clinton and Praising His Dad,link,http://abcn.ws/2aaK3CM,2016-07-19 22:56:13,1779,556,61,1130,156,19,365,16,93
86680728811_10154597386873812,Experts are questioning a recent pledge of allegiance to ISIS by a purported group of extremists in Brazil in what may be an attempt to rattle the international community before the Rio Olympic Games.,Experts Skeptical of Brazil Group's ISIS Pledge Before Olympics,link,http://abcn.ws/29S10kR,2016-07-19 22:55:48,122,17,23,93,1,10,1,14,3
86680728811_10154597341798812,"BREAKING: Garry Marshall, creator of ""Happy Days"" and director of ""Pretty Woman,"" has died at 81. http://abcn.ws/29MgO7T",Writer-Director Garry Marshall Dies at Age 81,link,http://abcn.ws/29SDUyn,2016-07-19 22:33:42,22268,975,8290,8376,188,662,13,13012,17
86680728811_10154597337098812,"BREAKING: Garry Marshall, creator of ""Happy Days"" and director of ""Pretty Woman,"" has died at 81. http://abcn.ws/29MgO7T",Timeline Photos,photo,https://www.facebook.com/ABCNews/photos/a.10150095914943812.286215.86680728811/10154597337098812/?type=3,2016-07-19 22:32:35,2278,105,657,936,35,54,0,1252,1
86680728811_10154597330233812,"Melania Trump joins Vice President Biden, Rand Paul, Vladimir Putin on list of politicians accused of plagiarism: http://abcn.ws/2a9w5Ew",5 Politicians Who Have Been Accused of Plagiarism,video,https://www.facebook.com/ABCNews/videos/10154597330233812/,2016-07-19 22:30:25,492,276,140,335,5,12,105,6,29
86680728811_10154597292563812,"Mother mourning the loss of her 4-year-old son shares message to parents: ""Go hug your babies right now. Soak in their smell, look at the innocent sparkle in their eyes that is lost somewhere between childhood and adulthood.""",Grieving Mom Pens Advice to Parents After Toddler's Death: 'Hold Your Babies Tight',link,http://abcn.ws/2a9JFVb,2016-07-19 22:10:34,25829,530,3478,14045,1940,33,13,9788,10
86680728811_10154597238218812,"Groups of protesters clashed on Day 2 of the Republican National Convention, as activists butted heads with each other as well as Donald J. Trump supporters.",Protesters Tangle in Cleveland Outside Republican Convention,link,http://abcn.ws/2arXWeQ,2016-07-19 21:45:30,232,109,22,186,2,2,26,3,13
86680728811_10154597229928812,"Dr. Ben Carson: Donald J. Trump understands the need to make blessings of the U.S. ""available to all, not just a privileged few."" abcn.ws/29Ph4Vv",Ben Carson Speaks at the RNC,video,https://www.facebook.com/ABCNews/videos/10154597229928812/,2016-07-19 21:42:38,4468,795,556,3435,360,27,496,22,128
86680728811_10154597191633812,"Chris Christie put on a rollicking show trial of Hillary Clinton, leading Cleveland crowd in shouting ""guilty!"" over and over again.",Christie Stages Raucous Mock Trial of Hillary Clinton at Convention,link,http://abcn.ws/29NcRit,2016-07-19 21:23:41,1492,714,169,950,88,16,200,22,216
86680728811_10154597174688812,"Donald Trump Jr.: ""We will not accept the current state of our country because it's hard to change, that's not the America I know...we're going to put Americans first - all Americans."" abcn.ws/29Ph4Vv",Donald Trump Jr.: 'We're Going to Put America First',video,https://www.facebook.com/ABCNews/videos/10154597174688812/,2016-07-19 21:18:20,4342,664,442,3431,334,18,423,14,122
86680728811_10154597175758812,The 22-year-old daughter of Donald J. Trump and Marla Maples said her father 'brings out the challenge and drive in people.',Tiffany Trump to GOP Convention: My Father's 'Desire for Excellence Is Contagious',link,http://abcn.ws/29SxDTh,2016-07-19 21:18:02,2453,604,56,1842,165,8,383,9,46
86680728811_10154597170943812,500 elephants are being moved by truck and crane to a new sanctuary in Malawi to help protect the threatened species.,500 Elephants Find New Home in Massive African Relocation,link,http://abcn.ws/29RFalh,2016-07-19 21:15:30,2337,61,183,1888,283,138,3,19,6
86680728811_10154597160848812,"Donald Trump Jr. at the RNC: ""When my father says he can fix the country, he means it."" abcn.ws/29Ph4Vv",Donald Trump Jr. Talks About Father at RNC,video,https://www.facebook.com/ABCNews/videos/10154597160848812/,2016-07-19 21:09:54,3315,707,183,2268,238,22,644,16,127
86680728811_10154597155953812,"Donald Trump Jr.: ""For my father, impossible is just the starting point...that's how he approaches life.""  abcn.ws/29Ph4Vv",Donald Trump Jr. Speaks at the RNC,video,https://www.facebook.com/ABCNews/videos/10154597155953812/,2016-07-19 21:08:17,1255,249,401,953,101,3,149,6,43
86680728811_10154597131683812,"Tiffany Trump on her father Donald J. Trump: ""His desire for excellence is contagious...he's always helped me be the best version of myself."" abcn.ws/29Swdbv",Tiffany Trump Says Father Has Always Helped Her,video,https://www.facebook.com/ABCNews/videos/10154597131683812/,2016-07-19 20:55:56,4371,824,266,3182,256,33,775,18,107
86680728811_10154597120788812,"The aunt of Alton Sterling and the father of a slain Baton Rouge police officer met, embraced and prayed together at a growing makeshift memorial.",Alton Sterling's Aunt Prays With Dad of Slain Baton Rouge Cop,link,http://abcn.ws/29ROpSC,2016-07-19 20:49:28,2847,71,241,2106,349,5,1,384,2
86680728811_10154597048103812,Melania Trump supporters have come up with a variety of defenses in wake of allegations she plagiarized portions of speech at the Republican Convention.,'My Little Pony' Among List of Creative Arguments Defending Melania Trump,link,http://abcn.ws/2aaaFUr,2016-07-19 20:18:51,635,258,88,329,17,7,273,2,7
86680728811_10154597024918812,"Donald J. Trump after clinching GOP nomination: ""Together, most importantly, we are going to make America great again...and we will win in November."" abcn.ws/29Ph4Vv",Donald Trump: 'We Will Win in Novemeber',video,https://www.facebook.com/ABCNews/videos/10154597024918812/,2016-07-19 20:09:25,3121,678,201,2092,243,14,218,53,501
86680728811_10154597021948812,"Donald J. Trump to the RNC after clinching the GOP nomination for president: ""I'm so proud to be your nominee."" abcn.ws/29Ph4Vv",Donald Trump to RNC: 'I'm So Proud',video,https://www.facebook.com/ABCNews/videos/10154597021948812/,2016-07-19 20:08:06,1827,326,128,1210,159,6,92,36,324
86680728811_10154596967758812,"David Muir takes you on a 360° tour at the Republican National Convention in Cleveland, OH. http://abcn.ws/29TSoLH",360° Tour of the RNC in Cleveland,video,https://www.facebook.com/ABCNews/videos/10154596967758812/,2016-07-19 19:59:39,139,23,64,119,9,5,5,0,1
86680728811_10154597000553812,"Donald J. Trump is betting on his business experience in hopes of getting voters to believe he can ""Make America Work Again.""",Trump's Business Chops the Focus Ahead of RNC's Economy-Themed Night,link,http://abcn.ws/29N3W0j,2016-07-19 19:55:05,358,200,22,241,19,2,73,2,21
86680728811_10154596969163812,"More than 200 firefighters battle brush fire in Southern California's Hollywood Hills. No homes threatened, according to Los Angeles County Fire Department.",Firefighters Battle Brush Fire in L.A.'s Hollywood Hills,link,http://abcn.ws/29LWyTB,2016-07-19 19:41:03,395,64,160,246,0,83,2,64,0
86680728811_10154596933618812,JUST IN: Senate Majority Leader Mitch McConnell announces Mike Pence is the official Republican Party nominee for vice president. http://abcn.ws/2asdjnW,McConnell Announces Pence as Official GOP VP Nominee,video,https://www.facebook.com/ABCNews/videos/10154596933618812/,2016-07-19 19:22:48,639,162,56,464,41,3,87,10,34
86680728811_10154596919048812,"Airstrikes in northern Syria allegedly led by a U.S.-backed coalition killed at least 56 civilians and injured dozens of others, report finds. Among the casualties were 11 children.",US Coalition Airstrikes Kill 56 Civilians in Syria: Report,link,http://abcn.ws/29KbNA6,2016-07-19 19:16:19,530,264,320,243,3,15,1,172,96
86680728811_10154596903093812,JUST IN: Speaker Paul Ryan announces that Donald J. Trump has officially won the Republican nomination. abcn.ws/29Ph4Vv,Speaker Ryan: Trump Wins GOP Nomination,video,https://www.facebook.com/ABCNews/videos/10154596903093812/,2016-07-19 19:11:10,5479,579,561,3846,431,56,175,221,750
86680728811_10154596865698812,Donald J. Trump's children celebrate as their father clinches the Republican nomination for president. abcn.ws/29Ph4Vv,Photos from ABC News's post,photo,https://www.facebook.com/ABCNews/photos/a.10150095914943812.286215.86680728811/10154596865058812/?type=3,2016-07-19 18:57:46,1631,191,65,1243,137,6,43,23,179
