status_id,status_message,link_name,status_type,status_link,status_published,num_reactions,num_comments,num_shares,num_likes,num_loves,num_wows,num_hahas,num_sads,num_angrys
21898300328_10154866714160329,Steal their secrets and everything you make will get a little bit more delicious.,17 Genius Cooking Tricks That Professional Chefs Want You To Know,link,http://bzfd.it/2apNEjl,2016-07-25 13:01:00,417,49,144,405,11,0,1,0,0
21898300328_10154866692695329,We asked Donald J. Trump supporters to write down a misconception about them and here's what happened.,21 Things Trump Supporters Want Their Haters To Know,link,http://bzfd.it/2a4JwSp,2016-07-25 12:16:00,5397,1369,776,2081,117,102,2456,111,530
21898300328_10154866649830329,"♫ Splish, splash, I was takin' a bath ♫",19 Unique Bath Bombs That'll Make You Feel So Damn Relaxed,link,http://bzfd.it/2a4HFge,2016-07-25 11:30:26,838,132,179,770,65,3,0,0,0
21898300328_10154866401445329,Protect ya neck...from the heat.,13 Natural Hairstyles To Try When The Humidity Is Trying You,link,http://bzfd.it/2alJ7eS,2016-07-25 10:46:00,311,56,33,289,19,2,0,0,1
21898300328_10154863539770329,"Forget all of that ""me as a parent"" stuff — this is you.","18 Pictures That Make You Say ""Literally Me As A Parent""",link,http://bzfd.it/2a2mhsd,2016-07-25 10:01:00,1454,128,432,1150,47,1,256,0,0
21898300328_10154861267875329,When you start having secret meetings in the toilets.,18 Important Milestones That Turn Work Colleagues Into Work BFFs,link,http://bzfd.it/2alIT7v,2016-07-25 09:16:00,1073,1099,535,922,62,1,88,0,0
21898300328_10154863572355329,Aesthetic: Over it.,22 Products Every Slightly Grumpy Person Will Relate To,link,http://bzfd.it/2apEYcK,2016-07-25 08:31:00,3003,426,590,2651,193,0,158,0,1
21898300328_10154860516475329,"If you have to spend all day there, you might as well make it a little homier.",What Should You Get To Make Your Office A Little Nicer?,link,http://bzfd.it/2al8AFd,2016-07-25 07:01:00,620,103,79,593,22,1,4,0,0
21898300328_10154863526630329,A tiny bit more organizing can make a real big difference.,7 Easy Organizing Tricks You'll Actually Want To Try,link,http://bzfd.it/2a2mKdS,2016-07-25 06:01:00,804,40,173,782,20,2,0,0,0
21898300328_10154864160475329,More like DSLOL.,13 Things That'll Help You Take Better Photos With Your Phone,link,http://bzfd.it/2apRrx9,2016-07-25 05:01:00,514,71,106,476,24,12,2,0,0
21898300328_10154863794315329,"Oh hey, Tom Hiddleston and Brie Larson.","Tom Hiddleston And Brie Larson Look Scared As Shit In ""Kong: Skull Island""",link,http://bzfd.it/2apNk3N,2016-07-25 04:01:01,2588,102,104,2436,107,35,10,0,0
21898300328_10154863473580329,Let's get down to ~boob~ business.,We Know What Kind Of Bra You Wear,link,http://bzfd.it/2a2kYsY,2016-07-25 03:01:00,363,109,18,333,4,1,23,0,2
21898300328_10154863958740329,Or make you die from laughter.,The 20 Worst Damn Cosplays You've Ever Seen,link,http://bzfd.it/2apRtEZ,2016-07-25 02:01:00,3765,438,440,2876,76,19,779,5,10
21898300328_10154860507925329,,BuzzFeed Books,link,https://s3.amazonaws.com/hive-binaries/binaries/57e623ad6cb8483099acb108d131b312/ItIsntFair.gif,2016-07-25 01:01:00,14783,816,1,13216,620,4,447,495,1
21898300328_10154863980265329,"""Honey, they don't call it a job for nothing.""",What Do You Actually Do When You Give A Blow Job?,link,http://bzfd.it/2a2BUj6,2016-07-25 00:01:00,1263,314,118,1021,23,13,203,1,2
21898300328_10154863511240329,"Sansa might be in big trouble, guys. SPOILERS AHEAD. // Game of Thrones","Here's Everything We Learned About ""Game Of Thrones"" At Comic-Con",link,http://bzfd.it/2a2m1JG,2016-07-24 23:01:00,3308,309,388,3057,153,75,20,3,0
21898300328_10154863765855329,REMEMBER THE '90s????? REMEMBER?????,20 Witty Tweets About Remembering The '90s,link,http://bzfd.it/2a2wlBq,2016-07-24 22:16:00,1683,67,154,1528,31,2,120,1,1
21898300328_10154865287920329,"An internal memo left in a hotel restaurant details extraordinary demands considered by the Bernie Sanders campaign, including a private plane they wanted the DNC to pay for.",Obtained Memo Shows Bernie Sanders Campaign Debated Whether To Keep Fighting Clinton,link,http://bzfd.it/2a8ZOrY,2016-07-24 22:03:06,1734,455,187,1309,24,124,182,17,78
21898300328_10154863644955329,"Stranger Things pays tribute to many '80s classics, from Firestarter to Stand By Me. *Spoilers!*","23 Totally Rad Films You Should Watch If You Loved ""Stranger Things""",link,http://bzfd.it/2a2r5h9,2016-07-24 21:31:00,5886,1431,1753,5309,534,37,4,1,1
21898300328_10154863574385329,"Everyone: So why don't you believe in God? 
You: Um, hi, nice to meet you.",21 Awkward Situations That'll Make Non-Religious People Cringe,link,http://bzfd.it/2a2orb3,2016-07-24 20:46:00,12510,1202,3518,10357,1077,5,1048,10,13
21898300328_10154863548520329,You are not Nicki Minaj and baggy jean butts are your enemy.,21 Things You'll Only Know If You've Got No Bum And A Lil' Tum,link,http://bzfd.it/2a2n7Vz,2016-07-24 20:01:00,4730,645,1016,3920,257,6,520,26,1
21898300328_10154860661060329,*cringe*,29 Incredibly Concerning Grammar Fails,link,http://bzfd.it/2ajD9hQ,2016-07-24 19:16:00,8249,1349,1506,6369,182,64,1623,9,2
21898300328_10154863576765329,"""Men statistically have larger brains than women, which is why men are usually smarter and elephants rule us all from their laser-hovercraft.""",17 Brain Tweets That Will Make You Laugh And Then Think,link,http://bzfd.it/2a2o7cq,2016-07-24 18:31:00,1132,43,142,953,22,1,156,0,0
21898300328_10154861134035329,It's not exactly the rock 'n' roll lifestyle everyone thinks it is.,28 Secrets Tattoo Artists Will Never Tell You,link,http://bzfd.it/2ajZeNn,2016-07-24 17:46:00,6621,376,948,6269,316,5,29,0,2
21898300328_10154864155305329,Something's coming. // Sherlock,"Time To Freak Out Because The New ""Sherlock"" Trailer Is Here",link,http://bzfd.it/2apY7LC,2016-07-24 17:01:00,22300,3386,4902,18347,2819,1105,24,4,1
21898300328_10154864429345329,Debbie Wasserman Schultz announced she will leave her position after this week's Democratic National Convention in Philadelphia.,DNC Chair Debbie Wasserman Schultz Stepping Down Amid Email Scandal,link,http://bzfd.it/2a2QvLH,2016-07-24 16:16:01,1670,155,154,1396,144,12,103,6,9
21898300328_10154864232940329,"The Olympic accommodation for athletes has blocked toilets, leaking pipes, and water coming down the walls, according to the Australian team.",Rio's Olympic Village Is Apparently One Big Hot Mess,link,http://bzfd.it/2aq0L3T,2016-07-24 15:16:00,4292,474,596,2887,7,633,207,182,376
21898300328_10154863992145329,THIS. IS. IMPORTANT.,Little Girls Went To Comic-Con Dressed As Rey And That's So Important,link,http://bzfd.it/2a2C7D5,2016-07-24 14:31:00,35123,466,2360,30540,4521,13,41,3,6
21898300328_10154863659960329,You get a wand! You get a wand! You get a WAAAAND!,"Eddie Redmayne Gave Thousands Of ""Harry Potter"" Fans Free Wands",link,http://bzfd.it/2a2jUFu,2016-07-24 13:46:00,13962,427,835,11871,1577,388,93,33,0
21898300328_10154860611505329,Color your life.,This Color Test Will Determine What Country You Should Live In,link,http://bzfd.it/2aldv99,2016-07-24 13:01:00,428,73,22,400,21,5,1,1,0
21898300328_10154860849380329,This is the epic meal-time of beauty videos. // Jenna Marbles,Jenna Marbles Put 100 Coats Of Makeup On And It's Fuggin Terrifying,link,http://bzfd.it/2ajMiXG,2016-07-24 12:31:00,22313,3028,3493,17426,799,297,3749,17,25
21898300328_10154863739395329,"THIS IS NOT A DRILL, THIS IS NOT A DRILL.",Brie Larson Is Going To Be Captain Marvel And People Are Freaking Out,link,http://bzfd.it/2apLMXV,2016-07-24 11:46:00,14778,545,1032,12872,1638,243,14,2,9
21898300328_10154863616215329,From the lips of SANSA HERSELF. // Game of Thrones,Sophie Turner Really Doesn't Want Jon Snow And Sansa To Bone,link,http://bzfd.it/2a2q3l7,2016-07-24 11:01:00,4989,348,199,4080,79,19,802,6,3
21898300328_10154863463440329,"""What is revealed now is not a shock to me,"" Bernie Sanders said Sunday.","Sanders ""Outraged"" By Leaked Emails Showing DNC Staffers Criticizing Him",link,http://bzfd.it/2apBB5F,2016-07-24 10:16:00,5470,287,921,3765,25,47,35,483,1115
21898300328_10154860608265329,"Make your own ""pink drink"" right in your kitchen!",29 DIY Starbucks Recipes That Will Save You Tons Of Cash,link,http://bzfd.it/2aldbr3,2016-07-24 09:16:00,1672,268,720,1583,79,9,1,0,0
21898300328_10154860834130329,"Let's be real, your purse is messy enough already.",23 Makeup Bags That Will Make You Feel Like You Have Your Shit Together,link,http://bzfd.it/2ajLEJP,2016-07-24 08:31:00,1992,145,166,1855,83,1,52,1,0
21898300328_10154862167065329,"""Arthur Curry. I hear you can talk to fish."" // Justice League","""Justice League"" Looks Like It Might Actually Be Fun",link,http://bzfd.it/2akKlud,2016-07-24 07:01:00,7161,233,560,6603,454,18,81,0,5
21898300328_10154861208505329,'Cuz the snuggle is real.,17 Cute Summer PJs Every Lazy Girl Will Want To Live In,link,http://bzfd.it/2alG0DE,2016-07-24 06:01:00,1912,170,177,1769,129,3,11,0,0
21898300328_10154861271855329,"The photo is funny enough, but the caption is even better. // Margot Elise Robbie",Margot Robbie Made Fun Of Herself On Instagram And You'll Love Her More For It,link,http://bzfd.it/2alJfeh,2016-07-24 05:01:00,8128,159,236,7222,435,2,465,2,2
21898300328_10154861292785329,The queen has arrived. // Celine Dion,You Need To Watch Celine Dion Do Kickass Impressions Of Cher And Sia,link,http://bzfd.it/2alK86G,2016-07-24 04:01:00,4017,305,399,3399,345,11,261,0,1
21898300328_10154858301645329,Are you more of a Tiffani or a Snape?,Which One Of These Weird Dogs Are You?,link,http://bzfd.it/2amp3Mg,2016-07-24 03:01:00,565,192,81,498,19,1,46,1,0
21898300328_10154860854555329,We take a look at the true events that inspired some of the biggest horror movies. Obviously this post contains spoilers and disturbing images.,"9 ""True"" Horror Movies Vs The Real Stories They're Based On",link,http://bzfd.it/2ajMqGL,2016-07-24 02:01:00,5578,1782,2191,5108,131,312,20,6,1
21898300328_10154861313290329,,Obsessed,photo,https://www.facebook.com/BuzzFeedObsessed/photos/a.282328088767711.1073741828.280467515620435/310594662607720/?type=3,2016-07-24 01:01:00,73917,1173,1,58908,2637,30,12336,2,4
21898300328_10154861129325329,We do not condone any of this behavior.,Six Weird Things Celebrities Have Told Us To Do To Our Vaginas,link,http://bzfd.it/2ajYlEp,2016-07-24 00:01:00,1279,176,123,1081,13,50,134,1,0
21898300328_10154860654185329,You're gonna want to grab some tissues for this one. // Dawson's Creek,"17 Moments That'll Still Make Every ""Dawson's Creek"" Fan Emotional",link,http://bzfd.it/2amwRxz,2016-07-23 23:01:01,2828,723,883,2198,395,1,6,228,0
21898300328_10154860814880329,Life is a contest and I'm in it to win it.,24 Things All Secretly Competitive People Know To Be True,link,http://bzfd.it/2ajKQ7O,2016-07-23 22:16:00,2878,667,827,2520,107,1,249,1,0
21898300328_10154860757105329,"""HANGOVER LEVEL: I'm still in bed and there are no more Instagrams left. I've looked at all of Instagram.""",21 Tweets About Being In Your Mid-Twenties That Will Make You Lol-Cry,link,http://bzfd.it/2ajHGRt,2016-07-23 21:31:00,8742,663,1010,7800,204,2,734,2,0
21898300328_10154860753210329,There are some wild people in this world.,21 Totally Fucked Up Ways People Actually Eat Food,link,http://bzfd.it/2ajHKAA,2016-07-23 20:46:00,769,322,173,619,7,35,85,4,19
21898300328_10154860721355329,"Ah, my head is an armrest again. Brilliant.",17 Things Only Girls Under 5'3 Know To Be True,link,http://bzfd.it/2ajx30E,2016-07-23 20:01:00,6759,960,3031,5826,217,5,700,10,1
21898300328_10154861616880329,I see a House-elf! // Fantastic Beasts Movie,"The New ""Fantastic Beasts"" Trailer Shows Us Lots Of Magical Creatures",link,http://bzfd.it/2aklPt3,2016-07-23 19:16:00,13759,828,2308,11699,1789,263,5,2,1
21898300328_10154860524920329,"""My bucket list is basically a list of places I want to eat.""",19 Funny Tweets About Food That Are So Damn Real It Hurts,link,http://bzfd.it/2al90eT,2016-07-23 18:31:00,2843,361,386,2453,75,1,313,1,0
21898300328_10154861596170329,"""Be careful, Diana. They do not deserve you."" // Wonder Woman","The ""Wonder Woman"" Trailer Is Here And It's Wonderfully Epic",link,http://bzfd.it/2alYsMy,2016-07-23 17:46:00,15983,1024,4109,13352,2195,424,7,3,2
21898300328_10154861238630329,"""Will I be there for 5 minutes? 5 hours? Will I spend $5? $500?"" // Target",21 Tweets About Target That Will Make You Laugh Out Loud,link,http://bzfd.it/2alHldP,2016-07-23 17:01:00,8189,1814,2710,6855,448,4,880,1,1
21898300328_10154860506860329,*shakes from nostalgic sugar high*,"We Tried Crystal Pepsi From The '90s, And This Is What Happened",link,http://bzfd.it/2al8htP,2016-07-23 16:16:00,687,136,99,630,23,3,31,0,0
21898300328_10154858272880329,,SOML,video,https://www.facebook.com/SOML/videos/911138162363932/,2016-07-23 15:46:00,3638,68,0,2974,348,14,2,265,35
21898300328_10154861158240329,"We can dream, though. We can dream. // Bernie Sanders","No, Bernie Sanders Doesn't Have A Photo Of Harambe In His Living Room",link,http://bzfd.it/2ajYWWt,2016-07-23 15:16:00,678,82,22,526,7,1,133,10,1
21898300328_10154860783190329,The restaurant owner thought it was all a joke at first.,This 110-Year-Old Lobster Was Moments Away From Becoming Dinner,link,http://bzfd.it/2aln9IR,2016-07-23 14:31:00,7494,362,823,6246,526,567,46,85,24
21898300328_10154861103325329,Dean Eastmond was told by the NHS that if he died his partner would not be allowed to use his frozen sperm sample to have a child because they were in a same-sex relationship.,This Gay Cancer Patient Was Told Fertility Treatment Was Only For Straight People,link,http://bzfd.it/2ajWTBL,2016-07-23 13:46:00,9062,168,629,2418,39,183,27,1906,4489
21898300328_10154858302565329,Are you sorta serious or SUPER serious?,How Serious Is Your Relationship Actually?,link,http://bzfd.it/2amppCv,2016-07-23 13:01:00,548,272,55,494,27,3,17,6,1
21898300328_10154857977530329,"Crywolf, an independent Toronto store, says its lapel pin design was taken without permission by ZARA.",These Independent Designers Say They Were Also Ripped Off By Zara,link,http://bzfd.it/29YXmps,2016-07-23 12:16:00,2576,107,235,1804,11,128,4,55,574
21898300328_10154860586605329,I'm not o-fucking-kay. // My Chemical Romance,My Chemical Romance Are Not Reuniting And Fans Are Not Happy,link,http://bzfd.it/2alcPRa,2016-07-23 11:31:00,5761,795,992,3907,19,36,152,1210,437
21898300328_10154860503755329,"Guys, ""benevolent"" is a really hard word to say. // Game of Thrones","The ""Game Of Thrones"" Season 6 Bloopers Are Here And They Are So Good",link,http://bzfd.it/2al89e6,2016-07-23 10:46:00,11694,1548,2470,9354,555,11,1769,3,2
21898300328_10154858266690329,The collection comes in sizes 10-20 and is available now.,We Tried Ashley Graham's New Plus-Size Swimsuits And They're Fierce AF,link,http://bzfd.it/29Z7Zsb,2016-07-23 10:01:01,3909,201,236,3467,412,19,5,2,4
21898300328_10154858544170329,"Don't say it will ""all be OK,"" because that just makes it definitely NOT OK.",21 Truths All Anxious People Will Understand,link,http://bzfd.it/2amzUpy,2016-07-23 09:16:00,11076,901,3945,9835,500,6,708,25,2
21898300328_10154858455190329,We really have seen it all. Quite literally.,21 Brutally Honest Confessions From A Midwife,link,http://bzfd.it/29ZgOlS,2016-07-23 08:31:00,9430,958,1843,7623,1640,143,10,14,0
21898300328_10154858452500329,"From cleansing oils to sleeping masks to bunny-shaped lip glosses, these Korean products are the real deal.",18 Highly-Rated Korean Beauty Products You Can Buy On Amazon,link,http://bzfd.it/29ZgyTH,2016-07-23 07:01:00,7021,1093,2045,6491,471,53,5,1,0
21898300328_10154858495325329,Inspiring ink from the small and minimalist to the big and colorful.,34 Tattoos That Beautifully Reclaim Self-Harm Scars,link,http://bzfd.it/29Zi4oP,2016-07-23 06:31:00,7401,257,1278,6149,1206,28,4,12,2
21898300328_10154858230215329,"Stay cool, my friends.",23 Tried-And-True Products To Make Summer Better,link,http://bzfd.it/29Z7a2D,2016-07-23 06:01:00,748,43,115,730,18,0,0,0,0
21898300328_10154858282860329,STAY WOKE,"Here's Why Some People Are Convinced Kim, Kanye, and Taylor Are All Illuminati",link,http://bzfd.it/29Z8YZm,2016-07-23 05:01:00,1046,492,137,826,19,8,187,0,6
21898300328_10154858252510329,"The pictures are the latest in a string of banners that the people of the city of Kanfrabel have sent into the world, trying to draw attention to the plight of Syrians.",These Syrian Children Are Hoping That Pokémon Will Finally Bring The Help They Need,link,http://bzfd.it/29Z83YY,2016-07-23 04:01:00,2480,50,378,1416,59,6,4,994,1
21898300328_10154857850585329,Next tattoo or first tattoo.,The First Word You See Should Be Your Next Tattoo,link,http://bzfd.it/2am7qw1,2016-07-23 03:01:01,490,687,191,450,12,2,25,0,1
21898300328_10154857943315329,Because it's the fucking worst.,17 Reasons Swimming In The Ocean Is Actually The Worst,link,http://bzfd.it/29YWEbq,2016-07-23 02:01:00,3925,1049,1130,3221,83,12,604,0,5
21898300328_10154858322365329,,Cocoa Butter,photo,https://www.facebook.com/Cocoa.Butter/photos/a.675980592533282.1073741828.667406426724032/843309562467050/?type=3,2016-07-23 01:01:00,1899,85,0,1639,20,2,234,4,0
21898300328_10154857951180329,Because there's more than one way to rub one out.,23 Ways To Make Jerking Off Even Better,link,http://bzfd.it/29YWQrt,2016-07-23 00:01:00,2200,869,495,1785,41,43,323,2,6
21898300328_10154858472690329,Remember when there was a movie about a lady who left her fiancé for a bee? // Bee Movie,"For Everyone Who Still Can't Believe ""Bee Movie"" Is Real",link,http://bzfd.it/29ZhJm8,2016-07-22 23:01:00,16470,2729,2064,13582,323,53,2495,7,10
21898300328_10154858546620329,"Because if you didn't Snapchat it, did it even really happen?",24 Times Snapchat Was A Goddamn Gift To The Internet,link,http://bzfd.it/29ZiHyO,2016-07-22 22:16:00,29559,2830,4871,24054,523,18,4957,3,4
21898300328_10154858345125329,Building character one letter at a time.,17 People Who Succeeded In Life Despite Having Super Awkward Names,link,http://bzfd.it/29ZbzlX,2016-07-22 21:31:00,2437,689,650,1803,46,9,578,1,0
21898300328_10154858314760329,What the hell is going on here?,"17 Pictures That Will Make You Say ""Um, What?""",link,http://bzfd.it/29Z9VAL,2016-07-22 20:46:00,3636,399,590,2651,39,5,939,1,1
21898300328_10154858234445329,"Mom: ""Do you want this?"" Me: ""No."" Mom: ""Ok I'll give it to your brother."" Me: ""No I want it.""",19 Tweets About Siblings That Will Make You Laugh Or Cry Or Both,link,http://bzfd.it/29Z7kXG,2016-07-22 20:01:00,6927,953,1453,5642,119,3,1158,4,1
21898300328_10154859010250329,Hillary Clinton announced the decision in a text message to supporters late on Friday (via BuzzFeed News),Hillary Clinton Picks Virginia Senator Tim Kaine As Her Running Mate,link,http://bzfd.it/2amUiGK,2016-07-22 19:17:21,2121,177,147,1776,142,23,19,80,81
21898300328_10154858257625329,"Use snapchat for good, not evil.",14 Perfect Alternatives To Sending A Dick Pic,link,http://bzfd.it/29Z8jHq,2016-07-22 17:46:01,17611,1167,1579,15344,1561,13,691,0,2
