status_id,status_message,link_name,status_type,status_link,status_published,num_reactions,num_comments,num_shares,num_likes,num_loves,num_wows,num_hahas,num_sads,num_angrys
5550296508_10155073239626509,U.S. Senator Tim Kaine was born in the midwest and then elected to office in the south. He was an early Obama supporter and is now Hillary Clinton's running mate.,Who is Tim Kaine?,link,http://cnn.it/2ai9t4t,2016-07-22 20:05:06,3357,845,276,2789,332,11,70,13,142
5550296508_10155073130146509,"""I'm thrilled to announce my running mate, @TimKaine, a man who's devoted his life to fighting for others. -H,"" Hillary Clinton tweets.",Hillary Clinton selects Tim Kaine as her running mate,link,http://cnn.it/2ai479n,2016-07-22 19:27:56,4865,852,702,4132,390,23,214,27,79
5550296508_10155073118406509,Hillary Clinton chooses U.S. Senator Tim Kaine as her vice presidential running mate. http://cnn.it/2ai479n,,video,https://www.facebook.com/cnn/videos/10155073118406509/,2016-07-22 19:25:48,2917,668,295,2381,274,18,163,11,70
5550296508_10155073106766509,"BREAKING: Hillary Clinton has chosen U.S. Senator Tim Kaine of Virginia to be her running mate, turning to a steady and seasoned hand in government to fill out the Democratic ticket.",Hillary Clinton selects Tim Kaine as her running mate,link,http://cnn.it/2a6Z4Xc,2016-07-22 19:20:34,6766,1174,1183,5631,644,42,274,42,133
5550296508_10155072947561509,"Hillary Clinton slammed Donald J. Trump during a campaign appearance in Florida, characterizing his Republican convention speech as arrogant and dark: ""I can't really imagine him on a white horse, but that seems to be what he is telling us: I alone can fix it."" http://cnn.it/29Ut05s",Clinton rips Trump speech,video,https://www.facebook.com/cnn/videos/10155072947561509/,2016-07-22 17:52:07,8622,3164,969,6911,744,34,532,18,383
