status_id,status_message,link_name,status_type,status_link,status_published,num_reactions,num_comments,num_shares,num_likes,num_loves,num_wows,num_hahas,num_sads,num_angrys
5550296508_10155061551756509,"Thanks in part to these images and a petition, a Chinese aquarium that PETA once called ""the saddest zoo in the world"" has agreed to redesign its facilities http://cnn.it/2a09fgk",Tragic images of aquarium's bear leads to change,video,https://www.facebook.com/cnn/videos/10155061551756509/,2016-07-20 08:46:01,5023,257,629,2430,40,19,4,1557,973
5550296508_10155060098951509,"Found: 3,000-year-old lost world",History made: An astonishing Bronze Age discovery,link,http://cnn.it/29UiECA,2016-07-20 07:51:28,4391,137,879,3887,133,366,4,0,1
5550296508_10155060049856509,"Wally the whale -- or its carcass, rather -- just keeps making it back to shore.","Giant whale carcass cut up, moved from beach to landfill",link,http://cnn.it/29UgJxw,2016-07-20 07:34:54,566,89,43,453,5,28,1,77,2
5550296508_10155060008091509,"Kellogg has been told to stop running two ads in the U.K. that claim Special K is ""full of goodness"" and ""nutritious.""",Special K ads banned over health benefits claims,link,http://cnn.it/29TXPqG,2016-07-20 07:20:02,649,75,81,564,9,19,56,0,1
5550296508_10155059998096509,"Britain's impending exit from the European Union will loom large over the working dinner between the two leaders,","May, Merkel to meet during new British Prime Minister's first foreign trip",link,http://cnn.it/29UexX0,2016-07-20 07:14:33,314,56,24,302,3,0,8,0,1
5550296508_10155058885801509,"We've identified three types at the Republican National Convention: the Trump all-in, the anti-Trumper, and the okay-fine-I'll-vote-for-him. http://cnn.it/29ZaVXl",The three types of Republicans at the convention,video,https://www.facebook.com/cnn/videos/10155058885801509/,2016-07-20 06:51:00,596,352,70,366,3,5,177,13,32
5550296508_10155059922786509,At least one Republican senator thinks the calls for Hillary Clinton to be imprisoned are going one step too far.,GOP senator: Prison for Clinton is 'jumping the shark',link,http://cnn.it/29ZX17w,2016-07-20 06:48:03,1902,671,87,1681,67,11,112,4,27
5550296508_10155059856326509,"""The only thing that keeps us going is that we had 20 incredible years with our son.""

Conrad and Paola Leslie, the parents of Nicholas Leslie, the UC Berkeley student who died in the Nice attack, speak out on CNN. http://cnn.it/29ZTIgy

Correction: An earlier post misspelled the name of victim Nicolas Leslie.",Parents of American Student Killed In Nice Speak Out,video,https://www.facebook.com/cnn/videos/10155059856326509/,2016-07-20 06:19:58,3323,252,222,1271,112,4,2,1922,12
5550296508_10155059796506509,"Gavin Long, the man who shot six law enforcement officers in Baton Rouge, Louisiana -- killing three -- suffered from post-traumatic stress disorder, a source involved in the investigation told CNN.","Gavin Long suffered from PTSD, source tells CNN",link,http://cnn.it/29ZQMAE,2016-07-20 05:48:01,1309,1613,531,825,9,27,60,227,161
5550296508_10155059770276509,Biofuel-powered commercial flights have debuted in Africa.,Tobacco-fueled jets take off in South Africa,link,http://cnn.it/29TZRqI,2016-07-20 05:32:58,1256,96,304,1136,29,78,12,0,1
5550296508_10155059677396509,It all started with a golf game.,How Mike Pence went from golf partner to running mate in two weeks,link,http://cnn.it/29ZKdOk,2016-07-20 04:50:53,543,217,37,429,16,4,72,4,18
5550296508_10155059636141509,"A Bosnian nongovernmental agency is urging Pokemon Go users to be aware of their surroundings, for a good reason...",Pokemon Go players at risk of landmines in Bosnia,link,http://cnn.it/29ZGVe9,2016-07-20 04:26:50,963,132,288,708,6,98,120,26,5
5550296508_10155058842131509,"Watch out, ""Make America Great Again.""",The RNC's unofficial slogan: 'Lock her up',link,http://cnn.it/29Z9isG,2016-07-20 04:13:00,1317,822,100,850,94,16,115,12,230
5550296508_10155058765721509,"Donald J. Trump's youngest daughter, Tiffany, stepped into the campaign spotlight when she addressed the delegates at the Republican National Convention. See her full speech. http://cnn.it/29Td0jY",Tiffany Trump's entire Republican convention speech,video,https://www.facebook.com/cnn/videos/10155058765721509/,2016-07-20 03:02:00,1945,770,247,1475,141,7,279,5,38
5550296508_10155059443271509,"With Donald J. Trump officially his party's nominee for U.S. President, here's a recap of the big moments from the second day of the Republican National Convention, in 90 seconds.

http://cnn.it/2a83rjZ",Day 2: Tuesday at the RNC in 90 seconds,video,https://www.facebook.com/cnn/videos/10155059443271509/,2016-07-20 02:44:54,1864,425,243,1271,116,11,201,48,217
5550296508_10155059404381509,"""Surplus"" elephants are being transported to a park where the threatened species have been wiped out by poachers.",Malawi to relocate 500 elephants in man-made migration,link,http://cnn.it/29TCX31,2016-07-20 02:16:57,641,82,55,435,7,8,2,95,94
5550296508_10155058677741509,The car chase  ended in a violent arrest caught on live television.,Officers charged over arrest caught on camera,link,http://cnn.it/29Z3OOG,2016-07-20 02:09:00,1356,631,430,1057,33,68,19,22,157
5550296508_10155059360476509,Did Donald Trump Jr. plagiarize parts of his speech too? His speechwriter says no.,Speechwriter defends Donald Trump Jr.'s words,link,http://cnn.it/29TzVvy,2016-07-20 01:52:01,1668,1055,199,985,24,30,527,6,96
5550296508_10155058669336509,Meanwhile...,Clinton closes in on VP choice,link,http://cnn.it/29Z3xeH,2016-07-20 01:52:00,1155,506,53,1024,61,6,13,2,49
5550296508_10155059318316509,Hate long airplane rides? Try an inflight sleeping cocoon.,These are the airline cabins of the future,link,http://cnn.it/29ZqGxy,2016-07-20 01:30:56,12766,509,1931,11083,741,897,38,2,5
5550296508_10155059282436509,"Turkey's government has now fired or suspended around 50,000 people following a failed coup over the weekend, as it intensifies its vast purge.","Turkey post-coup crackdown nets 50,000 people",link,http://cnn.it/29TwxAM,2016-07-20 01:10:01,621,104,99,529,3,44,15,15,15
5550296508_10155059225651509,Experts believe the United States maintains 50 nuclear weapons in Turkey -- but are they secure?,How safe are U.S. nukes in Turkey?,link,http://cnn.it/29TuDQB,2016-07-20 00:45:02,896,256,219,724,5,101,36,11,19
5550296508_10155059148596509,Authorities are investigating ISIS' claim of responsibility in the attack on German train passengers by a 17-year-old wielding an ax and a knife.,What drove teen to attack passengers on German train?,link,http://cnn.it/29TrY9K,2016-07-20 00:18:26,402,204,58,290,1,10,3,36,62
5550296508_10155058672841509,"Mojo was ""overcome by the heat"" while helping serve a felony warrant.",Police dog dies after search for suspect,link,http://cnn.it/29Z3O11,2016-07-20 00:08:00,1166,139,80,409,6,5,2,612,132
5550296508_10155059096971509,"Two nights down, two nights to go. Here's what to watch for.",An updated guide to the 2016 Republican convention,link,http://cnn.it/29Tq2Oe,2016-07-19 23:56:53,243,137,22,206,4,1,14,1,17
5550296508_10155059045116509,"Garry Marshall created some of the most popular 1970s TV shows -- including ""Mork and Mindy"" and ""Happy Days."" He also directed hit films like ""Pretty Woman"" and The Princess Diaries.","Garry Marshall, 'Happy Days' creator and 'Pretty Woman' director, dies at 81",link,http://cnn.it/29ZfUaC,2016-07-19 23:22:27,2734,148,993,1387,78,14,1,1254,0
5550296508_10155058837626509,"Founder of ""American Muslims for Trump"" offers prayers for Donald J. Trump to close out night 2 of the Republican National Convention. http://cnn.it/29Z1pDx",'American Muslims for Trump' prays for Donald Trump,video,https://www.facebook.com/cnn/videos/10155058837626509/,2016-07-19 22:50:00,4705,2176,2231,3041,159,159,842,43,461
5550296508_10155058789611509,"""I'm not politically correct and I hate political correctness."" - Dr. Ben Carson at the Republican National Convention. http://cnn.it/29TfApW","Ben Carson: ""I'm not politically correct""",video,https://www.facebook.com/cnn/videos/10155058789611509/,2016-07-19 22:38:00,2995,905,342,2242,245,21,358,19,110
5550296508_10155058823176509,"Dr. Ben Carson suggests at the Republican National Convention that Hillary Clinton's role model ""acknowledges Lucifer."" http://cnn.it/29Tfr6e",Ben Carson says Hillary Clinton acknowledges Lucifer,video,https://www.facebook.com/cnn/videos/10155058823176509/,2016-07-19 22:30:00,3090,1244,744,1910,163,66,594,22,335
5550296508_10155058758751509,"""For my father, impossible is just the starting point."" - Donald Trump Jr. at the Republican National Convention. http://cnn.it/29ZcHYI",Donald Trump Jr. on his father's tenacity,video,https://www.facebook.com/cnn/videos/10155058758751509/,2016-07-19 22:20:00,1331,527,128,893,141,6,113,9,169
5550296508_10155058681696509,"Tiffany Trump, Donald J. Trump's youngest daughter, on what it's like to introduce friends to her dad. http://cnn.it/29Z1pDx",Tiffany Trump speaks out about her father,video,https://www.facebook.com/cnn/videos/10155058681696509/,2016-07-19 22:08:00,4590,1498,438,3132,273,34,995,21,135
5550296508_10155058661761509,Governor Chris Christie makes appeal to Americans watching the Republican convention at home in their living rooms. http://cnn.it/29Tf23m,"Chris Christie makes his ""case"" against Hillary Clinton",video,https://www.facebook.com/cnn/videos/10155058661761509/,2016-07-19 21:40:00,1613,799,157,1078,124,7,256,10,138
5550296508_10155058643921509,"Crowd at Republican National Convention chants, ""Lock her up! Lock her up!"" as NJ Governor Chris Christie makes the ""case"" against Hillary Clinton. http://cnn.it/29T9u93","""Lock her up!"" RNC crowd chants against Hillary Clinton",video,https://www.facebook.com/cnn/videos/10155058643921509/,2016-07-19 21:34:00,2826,1128,553,1844,253,26,169,31,503
5550296508_10155058601081509,"Bourbon! Pens! Spam! At the Republican National Convention, delegations have a tradition of offering a few interesting facts about their state before they vote. Here's a sampling. http://cnn.it/29Z1RC3",The things that Republicans shared about their states,video,https://www.facebook.com/cnn/videos/10155058601081509/,2016-07-19 21:20:00,354,120,48,262,11,4,52,4,21
5550296508_10155058592711509,"Speaker Paul Ryan says next week's Democratic convention — ""a four-day infomercial of politically correct moralizing"" — will serve as a reminder of everything that's at sake in this election. http://cnn.it/29Z1pDx",Paul Ryan says America is ready to move on,video,https://www.facebook.com/cnn/videos/10155058592711509/,2016-07-19 21:10:00,1478,607,126,942,62,20,211,10,233
5550296508_10155058550001509,"""Good evening. Are you having fun?"" Donald J. Trump addresses the Republican National Convention from Trump Tower New York. http://cnn.it/29Z06EQ",Trump addresses RNC in video address,video,https://www.facebook.com/cnn/videos/10155058550001509/,2016-07-19 20:52:00,2856,944,323,1829,160,9,317,46,495
5550296508_10155058537931509,"NRA lobbyist: ""A Hillary Clinton Supreme Court means your right to own a firearm is gone."" http://cnn.it/29YWFhu",NRA lobbyist warns against Hillary Clinton,video,https://www.facebook.com/cnn/videos/10155058537931509/,2016-07-19 20:35:00,2922,1522,622,1644,57,37,652,15,517
5550296508_10155058496896509,"Arkansas's attorney general suggests Hillary Clinton's Arkansas accent isn't ""real.""  http://cnn.it/29YWFhu",Arkansas attorney general says Clinton's accent isn't real,video,https://www.facebook.com/cnn/videos/10155058496896509/,2016-07-19 20:20:00,2215,1103,331,1124,71,39,689,19,273
5550296508_10155058551126509,Experience the convention floor during tonight's #GOPConvention #RNCinCLE,,video,https://www.facebook.com/cnn/videos/10155058551126509/,2016-07-19 20:11:13,2272,1193,142,1533,113,40,78,41,467
5550296508_10155058483531509,"Arkansas Attorney General Leslie Rutledge on Hillary Clinton potentially becoming the first female U.S. president: ""I broke a glass ceiling. I know the importance of doing so. But a historical milestone need not come at the expense of America.""",Arkansas attorney general says Clinton's 'historical milestone...,video,https://www.facebook.com/cnn/videos/10155058483531509/,2016-07-19 20:05:00,3688,803,423,2783,237,21,132,16,499
5550296508_10155058467416509,South Dakota delegate facepalms as his state announces its votes for Donald J. Trump. http://cnn.it/29YWFhu,Delegate facepalms as Trump votes are announced,video,https://www.facebook.com/cnn/videos/10155058467416509/,2016-07-19 19:50:00,29904,2223,14258,17586,1567,118,10397,110,126
5550296508_10155058461671509,"UFC president Dana White on Donald J. Trump: ""I know fighters. Donald Trump is a fighter and I know he will fight for this country."" http://cnn.it/29YWFhu",UFC president says Trump is a 'fighter',video,https://www.facebook.com/cnn/videos/10155058461671509/,2016-07-19 19:36:49,7034,2000,1256,4593,273,72,1232,67,797
5550296508_10155058409561509,"JUST IN: Speaker Paul Ryan announces Donald J. Trump ""has been selected as the Republican party nominee for President of the United States."" http://cnn.it/29YTUNc",Paul Ryan says Trump is the Republican party nominee,video,https://www.facebook.com/cnn/videos/10155058409561509/,2016-07-19 19:23:00,12389,1921,2905,7332,731,195,658,1536,1937
5550296508_10155058390726509,Donald Trump Jr. tears up while talking about his father's win as the official Republican Nominee for President. http://cnn.it/29YSt1h,Donald Trump Jr. says his father is one of a kind,video,https://www.facebook.com/cnn/videos/10155058390726509/,2016-07-19 19:15:00,1775,516,251,1145,128,18,193,52,239
5550296508_10155058376396509,JUST IN: Alaska delegate raises issue with the votes recorded for his state http://cnn.it/29YSt1h,Alaska delegate questions the results,video,https://www.facebook.com/cnn/videos/10155058376396509/,2016-07-19 18:58:15,2534,395,434,1848,113,78,413,21,61
