status_id,status_message,link_name,status_type,status_link,status_published,num_reactions,num_comments,num_shares,num_likes,num_loves,num_wows,num_hahas,num_sads,num_angrys
5550296508_10155067246531509,About 200 protesters are marching in Cleveland around the GOP convention site.,RNC protesters,video,https://www.facebook.com/cnn/videos/10155067246531509/,2016-07-21 13:21:45,4461,3426,543,3480,515,41,108,28,289
5550296508_10155067230096509,"When this astronomer tweeted out some galaxy maps, he wasn't expecting for them to lead to a new way of looking at the Milky Way.",'X' shape in Milky Way confirmed via Twitter,link,http://cnn.it/29Y1Nys,2016-07-21 13:15:33,475,47,65,441,3,25,6,0,0
5550296508_10155067131286509,"""It's not a game when you're behind the wheel of a 2,000-pound vehicle."" Video shows a driver distracted by Pokemon Go plow his car into a parked police cruiser http://cnn.it/29XVGdK",Pokemon Go player crashes into cop car,video,https://www.facebook.com/cnn/videos/10155067131286509/,2016-07-21 12:37:39,2841,645,2191,1697,19,369,522,55,179
5550296508_10155067009811509,Young Republicans: 17-year old delegate Jace Laquerre and 18-year old Tanner Goldsmith are live in Cleveland with CNN's Jeremy Diamond. Ask your questions!,GOP teenagers answer your questions,video,https://www.facebook.com/cnn/videos/10155067009811509/,2016-07-21 12:03:21,2348,1992,230,1879,110,26,104,32,197
5550296508_10155067012286509,Peter Thiel is set to admonish the GOP for refusing to embrace LGBT rights on stage at the convention,Peter Thiel to tell RNC he's proudly gay,link,http://cnn.it/29XQOVQ,2016-07-21 11:55:03,1264,402,136,1058,96,55,40,4,11
5550296508_10155066797966509,"There's beating a video game, and then there's stumping the game's creators as to how you did it. Billy Mitchell did just that to the creators of PAC-MAN by getting a perfect score in 1999. Now, he's the ""video game player of the century."" He explained to Great Big Story just how he did it all…",Great Big Story,video,https://www.facebook.com/greatbigstory/videos/1570598163242611/,2016-07-21 11:30:14,1562,162,0,1325,51,166,17,1,2
5550296508_10155066800771509,"Joey LeMar, a.k.a. DEADLEE, embraces all the signifiers of being a cholo rapper, while also being open and proud of his homosexuality. As he explained to Great Big Story, honesty is the realest policy.",Great Big Story,video,https://www.facebook.com/greatbigstory/videos/1570803923222035/,2016-07-21 10:50:45,306,130,0,252,24,9,19,0,2
5550296508_10155066764226509,"BREAKING: Brazilian police have arrested 10 people suspected of planning terrorist acts during the Olympics, Brazil's Justice Ministry says.",BREAKING: Brazilian police arrest 10 suspected of planning terrorist acts during Olympics,link,http://cnn.it/29XBYPm,2016-07-21 10:27:41,2000,170,582,1516,11,269,7,44,153
5550296508_10155066669896509,Here's how Democrats on Capitol Hill responded to House Speaker Paul Ryan's selfie with a group of interns.,Democrats' diverse interns respond to Paul Ryan's #SpeakerSelfie,link,http://cnn.it/29Xx8Br,2016-07-21 09:57:31,3723,696,402,2833,371,46,418,22,33
5550296508_10155066619296509,"Join the new CNN Africa Facebook page for the latest news, sights and sounds from the continent",CNN Africa,video,https://www.facebook.com/CNNAfrica/videos/1402389136444716/,2016-07-21 09:40:52,489,53,0,459,25,4,1,0,0
5550296508_10155066533211509,"""As long as I've got my hands up, they're not gonna shoot me, that's what I'm thinking... Wow, was I wrong.""

Charles Kinsey said he was lying in the middle of the street with his arms raised high when police shot him in the leg.",Lawyer: Man shot by cops while lying down with hands up,link,http://cnn.it/2a2SvVL,2016-07-21 09:15:32,13888,2625,5521,5182,27,507,66,2240,5866
5550296508_10155066458846509,This man has been impersonating Donald J. Trump for 12 years. And it's finally paying off. http://cnnmon.ie/29Y2NCY,Meet the highest-paid Trump impersonator,video,https://www.facebook.com/cnn/videos/10155066458846509/,2016-07-21 08:53:48,2912,309,777,2018,74,14,795,4,8
5550296508_10155066389521509,"Ted Cruz on Donald J. Trump: ""I am not in the habit of supporting people who attack my wife and attack my father"" http://cnn.it/2a2RpsY",,video,https://www.facebook.com/cnn/videos/10155066389521509/,2016-07-21 08:35:01,31961,5378,7638,27697,2255,174,1472,55,309
5550296508_10155065450926509,In their faces and their boos… the moment the RNC turned on Ted Cruz  http://cnn.it/2a2IFmy,When the RNC turned on Ted Cruz,video,https://www.facebook.com/cnn/videos/10155065450926509/,2016-07-21 08:00:39,2758,1041,563,1850,191,30,617,14,56
5550296508_10155065204551509,Watch the first lady rock out to Beyoncé with James Corden. http://cnn.it/2a2Gr6U,Michelle Obama jams to 'Carpool Karaoke,video,https://www.facebook.com/cnn/videos/10155065204551509/,2016-07-21 07:33:27,103928,3109,35336,87619,11816,2311,1967,45,172
5550296508_10155065129116509,Donald J. Trump  last month forgave more than $47 million in loans he made to his own campaign committee,FEC report: Trump forgives $47 million in loans,link,http://cnn.it/29X659w,2016-07-21 07:03:48,1590,582,186,1071,47,46,277,4,145
5550296508_10155064978446509,"Heavyweight champ Anthony Joshua consumes about  3,600 calories daily.

His breakfast:
-Five poached eggs
-Porridge
-A bowl of fruit
-Two cups of yogurt",Want to eat like heavyweight champion Anthony Joshua?,link,http://cnn.it/29WWRdn,2016-07-21 05:58:02,497,120,48,457,11,26,2,1,0
5550296508_10155064919931509,Donald J. Trump will accept the Republican nomination for president on Thursday night. Here's a look back at 28 years of nomination acceptances in 90 seconds. http://cnn.it/2a2scPj,28 years of nomination acceptances in 90 seconds,video,https://www.facebook.com/cnn/videos/10155064919931509/,2016-07-21 05:37:05,668,230,182,563,15,8,36,7,39
5550296508_10155064870856509,Art or amusement park?,These large-scale art installations are kind of mind-boggling,link,http://cnn.it/29WPYIN,2016-07-21 05:12:01,442,28,50,414,13,14,1,0,0
5550296508_10155064833936509,That's double the disapproval rating from June 2013.,Half of Brazilians are against the Olympics,link,http://cnn.it/29WMNRA,2016-07-21 04:56:02,868,97,96,732,6,62,51,13,4
5550296508_10155064798396509,BREAKING NEWS: Russia has failed in its quest to have a ban on its track and field athletes at the Rio 2016 Olympic Games overturned.,Rio 2016: Russia loses doping appeal,link,http://cnn.it/29WNryi,2016-07-21 04:34:57,1494,125,157,1222,31,76,135,17,13
5550296508_10155064759861509,"The submarine suffered external damage, but ""there is absolutely no damage to her nuclear plant,"" authorities said.",Nuclear sub damaged in 'glancing collision',link,http://cnn.it/29WMC8E,2016-07-21 04:13:02,517,42,71,456,6,47,5,3,0
5550296508_10155064730681509,An alligator grabbed the 2-year-old as he was walking in a foot of water in a lagoon at Walt Disney World's Grand Floridian Resort and Spa.,The family of the boy who died in the Disney World alligator attack won't sue,link,http://cnn.it/2a2h0SX,2016-07-21 03:55:50,1546,356,133,1100,58,24,3,351,10
5550296508_10155064641221509,"Gruesome video footage has emerged of Syrian rebels beheading a young boy, in what leaders of the group involved called an ""individual mistake.""",Rebels in Syria behead boy in 'mistake',link,http://cnn.it/2a29BmM,2016-07-21 03:00:03,1638,570,283,754,12,24,11,325,512
5550296508_10155064573191509,"In the aftermath of the coup, many Turks are re-evaluating everything.",Turkey: Soul-searching after the failed coup,link,http://cnn.it/29WAMvy,2016-07-21 02:40:01,404,170,34,370,6,8,11,3,6
5550296508_10155064518396509,"Ted Cruz didn't just outshine Donald J. Trump, he force-fed him an ice-cold dish of revenge, writes Eric Liu for CNN Opinion.",Ted Cruz gets his revenge on Trump (Opinion),link,http://cnn.it/2a26H19,2016-07-21 02:17:32,16748,3388,1340,12634,1234,110,2520,24,226
5550296508_10155064460666509,"Ted Cruz received loud boos when he refused to endorse Donald J. Trump in his speech. See the biggest moments from the third night of the Republican convention, in 90 seconds.

http://cnn.it/2a0VP4l",Wednesday fireworks at the RNC in 90 seconds,video,https://www.facebook.com/cnn/videos/10155064460666509/,2016-07-21 01:55:16,2226,1053,483,1547,161,20,415,15,68
5550296508_10155064429421509,Joshua Wong and two fellow leaders of Hong Kong's 2014 mass pro-democracy protests have been convicted and could face jail time.,Hong Kong court convicts Occupy protest leaders,link,http://cnn.it/29WuEn6,2016-07-21 01:31:54,408,53,31,298,3,8,5,40,54
5550296508_10155064349051509,"Donald J. Trump argued for an unprecedented global retrenchment, seeming to reject core assumptions of U.S. military and foreign policy thinking.","In interview, Trump breaks sharply with U.S. foreign policy tradition",link,http://cnn.it/2a21N46,2016-07-21 01:11:53,826,449,106,564,35,26,26,13,162
5550296508_10155064290081509,China's government wants citizens to chill out with the protests against fried chicken.,"South China Sea: Beijing calls KFC, Apple protests 'irrational'",link,http://cnn.it/29WqLOV,2016-07-21 00:46:52,513,128,82,398,8,5,102,0,0
5550296508_10155064198051509,"The U.S. government claims corrupt financiers spent $3.5 billion stolen from Malaysia's 1MDB fund on yachts, condos, and producing The Wolf of Wall Street.",Feds want 'Wolf of Wall Street' profits as part of $3.5 billion fraud allegations,link,http://cnn.it/2a1WC4a,2016-07-21 00:13:51,2654,212,639,1985,28,263,341,8,29
5550296508_10155064070601509,Special counsel to Donald J. Trump Michael Cohen says Sen. Ted Cruz committed political suicide when Cruz chose not to fully endorse Trump in a speech at the Republican National Convention.,Trump lawyer: Ted Cruz committed 'political suicide',video,https://www.facebook.com/cnn/videos/10155064070601509/,2016-07-20 23:45:00,2562,1569,282,1766,99,25,625,4,43
5550296508_10155064122191509,"Taiwan calls it Taiping Island; an international court calls it simply a ""rock.""",Taiwan lawmakers visit disputed landmass in South China Sea,link,http://cnn.it/2a1SPnO,2016-07-20 23:39:02,384,29,32,357,1,3,9,1,13
5550296508_10155064035326509,"""We will always stand with those who stand on the thin blue line of law enforcement in America."" - Donald J. Trump's newly minted running mate Mike Pence at the Republican National Convention. http://cnn.it/29Wj0IG",Mike Pence on the 'thin blue line',video,https://www.facebook.com/cnn/videos/10155064035326509/,2016-07-20 23:23:00,1341,295,88,1066,117,7,33,6,112
5550296508_10155064000576509,It's safe to say Chris Christie wasn't too big a fan of Ted Cruz's Republican National Convention speech.,"Chris Christie says Ted Cruz's speech was ""selfish""",video,https://www.facebook.com/cnn/videos/10155064000576509/,2016-07-20 23:00:00,3420,1333,1201,2411,146,30,760,13,60
5550296508_10155063988111509,Donald J. Trump just air-kissed his running mate. http://cnn.it/2a1LNiK,Donald Trump air-kisses Mike Pence,video,https://www.facebook.com/cnn/videos/10155063988111509/,2016-07-20 22:38:44,4775,1464,1023,2313,212,91,2047,21,91
5550296508_10155063877186509,"""For those of you who don't know me, which is most of you..."" - Indiana Gov. Mike Pence, newly named vice-presidential running mate on Donald J. Trump's ticket, introduces himself to Republican voters. http://cnn.it/29VZnR8",Mike Pence introduces himself to America,video,https://www.facebook.com/cnn/videos/10155063877186509/,2016-07-20 22:20:00,3115,689,302,2374,263,8,329,22,119
5550296508_10155063863421509,"Newt Gingrich: The cost of Hillary Clinton's dishonesty ""could be the loss of America as we know it."" http://cnn.it/2a1IgkG",Newt hits Hillary Clinton's 'dishonesty',video,https://www.facebook.com/cnn/videos/10155063863421509/,2016-07-20 22:10:00,2028,798,254,1412,148,21,325,8,114
5550296508_10155063696931509,"Sen. Ted Cruz, who dropped out of the race for the Republican nomination after losing to Donald J. Trump in Indiana's primary, got more than a minute of sustained applause as he took the stage in Cleveland. http://cnn.it/29VZnR8",Ted Cruz gets warm welcome in Cleveland,video,https://www.facebook.com/cnn/videos/10155063696931509/,2016-07-20 22:00:00,1276,593,99,874,105,13,209,4,71
5550296508_10155063857461509,Sen. Ted Cruz seemingly appeals to Republican voters perhaps unhappy with Donald J. Trump as their nominee: Please don't stay home in November. http://cnn.it/29W8UHD,Cruz to Republicans: Vote your conscience,video,https://www.facebook.com/cnn/videos/10155063857461509/,2016-07-20 21:42:03,2893,793,391,2107,238,31,418,12,87
5550296508_10155063789216509,"BREAKING: Ted Cruz refused to endorse Donald J. Trump while speaking at the Republican convention, a powerful rebuke that earned boos from the audience.  http://cnn.it/2a1FXOr",Ted Cruz booed at Republican National Convention,video,https://www.facebook.com/cnn/videos/10155063789216509/,2016-07-20 21:17:44,30537,4601,5075,22303,2386,370,4721,62,695
5550296508_10155063655851509,Talk radio host Laura Ingraham says Donald J. Trump won the Republican nomination because he exposed the problems in the political system that the mainstream media ignored. http://cnn.it/2a1B9J1,Laura Ingraham: Trump won by exposing the phonies,video,https://www.facebook.com/cnn/videos/10155063655851509/,2016-07-20 21:02:00,3387,885,446,2512,283,24,426,9,133
5550296508_10155063658996509,Here's the 60 seconds of delegate dancing you didn't know you needed. http://cnn.it/2a1Bc7z #RNCinCLE,One minute of Republican delegates dancing,video,https://www.facebook.com/cnn/videos/10155063658996509/,2016-07-20 20:47:04,3046,1599,1244,1630,120,57,1147,35,57
5550296508_10155063691171509,"We're inside the Quicken Loans Arena as Senator Ted Cruz takes the stage during night 3 of the GOP Convention in Cleveland, Ohio.",Inside the Quicken Loans Arena for the Republican National Con...,video,https://www.facebook.com/cnn/videos/10155063691171509/,2016-07-20 20:36:26,2705,2712,199,1812,163,46,152,31,501
5550296508_10155063660991509,Salad for dinner?,ALERT: There's been a massive hot dog recall,link,http://cnn.it/2a1AerR,2016-07-20 20:24:02,1282,690,2690,1020,25,159,26,36,16
5550296508_10155063593186509,"Latino Donald J. Trump supporter makes pro-Trump appeal to Spanish-speaking Americans: ""Our families escaped countries filled with corruption and lying politicians. Please, do not allow this misery to occur in this country too."" http://cnn.it/29VZnR8",Hispanic Trump supporter makes Spanish appeal,video,https://www.facebook.com/cnn/videos/10155063593186509/,2016-07-20 20:01:25,10709,4218,3956,6776,564,173,1558,116,1522
5550296508_10155063557521509,First woman to command a NASA - National Aeronautics and Space Administration Space Shuttle mission calls for more space exploration on the anniversary of the moonwalk. http://cnn.it/29VUbwB,Former astronaut calls for more space exploration,video,https://www.facebook.com/cnn/videos/10155063557521509/,2016-07-20 19:46:50,2018,375,332,1821,120,11,43,8,15
5550296508_10155063514421509,"Ivanka Trump on her father, Donald J. Trump: He is an ""incredible parent"" who ""saw the potential in us before we saw it in ourselves."" http://cnn.it/29VWrDX",Ivanka Trump on growing up Trump,video,https://www.facebook.com/cnn/videos/10155063514421509/,2016-07-20 19:32:30,2652,706,263,2012,195,15,370,7,53
5550296508_10155063468646509,"Gov. Rick Scott: ""Who better to let the politicians know 'you're fired' than Donald J. Trump?"" http://cnn.it/29VUbwB",Florida governor says Trump will tell politicians 'you're fired',video,https://www.facebook.com/cnn/videos/10155063468646509/,2016-07-20 19:11:13,1794,613,186,1230,93,11,200,12,248
5550296508_10155063411426509,"The same day Donald J. Trump was officially nominated as the Republican Party's presidential candidate, a six-inch wall was built around his star on the Hollywood Walk of Fame. http://cnn.it/29VRIlS",Tiny wall built around Trump's Hollywood star,video,https://www.facebook.com/cnn/videos/10155063411426509/,2016-07-20 18:50:38,64297,5017,16772,41739,2403,393,19214,75,473
5550296508_10155063276841509,"An informal adviser to Donald J. Trump's presidential campaign called for Hillary Clinton to be ""put in the firing line and shot for treason."" The Secret Service says it is investigating.",Secret Service investigating Trump adviser after Clinton remark,link,http://cnn.it/29VLLFk,2016-07-20 18:30:00,4363,1439,775,2793,92,471,218,48,741
5550296508_10155063269941509,This probably wasn't the wall Donald J. Trump had in mind.,Someone built a tiny wall around Donald Trump's Hollywood Star,link,http://cnn.it/2a1mjSD,2016-07-20 18:15:00,24879,1448,3315,14356,948,55,9440,9,71
5550296508_10155063298656509,We're inside the Quicken Loans Arena for night three of the Republican National Convention in Cleveland.,Inside the Republican National Convention,video,https://www.facebook.com/cnn/videos/10155063298656509/,2016-07-20 18:06:20,2984,3210,263,2292,155,40,128,47,322
5550296508_10155063266416509,"JUST IN: Hundreds of Southwest Airlines flights delayed due to technical issues. ""It will take time"" to fully recover, airline says. http://cnnmon.ie/2a1mAF7",Hundreds of Southwest flights delayed after ground stop,link,http://cnnmon.ie/2a1mAF7,2016-07-20 18:02:01,517,205,420,391,5,80,6,18,17
5550296508_10155063237611509,This teen builds drones that can fly up to 70 miles per hour. http://cnnmon.ie/29VKOwV,Teen builds 70 mph drone,video,https://www.facebook.com/cnn/videos/10155063237611509/,2016-07-20 17:47:21,3266,207,866,2955,91,214,3,0,3
5550296508_10155063170471509,Eric Trump says his prime-time address at the Republican convention will focus on why the country needs his father in the White House. http://cnn.it/29VHthk,Eric Trump: I didn't 'outsource' my speech,video,https://www.facebook.com/cnn/videos/10155063170471509/,2016-07-20 17:17:10,812,455,68,538,35,7,151,12,69
5550296508_10155063090006509,"We're at the #CNNGrill at the #RNCinCLE with Brooke Baldwin and Presidential Historian Tim Naftali, chatting politics, pints and Pence. Ask your questions or put in your drink order.",,video,https://www.facebook.com/cnn/videos/10155063090006509/,2016-07-20 16:50:31,2435,1716,148,2112,184,22,49,14,54
5550296508_10155063083711509,"4,000 police officers. 3,000 federal agents. Miles of iron gates. Cleveland is a fortress for the Republican convention. http://cnn.it/2a1eIn1",Welcome to Fortress Cleveland,video,https://www.facebook.com/cnn/videos/10155063083711509/,2016-07-20 16:49:49,1471,517,491,1152,44,144,81,18,32
5550296508_10155063006536509,"Video shows protesters outside of the #GOPConvention setting fire to an American flag. Two officers were injured in this scuffle, Cleveland police say. Details: cnn.it/2a1iVqZ",Protesters burn flag outside GOP convention,video,https://www.facebook.com/cnn/videos/10155063006536509/,2016-07-20 16:28:37,5322,3312,2659,2166,55,207,97,513,2284
5550296508_10155062853846509,A speechwriter working for Donald J. Trump's company has identified herself as the person responsible for plagiarism in Melania Trump's convention speech and offered her resignation. Donald and Melania Trump did not accept her resignation. http://cnn.it/29URATu,Timeline Photos,photo,https://www.facebook.com/cnn/photos/a.369810096508.159795.5550296508/10155062853846509/?type=3,2016-07-20 15:44:18,2443,1496,979,1481,79,57,778,10,38
5550296508_10155062831756509,"Police on horseback and in riot gear are monitoring small protests outside the arena hosting the Republican National Convention in Cleveland, Ohio.",We're outside the GOP convention's arena as police monitor sma...,video,https://www.facebook.com/cnn/videos/10155062831756509/,2016-07-20 15:39:52,3882,2549,669,3020,159,228,91,76,308
5550296508_10155062652331509,"Hat tip to the #RNCinCLE, where creative hats know no bounds. One woman, Cheryl McDonald, started her own hat making business called 'the ladies with hats for Trump.' She's made made and sold at least 50 of her hats for $100 dollars each. Another woman, Cindy Sue, who traveled all the way from Hawaii to attend the Republican Convention, went through four TSA agents to pass security into the convention. It goes without saying, people at the #GOPConvention take their hats VERY seriously.",The hats of the RNC convention,video,https://www.facebook.com/cnn/videos/10155062652331509/,2016-07-20 15:16:00,520,294,71,418,23,4,66,0,9
5550296508_10155062657306509,It's called a heat dome and it's been baking a good portion of the country for days,Heat wave still scorching the nation,link,http://cnn.it/2a10q60,2016-07-20 14:51:02,383,103,63,327,4,25,5,5,17
5550296508_10155062592761509,That time Ted Cruz was interrupted by Donald J. Trump's plane http://cnn.it/2a0Wr9w,Trump's plane interrupts Ted Cruz,video,https://www.facebook.com/cnn/videos/10155062592761509/,2016-07-20 14:25:36,1363,353,241,861,38,15,431,1,17
5550296508_10155062491841509,Watch Donald J. Trump make a dramatic entrance in Cleveland for the #GOPConvention http://cnn.it/2a0Rmhn,Donald Trump makes grand arrival in Cleveland,video,https://www.facebook.com/cnn/videos/10155062491841509/,2016-07-20 13:52:55,4388,1615,935,2830,241,57,733,24,503
5550296508_10155062423841509,We're at the #GOPConvention where CNN's Ryan Nobles of the #RunningMate podcast is giving us a tour of the grounds. Join us and chat with him!,,video,https://www.facebook.com/cnn/videos/10155062423841509/,2016-07-20 13:32:28,1864,442,116,1703,63,14,19,12,53
5550296508_10155062385816509,"A constant churn of harrowing news is physically and psychologically unhealthy, and you don't need to be directly involved in a tragedy to feel its effects, experts say.",When bad news gets to be too much,link,http://cnn.it/29V3gpr,2016-07-20 13:15:03,1087,203,400,923,17,6,1,138,2
5550296508_10155061871361509,"In part two of ""Sea Change,"" Great Big Story's latest Great Big Film with Vacationland Studio, we learn how The Nature Conservancy is trying to reduce ""road kill"" on the undersea highways even as sustainable fishing is practiced in Palau.",Great Big Story,video,https://www.facebook.com/greatbigstory/videos/1570261719942922/,2016-07-20 12:52:01,221,29,0,206,11,4,0,0,0
5550296508_10155062185711509,"We're in Cleveland with CNN's Alisyn Camerota and Jake Tapper.  It's day three of the Republican National Convention where vice presidential nominee Governor Mike Pence will be speaking tonight, along with Ted Cruz. Any questions about the conventions so far or what to expect tonight?",Ask Jake and Alisyn about #RNCinCLE,video,https://www.facebook.com/cnn/videos/10155062185711509/,2016-07-20 12:09:11,2024,1643,134,1795,76,23,30,16,84
5550296508_10155062182616509,Watch a retired U.S. Navy ship get bombarded at sea  http://cnn.it/2a0xHOx,See a retired U.S. Navy ship get bombarded at sea,video,https://www.facebook.com/cnn/videos/10155062182616509/,2016-07-20 12:05:34,3043,339,1444,2618,30,269,13,91,22
5550296508_10155062056931509,JUST IN: Donald J. Trump camp has identified Melania Trump's speechwriter. Meredith McIver accepts responsibility. She apologized in a statement sent out by the campaign and said Trump did not accept her resignation. http://cnn.it/29URATu,Trump aide offers resignation in Melania Trump plagiarism inci...,video,https://www.facebook.com/cnn/videos/10155062056931509/,2016-07-20 11:36:34,6427,4064,2647,4059,77,135,1807,26,323
5550296508_10155061971271509,"We're in Cleveland, where several dozen protesters are gathered outside the perimeter of the Republican National Convention.",Protesters at #RNCinCLE,video,https://www.facebook.com/cnn/videos/10155061971271509/,2016-07-20 11:14:45,4291,3278,489,3327,393,54,111,34,372
5550296508_10155061869091509,"Working with someone for more than 30 years is a special thing, but when you're also two of the last people in the world who have your jobs? That's incredible. And, as Great Big Story found out, Dan Jones and Art Ritchie at Carousel Works are pretty incredible.",Great Big Story,video,https://www.facebook.com/greatbigstory/videos/1570486503253777/,2016-07-20 11:14:01,229,26,0,190,34,5,0,0,0
5550296508_10155061897511509,"At the concert, Third Eye Blind bashed the Republican platform, asking the crowd ""who here believes in science?""","Third Eye Blind taunts GOP during convention, gets booed",link,http://cnn.it/29UDyBl,2016-07-20 10:50:03,7494,1185,980,5282,758,26,1364,5,59
5550296508_10155061811436509,"Erik Varszegi grew up loving comic books. Now, he builds super heroes full time... with legos. http://cnn.it/29UhO8U",This Lego Master Builder brought Captain America to life,video,https://www.facebook.com/cnn/videos/10155061811436509/,2016-07-20 10:25:49,1317,90,472,1093,76,145,3,0,0
5550296508_10155061746351509,"""I'm not lying about anything"": Donald J. Trump's campaign manager says the media should stop focusing on the similarities between Melania Trump's and Michelle Obama's speeches http://cnn.it/29UxWat",Manafort: Media should 'move on' from Melania's speech,video,https://www.facebook.com/cnn/videos/10155061746351509/,2016-07-20 10:02:41,3336,1886,873,2028,71,74,862,22,279
5550296508_10155061697711509,One step closer to Harry Potter,Scientists get closer to creating real-life invisibility cloak,link,http://cnn.it/2a0cHHF,2016-07-20 09:41:02,1926,165,398,1631,85,187,21,0,2
5550296508_10155061625491509,"The planet has now had 14 consecutive months of the hottest temperatures ever recorded, according to NOAA",NASA: Hottest June on record continues 14-month global heat wave,link,http://cnn.it/2a07RKL,2016-07-20 09:10:01,1932,405,1024,1254,15,279,11,329,44
