status_id,status_message,link_name,status_type,status_link,status_published,num_reactions,num_comments,num_shares,num_likes,num_loves,num_wows,num_hahas,num_sads,num_angrys
15704546335_10154467394551336,"An FBI report says the three told an informant last year about plans to go to Syria, and spoke approvingly of terror attacks in Orlando, San Bernardino, California, and elsewhere.",3 Florida Men Charged With Trying to Join ISIS,link,http://www.foxnews.com/us/2016/07/22/3-florida-men-charged-with-trying-to-join-isil.html,2016-07-23 08:59:04,7197,1685,2234,4001,34,525,107,134,2396
15704546335_10154467369411336,"In a 4-3 decision, the Supreme Court of Virginia ordered the state to cancel the registration of the more than 11,000 felons who had signed up to vote so far under the governor's April executive order.",Virginia high court strikes down gov's order giving felons right to vote | Fox News,link,http://www.foxnews.com/politics/2016/07/22/virginia-high-court-strikes-down-govs-order-giving-felons-right-to-vote.html,2016-07-23 08:45:00,79310,7695,12660,69696,4839,478,3805,85,407
15704546335_10154467361326336,"The gunman who opened fire inside a Munich shopping center Friday killing 9 people sent out an online invitation about a bogus free giveaway to attract more people to the site of the attack, investigators said.","Munich Gunman Sent Out Invitations to Mall Before Rampage, Cops Say",link,http://www.foxnews.com/world/2016/07/23/munich-gunman-obsessed-with-mass-shootings-sent-out-invitations-to-mall-before-rampage-cops-say.html,2016-07-23 08:14:44,1560,215,486,461,7,81,1,318,692
15704546335_10154467236921336,"Breaking News: A German prosecutor says the Friday shooting at a shopping mall in Munich that left ten people dead, including the alleged gunman, appears to be a ""classic shooting rampage"" and not terrorism, the Associated Press reports.","Munich gunman obsessed with mass shootings, sent out invitations to mall before rampage, cops say | Fox News",link,http://www.foxnews.com/world/2016/07/23/munich-gunman-obsessed-with-mass-shootings-sent-out-invitations-to-mall-before-rampage-cops-say.html,2016-07-23 06:44:28,1707,1484,426,744,7,55,33,352,516
15704546335_10154465419106336,"At the #RNC, Pastor Mark Burns shared this message about what a Donald J. Trump presidency would be like.",Timeline Photos,photo,https://www.facebook.com/FoxNews/photos/a.184044921335.134777.15704546335/10154465419106336/?type=3,2016-07-23 04:00:01,52656,1296,8282,48919,3341,83,194,14,105
15704546335_10154466601226336,"""One of the things Trump kept talking about last night was 'We are going to not only defeat her but we are going to defeat the corrupt, rigged system,'"" Monica Crowley said.",Crowley: DNC Email Leak Supports Trump's Argument That 'System Is Rigged',link,http://insider.foxnews.com/2016/07/22/special-report-panel-reacts-wikileaks-releasing-nearly-20000-dnc-emails,2016-07-23 03:00:00,26856,1136,11304,24775,939,671,205,33,233
15704546335_10154460676686336,"Urban Outfitters says they're not taking sides, they're just having fun.

Thoughts?",Urban Outfitters Playing (Anti-Trump) Politics with Merchandise,link,http://www.foxnews.com/entertainment/2016/07/20/urban-outfitters-playing-anti-trump-politics-with-merchandise.html,2016-07-23 02:00:00,2652,1852,207,661,116,40,158,39,1638
15704546335_10154466010566336,Something strange in the neighborhood?,Yuck! UT County Investigating Weird Green Foam Bubbling Out of Sewer,link,http://insider.foxnews.com/2016/07/22/ut-county-investigating-weird-green-foam-bubbling-out-sewer,2016-07-23 01:00:01,3830,1247,3120,2039,18,1229,516,8,20
15704546335_10154460669296336,A police officer's body camera captured the moment an SUV - driven by a distracted Pokemon hunter - slammed into his patrol car.,WATCH: Driver Distracted by Pokemon Go Slams into Police Car,link,http://insider.foxnews.com/2016/07/20/watch-driver-distracted-pokemon-go-game-slams-police-car,2016-07-23 00:00:00,3483,729,4058,1691,22,694,394,72,610
15704546335_10154466491371336,What was your favorite moment of the 2016 Republican National Convention?,,video,https://www.facebook.com/FoxNews/videos/10154466491371336/,2016-07-22 23:00:00,2657,2109,270,2318,281,8,16,0,34
15704546335_10154466586196336,"""He's created this narrative, and he just has to live in it.""

Dr. Sebastian Gorka responded to President Obama saying the world has never been more prosperous or peaceful.",Gorka on Obama Saying the World's Never Been Better: 'He's in The Matrix',link,http://insider.foxnews.com/2016/07/22/gorka-obama-saying-worlds-never-been-better-hes-matrix,2016-07-22 22:30:00,9190,1397,4604,7052,119,219,1067,109,624
15704546335_10154466564391336,"More than 2,000 people packed the church where Mayor Holden and others eulogized Matthew Gerald, the first of three Baton Rouge officers slain by a lone gunman to be laid to rest.","Respect Police, Baton Rouge Mayor Says at Officer's Funeral",link,http://www.foxnews.com/us/2016/07/22/respect-police-baton-rouge-mayor-says-at-officers-funeral.html,2016-07-22 21:39:43,9972,247,631,8145,454,4,8,1348,13
15704546335_10154466464526336,"""Donald J. Trump is going to show respect for the law enforcement officers so they don't wear targets on their back.""

Mike Huckabee said Republicans are saying to the American people, ""you want to stand with the cops or ... stand with the crooks?""",,video,https://www.facebook.com/FoxNews/videos/10154466464526336/,2016-07-22 20:38:34,17109,975,2430,16031,918,32,102,6,20
15704546335_10154466355201336,"""Terrorism's a contagion, and now we're starting to see it break out like the bubonic plague all over Europe.""

Bill O'Reilly reacted to today's attack in Munich, Germany, saying the common thread among all the terrorists is ""they don't value their own lives, so therefore don't value anyone else's.""",,video,https://www.facebook.com/FoxNews/videos/10154466355201336/,2016-07-22 19:57:44,6633,781,1394,4716,34,52,5,1036,790
15704546335_10154466243916336,Breaking News: Hillary Clinton picks U.S. Senator Tim Kaine as her running mate on the Democratic presidential ticket. http://fxn.ws/2afbPhC,Timeline Photos,photo,https://www.facebook.com/FoxNews/photos/a.184044921335.134777.15704546335/10154466243916336/?type=3,2016-07-22 19:12:50,4853,4458,2143,1703,96,63,2378,57,556
15704546335_10154466218566336,"Breaking News: Police in Munich, Germany say the gunman who opened fire at a popular shopping mall took his own life, and there is a ""high probability"" that he acted alone. Authorities say that 10 people are dead, including the shooter, and at least 10 others are injured.",Suspected Lone Gunman Among 10 Dead In Shooting Spree at Munich Shopping Center,link,http://www.foxnews.com/world/2016/07/22/suspected-lone-gunman-among-10-dead-10-injured-in-shooting-spree-at-munich-shopping-center.html,2016-07-22 18:58:10,808,248,292,335,4,9,1,255,204
