status_id,status_message,link_name,status_type,status_link,status_published,num_reactions,num_comments,num_shares,num_likes,num_loves,num_wows,num_hahas,num_sads,num_angrys
15704546335_10154465828011336,"Update: At least 8 people have died, police say. http://fxn.ws/29SkUv0

Breaking News: Munich is in a state of emergency following the shooting at a shopping center, German TV reports. Six people are reportedly dead as police hunt for suspects.",Timeline Photos,photo,https://www.facebook.com/FoxNews/photos/a.184044921335.134777.15704546335/10154465828011336/?type=3,2016-07-22 15:15:27,729,246,487,242,2,15,0,273,197
15704546335_10154465736881336,"Moments ago, President Obama commented on the shooting in Munich, Germany. ""We don't yet know exactly what's happening there but obviously our hearts go out to those who may have been injured.""",,video,https://www.facebook.com/FoxNews/videos/10154465736881336/,2016-07-22 14:25:10,1421,2573,634,497,12,16,31,145,720
15704546335_10154465700766336,"Breaking News Update: German authorities say 5 people are believed to be dead and there are 3 attackers that they know about. http://fxn.ws/29SkUv0

Breaking News: A police spokesman says a shooting spree at a mall in Munich is suspected to be a terror attack amid reports from German media that at least 6 people are dead. http://bit.ly/2aeFyr9",,video,https://www.facebook.com/FoxNews/videos/10154465700766336/,2016-07-22 14:09:05,2193,676,2393,737,6,46,4,741,659
15704546335_10154465596151336,"Breaking News: Police in Munich reportedly said they expect ""multiple dead"" after a shooting spree inside a city shopping center, prompting a massive police response and an intense manhunt for possible suspects.","Many Feared Dead After Shooting Spree at Munich Shopping Center, German News Agency Reports",link,http://www.foxnews.com/world/2016/07/22/shots-fired-at-shopping-center-in-munich-reports-say.html,2016-07-22 13:07:42,5104,1380,4119,1417,2,107,10,2026,1542
15704546335_10154465478211336,"Update: Police say multiple people have been killed and people are advised to avoid public areas. The transit system has shut down as authorities search for a suspect or suspects. http://fxn.ws/29SkUv0

Developing: Shots fired at shopping center in Munich, Germany, reports say.",,video,https://www.facebook.com/FoxNews/videos/10154465478211336/,2016-07-22 12:03:39,3733,1120,5854,1296,7,131,9,1225,1065
15704546335_10154465440556336,"""This idea that America is somehow on the verge of collapse – this vision of violence and chaos everywhere – doesn't really jibe with the experience of most people.""

President Obama called out the #RNCinCLE message that America is on the verge of collapse.",,video,https://www.facebook.com/FoxNews/videos/10154465440556336/,2016-07-22 11:56:29,9814,18201,5618,2548,81,318,1997,146,4725
15704546335_10154465331656336,Live: President Obama holds a joint news conference with Mexican President Enrique Peña Nieto.,,video,https://www.facebook.com/FoxNews/videos/10154465331656336/,2016-07-22 11:06:26,12298,29021,1371,2601,614,146,377,205,8355
15704546335_10154465259621336,"When a man tossed a suspicious device - first thought to be a bomb - into an NYPD vehicle, the two officers inside thought only of protecting the innocent bystanders.",2 Brave Officers Drove What They Thought Was a Bomb Away from Times Square,link,http://insider.foxnews.com/2016/07/22/nypd-officers-heroes-times-square-hoax-bomb-scare,2016-07-22 10:17:26,18044,601,4802,15049,2118,810,12,25,30
15704546335_10154464147516336,"""America is a nation of believers, dreamers and strivers that is being led by a group of censors, critics and cynics."" - Donald J. Trump",,video,https://www.facebook.com/FoxNews/videos/10154464147516336/,2016-07-22 09:17:59,14344,708,1328,13082,1168,19,46,6,23
15704546335_10154460860461336,"""One of the most compassionate and caring people I've ever met,"" the mom of twins wrote about the Enterprise Rent-A-Car employee.",Enterprise Employee Lends a Helping Hand to Mom of Twins,link,http://insider.foxnews.com/2016/07/20/enterprise-employee-goes-viral-lending-helping-hand-mom-twins,2016-07-22 08:32:47,12870,374,1522,11328,1500,34,7,0,1
15704546335_10154464992086336,"Happy birthday, Prince George! The little prince turns 3 today.",Photos from Fox News's post,photo,https://www.facebook.com/FoxNews/photos/a.184044921335.134777.15704546335/10154464990711336/?type=3,2016-07-22 07:35:50,35330,1136,1279,32172,3003,123,22,1,9
15704546335_10154464197781336,"""My opponent asks her supporters to recite a three word loyalty pledge. It reads 'I'm with her.' I choose to recite a different pledge. My pledge reads 'I'm with you, the American people.'"" – Donald J. Trump",,video,https://www.facebook.com/FoxNews/videos/10154464197781336/,2016-07-22 07:00:00,31091,904,3457,28094,2841,23,91,8,34
15704546335_10154464293721336,"Donald J. Trump had a message for anyone threatening the peace on our streets and the safety of our police: ""When I take the oath of office next year, I will restore law and order to our country."" #RNCinCLE",Timeline Photos,photo,https://www.facebook.com/FoxNews/photos/a.184044921335.134777.15704546335/10154464293721336/?type=3,2016-07-22 06:15:00,18385,713,3134,16883,1398,14,28,4,58
15704546335_10154464384571336,"Ivanka Trump spoke in support of Donald J. Trump at the Republican National Convention, saying ""no one has more faith in the American people than my father.""",Timeline Photos,photo,https://www.facebook.com/FoxNews/photos/a.184044921335.134777.15704546335/10154464384571336/?type=3,2016-07-22 05:30:01,52529,1418,4645,48421,3777,59,233,6,35
15704546335_10154463412861336,Sheriff David Clarke was hanging out with three of Cleveland's finest at the RNC.,Timeline Photos,photo,https://www.facebook.com/FoxNews/photos/a.184044921335.134777.15704546335/10154463412861336/?type=3,2016-07-22 04:45:00,48876,956,1480,46180,2592,39,50,5,11
15704546335_10154464270196336,"Watch: This was the highest-scored moment of the entire 2016 Republican National Convention, and it happened during Donald J. Trump's speech as he addressed the corruption surrounding Hillary Clinton. http://bit.ly/29XRHUp",,video,https://www.facebook.com/FoxNews/videos/10154464270196336/,2016-07-22 04:00:00,28715,850,6750,25933,2157,448,119,14,44
15704546335_10154463821311336,"""The police are guilty before they're proven innocent, and criminals are innocent until proven guilty.""

Mayor Rudy Giuliani said he believes President Obama has created an atmosphere that is ""getting close to anarchy with regard to the police.""",,video,https://www.facebook.com/FoxNews/videos/10154463821311336/,2016-07-22 03:00:00,17228,558,2372,16018,589,43,14,108,457
15704546335_10154463898776336,"Peter Thiel: ""I am proud to be gay. I am proud to be a Republican. But most of all, I am proud to be an American.""",,video,https://www.facebook.com/FoxNews/videos/10154463898776336/,2016-07-22 02:00:00,13993,609,1844,12756,1097,31,57,21,31
15704546335_10154463628361336,"""The country's upside down right now. The cops have been made out to be the bad guys. The criminals, the crooks, the law-breakers are now victims in this. The whole narrative is flipped up on its head."" — Sheriff David Clarke",Clarke: Cleveland Police Hit a 'Home Run' in Handling 'Conglomeration of Misfits',link,http://insider.foxnews.com/2016/07/21/clarke-cleveland-flag-burning-protests-rnc,2016-07-22 01:00:00,27445,1107,5620,24504,1079,99,25,348,1390
15704546335_10154464341401336,"""Despite the color you were born with, here in America, the only colors that matter are the colors of red, white, and blue!""

Pastor Mark Burns had the crowd on its feet as he delivered an electric speech on the final night of the Republican National Convention — ""Make America One Again."" http://bit.ly/29XwQkk",,video,https://www.facebook.com/FoxNews/videos/10154464341401336/,2016-07-22 00:01:20,68229,1658,15159,61444,6356,332,63,10,26
15704546335_10154464092626336,"""On Janurary 20th of 2017, the day I take the oath of office, Americans will finally wake up in a country where the laws of the United States are enforced."" – Donald J. Trump #RNCinCLE",,video,https://www.facebook.com/FoxNews/videos/10154464092626336/,2016-07-21 23:36:39,28540,1130,2625,25601,2673,36,83,13,135
15704546335_10154464161661336,"""Anyone who endorses violence, hatred or oppression is not welcome in our country and never, ever will be,"" says Donald J. Trump. #RNCinCLE",Timeline Photos,photo,https://www.facebook.com/FoxNews/photos/a.184044921335.134777.15704546335/10154464161661336/?type=3,2016-07-21 23:06:04,39499,1376,4763,36114,3162,35,68,5,116
15704546335_10154464167331336,Balloons are released and fireworks light up the sky over Lake Erie to celebrate the official nomination of Donald J. Trump and Mike Pence.,,video,https://www.facebook.com/FoxNews/videos/10154464167331336/,2016-07-21 22:42:22,73943,2544,10255,66386,6662,448,129,98,220
15704546335_10154464116126336,"In his RNC speech tonight, Donald J. Trump called himself the ""law and order candidate."" #RNCinCLE",Timeline Photos,photo,https://www.facebook.com/FoxNews/photos/a.184044921335.134777.15704546335/10154464116126336/?type=3,2016-07-21 22:24:43,27540,906,4433,25254,2099,21,125,4,37
15704546335_10154464092041336,"""The irresponsible rhetoric of our president, who has used the pulpit of the presidency to divide us by race and color, has made America a more dangerous environment than frankly I have ever seen."" – Donald J. Trump More: http://bit.ly/29XKgww",,video,https://www.facebook.com/FoxNews/videos/10154464092041336/,2016-07-21 22:14:07,54928,1942,6065,50517,3817,63,77,60,394
15704546335_10154464063831336,"""An attack on law enforcement is an attack on all Americans."" 

Donald J. Trump vowed to restore ""law and order"" if he is elected president.",,video,https://www.facebook.com/FoxNews/videos/10154464063831336/,2016-07-21 22:01:44,56866,1298,10036,52409,4159,51,135,31,82
15704546335_10154464049701336,"""This is the legacy of Hillary Clinton: death, destruction, terrorism and weakness.""

Donald J. Trump said after years of the Obama/Clinton foreign policy the situation in the Middle East ""is worse than it has ever been before.""",,video,https://www.facebook.com/FoxNews/videos/10154464049701336/,2016-07-21 21:54:54,26008,815,2902,23834,1882,30,47,25,190
15704546335_10154464000016336,"""I humbly and gratefully accept your nomination for the presidency of the United States."" - Donald J. Trump",,video,https://www.facebook.com/FoxNews/videos/10154464000016336/,2016-07-21 21:26:48,69242,2257,7297,61557,6795,84,142,105,560
15704546335_10154463958236336,"""This is the moment, and Donald J. Trump is the person, to make America great again!""

Ivanka Trump spoke in support of her father at the Republican National Convention. http://bit.ly/29XMZWX",,video,https://www.facebook.com/FoxNews/videos/10154463958236336/,2016-07-21 21:10:37,58083,2222,5636,51879,5731,108,232,21,114
15704546335_10154463924221336,Donald J. Trump is in the building. Follow FoxNews on Snapchat for behind-the-scenes content from the Republican National Convention!,,video,https://www.facebook.com/FoxNews/videos/10154463924221336/,2016-07-21 20:50:36,6981,271,312,6190,719,5,37,3,27
15704546335_10154463892476336,"""I am proud to be gay, I am proud to be a Republican, but most of all I am proud to be an American.""

Billionaire entrepreneur Peter Thiel said debates like those about ""who gets to use which bathroom"" are a distraction from our real problems. More: http://bit.ly/2agQd4j",,video,https://www.facebook.com/FoxNews/videos/10154463892476336/,2016-07-21 20:39:14,27366,1063,5256,25036,2027,178,36,18,71
15704546335_10154463875321336,"RNC Chairman Reince Priebus said Supreme Court justices appointed by Hillary Clinton would ""treat the Constitution like a doormat."" http://bit.ly/29XVaT5",Timeline Photos,photo,https://www.facebook.com/FoxNews/photos/a.184044921335.134777.15704546335/10154463875321336/?type=3,2016-07-21 20:20:25,16998,968,4133,15367,418,46,50,76,1042
15704546335_10154463799686336,Live: Watch the final night of the Republican National Convention as Donald J. Trump takes the stage to formally accept the GOP nomination for president of the United States. #RNCinCLE,,video,https://www.facebook.com/FoxNews/videos/10154463799686336/,2016-07-21 20:02:25,23432,45213,2814,16241,5338,217,344,196,1096
15704546335_10154463749741336,"""I want to declare to the whole world and to the Republican Party that ... under a Donald J. Trump administration, All Lives Matter!""

Pastor Mark Burns got the RNC crowd fired up and chanting ""All Lives Matter!""",,video,https://www.facebook.com/FoxNews/videos/10154463749741336/,2016-07-21 19:28:40,80619,2484,23559,72957,7028,378,145,29,86
15704546335_10154463670736336,"Adorable 6-year-old singer Heavenly Joy performs ""America the Beautiful"" at the start of the last night of the Republican National Convention in Cleveland. http://bit.ly/2a3lARN",,video,https://www.facebook.com/FoxNews/videos/10154463670736336/,2016-07-21 18:42:14,48585,2170,26953,40695,6453,1388,35,7,7
15704546335_10154463624801336,Watch the final night of the Republican National Convention as Donald J. Trump is set to take the stage to formally accept the GOP nomination for president of the United States.,,video,https://www.facebook.com/FoxNews/videos/10154463624801336/,2016-07-21 18:20:12,17259,18374,1719,12515,3903,148,217,84,392
15704546335_10154463647466336,,Fox News Politics,video,https://www.facebook.com/FoxNewsPolitics/videos/1195582600481274/,2016-07-21 18:17:38,1170,113,0,1091,70,5,1,0,3
15704546335_10154463508151336,"Protester: ""Why would I go anywhere else? This is where I'm from.""

Pete Hegseth countered: ""Yeah, why would he go anywhere else when he could stay in the greatest country on Earth where he has the freedom to do just this? Where cops that he claims are killers are the ones that protect him!""",Hegseth Confronts Flag-Burning Protesters: 'Why Do You Hate America?',link,http://insider.foxnews.com/2016/07/21/hegseth-confronts-flag-burning-protesters-why-do-you-hate-america,2016-07-21 17:46:39,9631,2541,5490,6295,96,172,382,158,2528
15704546335_10154463528496336,"The NBA will not hold its annual All-Star Game in Charlotte next year due to North Carolina's so-called ""Bathroom Law"" limiting anti-discrimination protection for LGBT people, the league announced.",NBA  Pulling 2017 All-Star Game Out of Charlotte Over NC Transgender Law,link,http://www.foxnews.com/sports/2016/07/21/nba-reportedly-pulling-2017-all-star-game-out-charlotte-over-nc-transgender-law.html,2016-07-21 17:05:00,4858,5782,810,1939,156,94,763,112,1794
15704546335_10154463316331336,"""THIS is the face of law enforcement!""","Bullies Stole This Little Boy's Shoes, But 2 Local Officers Had His Back",link,http://insider.foxnews.com/2016/07/21/bullies-stole-little-boys-shoes-2-local-officers-had-his-back,2016-07-21 16:04:08,12957,317,3006,11460,1425,49,13,6,4
15704546335_10154463363666336,,Shepard Smith,video,https://www.facebook.com/ShepardSmith/videos/10154192580405490/,2016-07-21 16:01:34,1310,860,0,1108,51,8,14,6,123
15704546335_10154463253996336,"""Remember what Donald Trump used to call him – Lyin' Ted."" - Rudy Giuliani on Ted Cruz breaking his promise to support Donald J. Trump as the Republican nominee",,video,https://www.facebook.com/FoxNews/videos/10154463253996336/,2016-07-21 15:11:28,15355,1656,2035,14163,649,45,346,34,119
15704546335_10154463243981336,,Outnumbered Fox News,video,https://www.facebook.com/OutnumberedFNC/videos/662437960576417/,2016-07-21 15:01:39,1683,693,0,1531,91,8,15,2,36
15704546335_10154463220011336,Donald J. Trump today on his walk through of the stage before his big speech tonight. Join us on Fox News Channel for full RNC coverage.,Timeline Photos,photo,https://www.facebook.com/FoxNews/photos/a.184044921335.134777.15704546335/10154463220011336/?type=3,2016-07-21 14:49:19,2773,370,121,2478,241,3,17,4,30
15704546335_10154463084556336,Liberal filmmaker Michael Moore had an interesting prediction about Donald J. Trump.,Michael Moore: 'Trump Will Win',link,http://insider.foxnews.com/2016/07/21/michael-moore-trump-will-win,2016-07-21 13:44:42,9818,1977,1750,8415,650,161,519,20,53
15704546335_10154462981246336,"Huckabee, Carson, Baier LIVE!

Post your questions for Mike Huckabee, Dr. Ben Carson and Bret Baier in the comments below!",,video,https://www.facebook.com/FoxNews/videos/10154462981246336/,2016-07-21 13:06:32,4369,4825,697,3449,802,22,48,12,37
15704546335_10154462921911336,"Flashback Video: During a Fox News debate in March, Ted Cruz said he would support Donald J. Trump if he became the Republican nominee. ""I gave my word that I would."" http://bit.ly/2ay5NrF",,video,https://www.facebook.com/FoxNews/videos/10154462921911336/,2016-07-21 12:29:51,10192,4403,7539,6853,63,271,1123,116,1766
15704546335_10154462779236336,"""You're on fire! You're on fire, stupid!"" the Cleveland officer yelled at the protester.","Cop to Flag-Burning RNC Protester: 'You're on Fire, Stupid!'",link,http://insider.foxnews.com/2016/07/21/cop-flag-burning-rnc-protester-youre-fire-stupid,2016-07-21 11:29:58,50182,6451,21262,29728,1258,515,17855,157,669
15704546335_10154462657101336,"Breaking News: Police in Brazil arrest at least 10 people accused of pledging allegiance to ISIS, possibly plotting attack during Rio Olympics, justice minister announces. http://fxn.ws/2abvL5b",,status,,2016-07-21 10:31:55,4465,391,1584,2988,28,540,13,125,771
15704546335_10154462613126336,"""As long as I've got my hands up, they're not going to shoot me. This is what I'm thinking...wow, was I wrong,"" Charles Kinsey said.",VIDEO: Police Shoot Autistic Man's Caretaker as He Lies in Street,link,http://www.foxnews.com/us/2016/07/21/south-florida-police-shoot-autistic-mans-caretaker-as-lies-in-street.html,2016-07-21 10:12:43,11738,5659,5313,3473,28,666,67,3062,4442
15704546335_10154462534986336,"""What Cruz delivered was the longest suicide note in American political history,"" Charles Krauthammer said in reaction to Ted Cruz's RNC speech.",Krauthammer: Ted Cruz Has Destroyed His Political Career,link,http://insider.foxnews.com/2016/07/21/krauthammer-cruzs-rnc-speech-longest-suicide-note-political-history,2016-07-21 09:23:11,78386,15945,23516,65077,1127,731,7388,676,3387
15704546335_10154462434366336,"When asked if he'll vote for Donald J. Trump, Ted Cruz responds: ""I can tell you I'm not voting for Hillary.""",,video,https://www.facebook.com/FoxNews/videos/10154462434366336/,2016-07-21 08:28:21,13153,7358,2174,9721,350,163,694,152,2074
15704546335_10154461311771336,"Jesse Watters: ""What does fascism mean?""
Answer: ""Fascism is like a conservative revolution almost.""",Trump Is 'Straight Evil'?! Watters' World Talks to Protesters at the RNC,link,http://insider.foxnews.com/2016/07/20/watters-world-protests-republican-nation-convention-rnc,2016-07-21 07:49:22,7408,2420,3666,3643,84,535,2806,121,219
15704546335_10154462344906336,"Breaking News: Suspect arrested at Sydney, Australia police station, accused of ""deliberate"" plot targeting police; bomb squad investigating his car.",Arrest in Alleged Terror Plot at Sydney Police Station,link,http://www.foxnews.com/world/2016/07/21/bomb-squad-checking-car-at-australian-police-parking-garage.html,2016-07-21 07:29:51,1906,186,684,1096,13,97,1,202,497
15704546335_10154460864891336,Former N.W.A. rapper Ice Cube says he has no intention to stop performing the song in light of recent attacks against police.,Ice Cube Says He Won't Stop Performing Anti-Cop Anthem,link,http://insider.foxnews.com/2016/07/19/ice-cube-says-he-wont-stop-performing-f-tha-police,2016-07-21 06:30:00,8984,5541,2978,2258,196,130,87,801,5512
15704546335_10154461655081336,"Newt Gingrich spoke at the Republican National Convention, declaring that Donald J. Trump can keep America safe.",Timeline Photos,photo,https://www.facebook.com/FoxNews/photos/a.184044921335.134777.15704546335/10154461655081336/?type=3,2016-07-21 05:30:01,37979,880,3467,35526,2307,34,85,5,22
15704546335_10154461740996336,Gov. Mike Pence formally accepted the vice presidential nomination Wednesday night at the Republican National Convention.,Timeline Photos,photo,https://www.facebook.com/FoxNews/photos/a.184044921335.134777.15704546335/10154461740996336/?type=3,2016-07-21 04:30:01,72307,1570,12650,66763,5275,52,145,15,59
15704546335_10154461690416336,"""My father doesn't think in terms of demographic. He thinks in terms of the person.""

Ivanka Trump said her father ""lives gender equality"" by looking for the same qualities of drive, passion, and vision in both women and men equally.",,video,https://www.facebook.com/FoxNews/videos/10154461690416336/,2016-07-21 03:30:00,12094,406,1005,11206,791,13,75,3,6
15704546335_10154461394136336,"""Freedom means free speech, not politically correct safe spaces.""

In his speech at the Republican National Convention, former candidate Ted Cruz said ""whether you are gay or straight, the Bill of Rights protects all of us.""",,video,https://www.facebook.com/FoxNews/videos/10154461394136336/,2016-07-21 02:30:00,5695,2702,453,4022,345,33,72,61,1162
15704546335_10154461516556336,"""[Donald J. Trump] could no longer stand to see the words 'Christmas' stripped from public use, or the Pledge of Allegiance removed from our schools in an effort to be politically correct."" 

What did you make of Eric Trump's RNC address?",,video,https://www.facebook.com/FoxNews/videos/10154461516556336/,2016-07-21 01:30:00,71021,3857,8257,63634,6974,215,125,13,60
15704546335_10154461503631336,"""Democrats are about to anoint someone who represents everything this country is tired of.""

Vice-presidential candidate Mike Pence said in a year where voters are crying out for change, Democrats offered a ""stale agenda and the most predictable of names.""",,video,https://www.facebook.com/FoxNews/videos/10154461503631336/,2016-07-21 00:30:00,17611,511,1810,16386,1115,10,36,7,57
15704546335_10154461705036336,"""Put your personal agenda aside and put your country first."" 

Sheriff David Clarke had strong words for Ted Cruz and people who refuse to endorse Donald J. Trump, adding, ""you got to come out of this thing as one team.""",,video,https://www.facebook.com/FoxNews/videos/10154461705036336/,2016-07-21 00:05:54,34537,2072,5899,32360,1898,45,122,32,80
15704546335_10154461589471336,"""The best unity I saw was everyone booing him off the stage, because I think everyone else in here has the sense to realize that the number one goal is to make sure we beat Hillary Clinton.""

Donald Trump Jr. reacted to Ted Cruz not endorsing his father during the Republican National Convention.",,video,https://www.facebook.com/FoxNews/videos/10154461589471336/,2016-07-20 23:33:53,15418,1188,1229,14382,731,26,70,14,195
15704546335_10154461575456336,Donald J. Trump responded on Twitter to Sen. Ted Cruz's non-endorsement at the end of his RNC address:,Timeline Photos,photo,https://www.facebook.com/FoxNews/photos/a.184044921335.134777.15704546335/10154461575456336/?type=3,2016-07-20 23:01:29,19985,3452,1629,17897,849,107,958,42,132
15704546335_10154461489701336,"""The cost of Hillary's dishonesty could be the loss of America as we know it.""

Newt Gingrich slammed Hillary Clinton during his Republican National Convention speech, adding ""the first step forward to safety is electing a leader who will be truthful to the American people.""",,video,https://www.facebook.com/FoxNews/videos/10154461489701336/,2016-07-20 22:30:52,27227,1001,4288,25321,1755,43,55,14,39
15704546335_10154461488071336,"In an impassioned speech, Eric Trump called on Americans to ""vote for the candidate who can't be bought, sold, purchased, bribed, coerced, intimidated or steered from the path that is right and just and true!"" http://bit.ly/29OF0GO",,video,https://www.facebook.com/FoxNews/videos/10154461488071336/,2016-07-20 22:02:11,70189,2434,10371,64004,5654,108,341,6,76
15704546335_10154461386036336,Delegates at the Republican National Convention booed former presidential candidate Ted Cruz after he finished his speech without endorsing nominee Donald J. Trump. More: http://bit.ly/2a0igqA,,video,https://www.facebook.com/FoxNews/videos/10154461386036336/,2016-07-20 21:23:59,17835,9502,2483,11352,400,251,1113,344,4375
15704546335_10154461356271336,"Governor Scott Walker said ""liberal Washington insiders created these problems. And Hillary Clinton is the ultimate liberal Washington insider.""",Timeline Photos,photo,https://www.facebook.com/FoxNews/photos/a.184044921335.134777.15704546335/10154461356271336/?type=3,2016-07-20 21:01:01,17499,478,1604,15644,742,16,1064,6,27
15704546335_10154461315276336,"Live Now: Senator Ted Cruz, Eric Trump, Newt Gingrich and Vice Presidential Nominee Mike Pence. #RNCinCLE",,video,https://www.facebook.com/FoxNews/videos/10154461315276336/,2016-07-20 20:33:34,23953,38512,2352,16073,4599,226,413,260,2382
15704546335_10154461301936336,"""You must honor your pledge to support Donald J. Trump now. Tonight.""

Laura Ingraham addressed the former candidates with ""wounded feelings and bruised egos"" who have not endorsed Trump during her speech at the Republican National Convention.",,video,https://www.facebook.com/FoxNews/videos/10154461301936336/,2016-07-20 20:31:00,31606,2120,3760,28613,2664,51,95,8,175
15704546335_10154461217191336,"Laura Ingraham slammed Hillary Clinton in her RNC speech, saying ""she believes our greatness can only be found in the ever-growing bloated government bureaucracy that only she, her majesty, can rule over.""",Timeline Photos,photo,https://www.facebook.com/FoxNews/photos/a.184044921335.134777.15704546335/10154461217191336/?type=3,2016-07-20 19:58:44,29157,1213,3181,26567,2045,48,452,4,41
