status_id,status_message,link_name,status_type,status_link,status_published,num_reactions,num_comments,num_shares,num_likes,num_loves,num_wows,num_hahas,num_sads,num_angrys
15704546335_10154464161661336,"""Anyone who endorses violence, hatred or oppression is not welcome in our country and never, ever will be,"" says Donald J. Trump. #RNCinCLE",Timeline Photos,photo,https://www.facebook.com/FoxNews/photos/a.184044921335.134777.15704546335/10154464161661336/?type=3,2016-07-21 23:06:04,6749,300,776,6011,695,10,13,1,21
15704546335_10154464167331336,Balloons are released and fireworks light up the sky over Lake Erie to celebrate the official nomination of Donald J. Trump and Mike Pence.,,video,https://www.facebook.com/FoxNews/videos/10154464167331336/,2016-07-21 22:42:22,26046,1296,3565,22843,2909,140,49,26,81
15704546335_10154464116126336,"In his RNC speech tonight, Donald J. Trump called himself the ""law and order candidate."" #RNCinCLE",Timeline Photos,photo,https://www.facebook.com/FoxNews/photos/a.184044921335.134777.15704546335/10154464116126336/?type=3,2016-07-21 22:24:43,12668,508,1793,11484,1102,6,64,0,13
15704546335_10154464092041336,"""The irresponsible rhetoric of our president, who has used the pulpit of the presidency to divide us by race and color, has made America a more dangerous environment than frankly I have ever seen."" – Donald J. Trump More: http://bit.ly/29XKgww",,video,https://www.facebook.com/FoxNews/videos/10154464092041336/,2016-07-21 22:14:07,19664,933,2090,17811,1643,31,35,16,132
15704546335_10154464063831336,"""An attack on law enforcement is an attack on all Americans."" 

Donald J. Trump vowed to restore ""law and order"" if he is elected president.",,video,https://www.facebook.com/FoxNews/videos/10154464063831336/,2016-07-21 22:01:44,24853,664,3441,22552,2171,32,60,12,29
15704546335_10154464049701336,"""This is the legacy of Hillary Clinton: death, destruction, terrorism and weakness.""

Donald J. Trump said after years of the Obama/Clinton foreign policy the situation in the Middle East ""is worse than it has ever been before.""",,video,https://www.facebook.com/FoxNews/videos/10154464049701336/,2016-07-21 21:54:54,13438,503,1399,12244,1054,12,20,11,98
15704546335_10154464000016336,"""I humbly and gratefully accept your nomination for the presidency of the United States."" - Donald J. Trump",,video,https://www.facebook.com/FoxNews/videos/10154464000016336/,2016-07-21 21:26:48,37593,1383,3897,33025,4115,40,79,60,276
15704546335_10154463958236336,"""This is the moment, and Donald J. Trump is the person, to make America great again!""

Ivanka Trump spoke in support of her father at the Republican National Convention.",,video,https://www.facebook.com/FoxNews/videos/10154463958236336/,2016-07-21 21:10:37,35978,1570,3382,31811,3896,66,140,8,58
15704546335_10154463924221336,Donald J. Trump is in the building. Follow FoxNews on Snapchat for behind-the-scenes content from the Republican National Convention!,,video,https://www.facebook.com/FoxNews/videos/10154463924221336/,2016-07-21 20:50:36,4331,215,221,3828,459,4,23,0,17
15704546335_10154463892476336,"""I am proud to be gay, I am proud to be a Republican, but most of all I am proud to be an American.""

Billionaire entrepreneur Peter Thiel said debates like those about ""who gets to use which bathroom"" are a distraction from our real problems. More: http://bit.ly/2agQd4j",,video,https://www.facebook.com/FoxNews/videos/10154463892476336/,2016-07-21 20:39:14,17225,694,3092,15702,1336,105,25,9,48
15704546335_10154463875321336,"RNC Chairman Reince Priebus said Supreme Court justices appointed by Hillary Clinton would ""treat the Constitution like a doormat.""",Timeline Photos,photo,https://www.facebook.com/FoxNews/photos/a.184044921335.134777.15704546335/10154463875321336/?type=3,2016-07-21 20:20:25,12860,735,2936,11682,298,36,32,57,756
15704546335_10154463799686336,Live: Watch the final night of the Republican National Convention as Donald J. Trump takes the stage to formally accept the GOP nomination for president of the United States. #RNCinCLE,,video,https://www.facebook.com/FoxNews/videos/10154463799686336/,2016-07-21 20:02:25,20970,44779,2435,14289,4927,200,320,188,1046
15704546335_10154463749741336,"""I want to declare to the whole world and to the Republican Party that ... under a Donald J. Trump administration, All Lives Matter!""

Pastor Mark Burns got the RNC crowd fired up and chanting ""All Lives Matter!""",,video,https://www.facebook.com/FoxNews/videos/10154463749741336/,2016-07-21 19:28:40,52545,1700,12701,47380,4747,252,103,15,50
15704546335_10154463670736336,"Adorable 6-year-old singer Heavenly Joy performs ""America the Beautiful"" at the start of the last night of the Republican National Convention in Cleveland. http://bit.ly/2a3lARN",,video,https://www.facebook.com/FoxNews/videos/10154463670736336/,2016-07-21 18:42:14,29812,1344,13232,24735,4165,883,21,4,4
15704546335_10154463624801336,Watch the final night of the Republican National Convention as Donald J. Trump is set to take the stage to formally accept the GOP nomination for president of the United States.,,video,https://www.facebook.com/FoxNews/videos/10154463624801336/,2016-07-21 18:20:12,16282,18279,1629,11710,3754,145,210,83,380
15704546335_10154463647466336,,Fox News Politics,video,https://www.facebook.com/FoxNewsPolitics/videos/1195582600481274/,2016-07-21 18:17:38,1008,103,0,945,55,4,1,0,3
15704546335_10154463508151336,"Protester: ""Why would I go anywhere else? This is where I'm from.""

Pete Hegseth countered: ""Yeah, why would he go anywhere else when he could stay in the greatest country on Earth where he has the freedom to do just this? Where cops that he claims are killers are the ones that protect him!""",Hegseth Confronts Flag-Burning Protesters: 'Why Do You Hate America?',link,http://insider.foxnews.com/2016/07/21/hegseth-confronts-flag-burning-protesters-why-do-you-hate-america,2016-07-21 17:46:39,7593,2133,4482,4932,74,142,302,127,2017
15704546335_10154463528496336,"The NBA will not hold its annual All-Star Game in Charlotte next year due to North Carolina's so-called ""Bathroom Law"" limiting anti-discrimination protection for LGBT people, the league announced.",NBA  Pulling 2017 All-Star Game Out of Charlotte Over NC Transgender Law,link,http://www.foxnews.com/sports/2016/07/21/nba-reportedly-pulling-2017-all-star-game-out-charlotte-over-nc-transgender-law.html,2016-07-21 17:05:00,3996,4901,692,1585,130,84,627,91,1480
15704546335_10154463316331336,"""THIS is the face of law enforcement!""","Bullies Stole This Little Boy's Shoes, But 2 Local Officers Had His Back",link,http://insider.foxnews.com/2016/07/21/bullies-stole-little-boys-shoes-2-local-officers-had-his-back,2016-07-21 16:04:08,10752,282,2544,9497,1195,38,12,6,4
15704546335_10154463363666336,,Shepard Smith,video,https://www.facebook.com/ShepardSmith/videos/10154192580405490/,2016-07-21 16:01:34,1218,837,0,1025,51,8,14,5,115
15704546335_10154463253996336,"""Remember what Donald Trump used to call him – Lyin' Ted."" - Rudy Giuliani on Ted Cruz breaking his promise to support Donald J. Trump as the Republican nominee",,video,https://www.facebook.com/FoxNews/videos/10154463253996336/,2016-07-21 15:11:28,12631,1458,1665,11630,537,37,298,27,103
15704546335_10154463243981336,,Outnumbered Fox News,video,https://www.facebook.com/OutnumberedFNC/videos/662437960576417/,2016-07-21 15:01:39,1595,683,0,1456,85,8,13,2,31
15704546335_10154463220011336,Donald J. Trump today on his walk through of the stage before his big speech tonight. Join us on Fox News Channel for full RNC coverage.,Timeline Photos,photo,https://www.facebook.com/FoxNews/photos/a.184044921335.134777.15704546335/10154463220011336/?type=3,2016-07-21 14:49:19,2637,356,120,2355,230,3,17,4,28
15704546335_10154463084556336,Liberal filmmaker Michael Moore had an interesting prediction about Donald J. Trump.,Michael Moore: 'Trump Will Win',link,http://insider.foxnews.com/2016/07/21/michael-moore-trump-will-win,2016-07-21 13:44:42,8581,1819,1538,7339,582,144,450,17,49
15704546335_10154462981246336,"Huckabee, Carson, Baier LIVE!

Post your questions for Mike Huckabee, Dr. Ben Carson and Bret Baier in the comments below!",,video,https://www.facebook.com/FoxNews/videos/10154462981246336/,2016-07-21 13:06:32,4164,4769,603,3280,767,22,47,12,36
15704546335_10154462921911336,"Flashback Video: During a Fox News debate in March, Ted Cruz said he would support Donald J. Trump if he became the Republican nominee. ""I gave my word that I would."" http://bit.ly/2ay5NrF",,video,https://www.facebook.com/FoxNews/videos/10154462921911336/,2016-07-21 12:29:51,8845,3891,6313,5971,53,239,965,96,1521
15704546335_10154462779236336,"""You're on fire! You're on fire, stupid!"" the Cleveland officer yelled at the protester.","Cop to Flag-Burning RNC Protester: 'You're on Fire, Stupid!'",link,http://insider.foxnews.com/2016/07/21/cop-flag-burning-rnc-protester-youre-fire-stupid,2016-07-21 11:29:58,46337,6086,19548,27216,1162,484,16714,144,617
15704546335_10154462657101336,"Breaking News: Police in Brazil arrest at least 10 people accused of pledging allegiance to ISIS, possibly plotting attack during Rio Olympics, justice minister announces. http://fxn.ws/2abvL5b",,status,,2016-07-21 10:31:55,4153,379,1476,2775,25,500,12,115,726
15704546335_10154462613126336,"""As long as I've got my hands up, they're not going to shoot me. This is what I'm thinking...wow, was I wrong,"" Charles Kinsey said.",VIDEO: Police Shoot Autistic Man's Caretaker as He Lies in Street,link,http://www.foxnews.com/us/2016/07/21/south-florida-police-shoot-autistic-mans-caretaker-as-lies-in-street.html,2016-07-21 10:12:43,11032,5394,5034,3200,25,630,62,2893,4222
15704546335_10154462534986336,"""What Cruz delivered was the longest suicide note in American political history,"" Charles Krauthammer said in reaction to Ted Cruz's RNC speech.",Krauthammer: Ted Cruz Has Destroyed His Political Career,link,http://insider.foxnews.com/2016/07/21/krauthammer-cruzs-rnc-speech-longest-suicide-note-political-history,2016-07-21 09:23:11,73413,15101,22004,60837,1060,690,6974,642,3210
15704546335_10154462434366336,"When asked if he'll vote for Donald J. Trump, Ted Cruz responds: ""I can tell you I'm not voting for Hillary.""",,video,https://www.facebook.com/FoxNews/videos/10154462434366336/,2016-07-21 08:28:21,11779,6863,1929,8672,324,148,615,142,1878
15704546335_10154461311771336,"Jesse Watters: ""What does fascism mean?""
Answer: ""Fascism is like a conservative revolution almost.""",Trump Is 'Straight Evil'?! Watters' World Talks to Protesters at the RNC,link,http://insider.foxnews.com/2016/07/20/watters-world-protests-republican-nation-convention-rnc,2016-07-21 07:49:22,6952,2321,3452,3365,81,507,2678,115,206
15704546335_10154462344906336,"Breaking News: Suspect arrested at Sydney, Australia police station, accused of ""deliberate"" plot targeting police; bomb squad investigating his car.",Arrest in Alleged Terror Plot at Sydney Police Station,link,http://www.foxnews.com/world/2016/07/21/bomb-squad-checking-car-at-australian-police-parking-garage.html,2016-07-21 07:29:51,1772,177,648,1013,12,92,1,188,466
15704546335_10154460864891336,Former N.W.A. rapper Ice Cube says he has no intention to stop performing the song in light of recent attacks against police.,Ice Cube Says He Won't Stop Performing Anti-Cop Anthem,link,http://insider.foxnews.com/2016/07/19/ice-cube-says-he-wont-stop-performing-f-tha-police,2016-07-21 06:30:00,8497,5300,2856,2137,184,119,85,758,5214
15704546335_10154461655081336,"Newt Gingrich spoke at the Republican National Convention, declaring that Donald J. Trump can keep America safe.",Timeline Photos,photo,https://www.facebook.com/FoxNews/photos/a.184044921335.134777.15704546335/10154461655081336/?type=3,2016-07-21 05:30:01,35868,855,3208,33557,2176,30,81,3,21
15704546335_10154461740996336,Gov. Mike Pence formally accepted the vice presidential nomination Wednesday night at the Republican National Convention.,Timeline Photos,photo,https://www.facebook.com/FoxNews/photos/a.184044921335.134777.15704546335/10154461740996336/?type=3,2016-07-21 04:30:01,67628,1493,10554,62450,4934,45,132,13,56
15704546335_10154461690416336,"""My father doesn't think in terms of demographic. He thinks in terms of the person.""

Ivanka Trump said her father ""lives gender equality"" by looking for the same qualities of drive, passion, and vision in both women and men equally.",,video,https://www.facebook.com/FoxNews/videos/10154461690416336/,2016-07-21 03:30:00,10734,371,856,9961,689,13,66,2,4
15704546335_10154461394136336,"""Freedom means free speech, not politically correct safe spaces.""

In his speech at the Republican National Convention, former candidate Ted Cruz said ""whether you are gay or straight, the Bill of Rights protects all of us.""",,video,https://www.facebook.com/FoxNews/videos/10154461394136336/,2016-07-21 02:30:00,5433,2617,440,3834,332,31,69,60,1107
15704546335_10154461516556336,"""[Donald J. Trump] could no longer stand to see the words 'Christmas' stripped from public use, or the Pledge of Allegiance removed from our schools in an effort to be politically correct."" 

What did you make of Eric Trump's RNC address?",,video,https://www.facebook.com/FoxNews/videos/10154461516556336/,2016-07-21 01:30:00,65605,3647,7368,58771,6449,201,120,11,57
15704546335_10154461503631336,"""Democrats are about to anoint someone who represents everything this country is tired of.""

Vice-presidential candidate Mike Pence said in a year where voters are crying out for change, Democrats offered a ""stale agenda and the most predictable of names.""",,video,https://www.facebook.com/FoxNews/videos/10154461503631336/,2016-07-21 00:30:00,16257,482,1640,15139,1023,8,32,5,50
15704546335_10154461705036336,"""Put your personal agenda aside and put your country first."" 

Sheriff David Clarke had strong words for Ted Cruz and people who refuse to endorse Donald J. Trump, adding, ""you got to come out of this thing as one team.""",,video,https://www.facebook.com/FoxNews/videos/10154461705036336/,2016-07-21 00:05:54,32489,1995,5367,30457,1770,43,118,32,70
15704546335_10154461589471336,"""The best unity I saw was everyone booing him off the stage, because I think everyone else in here has the sense to realize that the number one goal is to make sure we beat Hillary Clinton.""

Donald Trump Jr. reacted to Ted Cruz not endorsing his father during the Republican National Convention.",,video,https://www.facebook.com/FoxNews/videos/10154461589471336/,2016-07-20 23:33:53,14829,1151,1175,13828,703,25,67,14,192
15704546335_10154461575456336,Donald J. Trump responded on Twitter to Sen. Ted Cruz's non-endorsement at the end of his RNC address:,Timeline Photos,photo,https://www.facebook.com/FoxNews/photos/a.184044921335.134777.15704546335/10154461575456336/?type=3,2016-07-20 23:01:29,19781,3421,1612,17722,836,105,946,42,130
15704546335_10154461489701336,"""The cost of Hillary's dishonesty could be the loss of America as we know it.""

Newt Gingrich slammed Hillary Clinton during his Republican National Convention speech, adding ""the first step forward to safety is electing a leader who will be truthful to the American people.""",,video,https://www.facebook.com/FoxNews/videos/10154461489701336/,2016-07-20 22:30:52,26306,987,4021,24461,1696,42,55,13,39
15704546335_10154461488071336,"In an impassioned speech, Eric Trump called on Americans to ""vote for the candidate who can't be bought, sold, purchased, bribed, coerced, intimidated or steered from the path that is right and just and true!"" http://bit.ly/29OF0GO",,video,https://www.facebook.com/FoxNews/videos/10154461488071336/,2016-07-20 22:02:11,66811,2306,9255,60902,5403,102,327,5,72
15704546335_10154461386036336,Delegates at the Republican National Convention booed former presidential candidate Ted Cruz after he finished his speech without endorsing nominee Donald J. Trump. More: http://bit.ly/2a0igqA,,video,https://www.facebook.com/FoxNews/videos/10154461386036336/,2016-07-20 21:23:59,17433,9318,2426,11095,392,246,1084,333,4284
15704546335_10154461356271336,"Governor Scott Walker said ""liberal Washington insiders created these problems. And Hillary Clinton is the ultimate liberal Washington insider.""",Timeline Photos,photo,https://www.facebook.com/FoxNews/photos/a.184044921335.134777.15704546335/10154461356271336/?type=3,2016-07-20 21:01:01,17116,477,1561,15312,722,15,1034,6,27
15704546335_10154461315276336,"Live Now: Senator Ted Cruz, Eric Trump, Newt Gingrich and Vice Presidential Nominee Mike Pence. #RNCinCLE",,video,https://www.facebook.com/FoxNews/videos/10154461315276336/,2016-07-20 20:33:34,23893,38515,2355,16041,4591,226,413,257,2365
15704546335_10154461301936336,"""You must honor your pledge to support Donald J. Trump now. Tonight.""

Laura Ingraham addressed the former candidates with ""wounded feelings and bruised egos"" who have not endorsed Trump during her speech at the Republican National Convention.",,video,https://www.facebook.com/FoxNews/videos/10154461301936336/,2016-07-20 20:31:00,30327,2045,3458,27440,2578,47,92,8,162
15704546335_10154461217191336,"Laura Ingraham slammed Hillary Clinton in her RNC speech, saying ""she believes our greatness can only be found in the ever-growing bloated government bureaucracy that only she, her majesty, can rule over.""",Timeline Photos,photo,https://www.facebook.com/FoxNews/photos/a.184044921335.134777.15704546335/10154461217191336/?type=3,2016-07-20 19:58:44,28635,1200,3094,26101,2005,45,440,4,41
15704546335_10154461104561336,"Laura Ingraham, businessman Phil Ruffin and Florida Attorney General Pam Bondi speak at the Republican National Convention.",,video,https://www.facebook.com/FoxNews/videos/10154461104561336/,2016-07-20 19:05:00,21304,9183,3226,16720,4189,110,145,28,112
15704546335_10154460877416336,Retired U.S. Army Lt. Col. Charles Kettles wears the Medal of Honor after receiving it for his role in rescuing dozens of American soldiers pinned down by enemy fire in Vietnam. More: http://fxn.ws/2a1OZLy,Timeline Photos,photo,https://www.facebook.com/FoxNews/photos/a.184044921335.134777.15704546335/10154460877416336/?type=3,2016-07-20 18:50:00,28354,858,1982,25512,2658,169,8,3,4
15704546335_10154461027191336,Watch: Ted Cruz was interrupted at a rally with his supporters by Donald J. Trump's impeccably-timed jet – and the crowd wasn't too happy about it. http://bit.ly/2avydCw,,video,https://www.facebook.com/FoxNews/videos/10154461027191336/,2016-07-20 18:20:49,11433,3359,2257,6779,236,83,3731,43,561
15704546335_10154460940501336,Crazy Video: Police in Cleveland moved in to stop a woman from attempting to burn the American flag during a protest outside the RNC. http://bit.ly/2a9X9S5,,video,https://www.facebook.com/FoxNews/videos/10154460940501336/,2016-07-20 17:23:30,128861,62043,114397,82768,4345,1163,1234,1417,37936
15704546335_10154460463551336,"An Italian restaurant owner took heat for posting ""Black Olives Matter"" on a billboard.",Italian Restaurant Sees Surge in Business After Posting Controversial 'Black Olives Matter' Sign,link,http://www.foxnews.com/leisure/2016/07/20/italian-restaurant-sees-surge-in-business-after-posting-controversial-black/,2016-07-20 16:39:49,24127,3874,2675,14256,765,134,8904,17,51
15704546335_10154460765381336,,Shepard Smith,video,https://www.facebook.com/ShepardSmith/videos/10154189920750490/,2016-07-20 16:01:54,811,612,0,728,28,5,5,4,41
15704546335_10154460704896336,,Fox Business,video,https://www.facebook.com/FoxBusiness/videos/10154357614980238/,2016-07-20 15:39:01,30425,9247,4,17947,536,421,196,1577,9748
15704546335_10154460668406336,"An Oklahoma-based company is recalling 370,000 pounds of its hot dogs and corn dogs due to concerns over possible listeria contamination.",Massive Hot Dog Recall in All 50 States Due to Listeria Concerns,link,http://insider.foxnews.com/2016/07/20/bar-s-foods-hot-dogs-recalled-all-50-states-due-listeria-concerns,2016-07-20 15:20:48,1819,924,10422,1233,9,408,21,23,125
15704546335_10154460627541336,,Outnumbered Fox News,video,https://www.facebook.com/OutnumberedFNC/videos/661900693963477/,2016-07-20 15:02:35,1877,314,0,1781,68,12,9,1,6
15704546335_10154460550726336,Breaking News: A federal appeals court has ruled that Texas' strict voter ID law violates the Voting Rights Act and has ordered changes before the November election.,Federal Appeals Court Orders Changes to Texas Voter ID Law,link,http://www.foxnews.com/politics/2016/07/20/federal-appeals-court-orders-changes-to-texas-voter-id-law.html,2016-07-20 14:26:07,8343,5110,4704,2169,89,476,58,150,5401
15704546335_10154460471206336,"The fire chief told firefighters that the pro-police flag had to come down because, ""Some feel the flag is an attempt to incite further violence...""",Firefighters Forced to Remove Police Flag Due to 'Extremist' Fears,link,http://www.foxnews.com/opinion/2016/07/20/firefighters-forced-to-remove-police-flag-due-to-extremist-fears.html,2016-07-20 13:47:01,11091,3554,2684,1936,27,342,45,1407,7334
15704546335_10154460414196336,"What's it like to be a Republican on college campuses today? Dana Perino discusses that and more with two leaders of the College Republican National Committee now. 

Post your questions for Dana and the students below! #RNCinCLE",,video,https://www.facebook.com/FoxNews/videos/10154460414196336/,2016-07-20 13:16:44,3450,1395,585,2953,363,31,21,27,55
15704546335_10154460324326336,Live: Ted Cruz addresses delegates ahead of his RNC speech tonight in Cleveland.,,video,https://www.facebook.com/FoxNews/videos/10154460324326336/,2016-07-20 12:50:26,8052,11491,691,4972,1021,98,226,120,1615
15704546335_10154460263651336,"A speechwriter for Melania Trump is taking the blame for lifting passages from a 2008 Michelle Obama speech, admitting she made a 'mistake' – while saying she offered her resignation, but it was rejected. 

Full statement: http://bit.ly/29TWqSY",Timeline Photos,photo,https://www.facebook.com/FoxNews/photos/a.184044921335.134777.15704546335/10154460263651336/?type=3,2016-07-20 12:07:15,29234,3641,8309,26864,1566,110,607,20,68
15704546335_10154460210276336,"JUST IN: A Trump campaign speechwriter has released a statement apologizing for the controversy surrounding Melania Trump's RNC speech. Meredith McIver said the campaign rejected her resignation offer. 

Hear the full statement in the video below:",,video,https://www.facebook.com/FoxNews/videos/10154460210276336/,2016-07-20 11:49:28,17533,2908,7369,15944,1126,118,290,19,37
15704546335_10154460133156336,"The wall around Donald J. Trump's Hollywood star includes barbed wire, ""Keep Out"" signs and an American flag.",Someone Mockingly Put a Wall Around Trump's Hollywood Star,link,http://insider.foxnews.com/2016/07/20/someone-mockingly-put-wall-around-trumps-hollywood-star,2016-07-20 11:18:15,17373,3932,4594,9894,483,136,5636,106,1118
15704546335_10154460112136336,,FoxNews.com Digital Originals,video,https://www.facebook.com/FoxNewsLive/videos/1121940691200419/,2016-07-20 11:06:34,884,120,0,838,29,2,13,0,2
15704546335_10154460031026336,"Photos of the Day: You probably have never played 'Where's Waldo' like this before, but the children at Memorial Children's Hospital in South Bend, Indiana sure have! One fun-inspiring construction worker has been brightening their days with this 8-foot cardboard cutout. http://fxn.ws/2a8LC5v",Photos from Fox News's post,photo,https://www.facebook.com/FoxNews/photos/a.184044921335.134777.15704546335/10154460030156336/?type=3,2016-07-20 10:29:49,8415,196,974,7030,1321,12,49,2,1
15704546335_10154459928516336,What do you think of the billboard?,'Hate Cops?' Billboard Causes Uproar in Indiana,link,http://www.foxnews.com/us/2016/07/20/hate-cops-billboard-causes-uproar-in-indiana.html,2016-07-20 09:20:04,223087,11983,40544,183127,16237,668,22214,226,615
15704546335_10154459824446336,"A Black Lives Matter protest in Wichita, Kansas turned into a cookout with police officers!",Police Department and Community Come Together for Cookout,link,http://insider.foxnews.com/2016/07/19/wichita-police-department-and-community-come-together-cookout,2016-07-20 08:21:00,41712,1125,5308,36534,4863,262,45,3,5
15704546335_10154458833666336,"""They want to kill Americans, and they want to kill our way of life. They want to bring shariah law – they could care less about our Constitution.""  

Eric Trump asked ""how many more cities need to get hit?"" before the country takes the threat from terrorism seriously.",,video,https://www.facebook.com/FoxNews/videos/10154458833666336/,2016-07-20 07:26:36,30068,1032,6013,28390,1346,148,37,49,98
15704546335_10154458894381336,"Last night at the RNC, Donald Trump Jr. said Hillary Clinton ""is a risk Americans can't afford to take."" #RNCinCLE",Timeline Photos,photo,https://www.facebook.com/FoxNews/photos/a.184044921335.134777.15704546335/10154458894381336/?type=3,2016-07-20 06:30:00,47162,1358,10417,41846,2237,132,2804,47,96
15704546335_10154458885561336,"Watch: Former NYC Mayor Rudy Giuliani's defense of law enforcement scored the highest of anything we've seen so far at the 2016 GOP convention. (via Frank Luntz) 

What did you make of his speech?",,video,https://www.facebook.com/FoxNews/videos/10154458885561336/,2016-07-20 05:30:00,17601,636,2663,15829,1613,135,14,1,9
15704546335_10154458867496336,"""I'm not politically correct and I hate political correctness.""

Dr. Ben Carson said that secular progressives use political correctness ""to make people sit down and shut up while they change everything.""",,video,https://www.facebook.com/FoxNews/videos/10154458867496336/,2016-07-20 04:30:00,73329,2269,15702,66856,6119,201,89,16,48
