status_id,status_message,link_name,status_type,status_link,status_published,num_reactions,num_comments,num_shares,num_likes,num_loves,num_wows,num_hahas,num_sads,num_angrys
60342206410_10154299018116411,A little info with your drink,American Beers Are Getting Nutrition Labels,link,http://bit.ly/29T2CL0,2016-07-20 05:05:07,234,21,34,219,2,1,11,1,0
60342206410_10154298895221411,"A recently discovered ""rogue"" planet wasn't rogue after all - just really far away from its sun.","The Biggest Solar System Ever Found Is Very, Very Big",link,http://bit.ly/29T2FKT,2016-07-20 03:05:07,1361,22,108,1272,21,66,2,0,0
60342206410_10154298453321411,It cooked and served 200 sausages at an event earlier this month,Watch A German Robot Grill Sausages To Perfection,link,http://www.popsci.com/this-is-just-wurst-robot?src=SOC&dom=fb,2016-07-20 02:30:00,115,9,44,105,6,4,0,0,0
60342206410_10154298755796411,"Peace, love, and blacklight science",Feed Your Flowers Highlighter Juice For Psychedelic Petals,link,http://bit.ly/29SJ9u7,2016-07-20 01:05:07,165,7,44,150,1,11,2,1,0
60342206410_10154297641096411,"It's 13,000 times faster than the speed of human perception","The Only Way to Watch Glass Explode is at 300,000 Frames Per Second | Nerdist",link,http://nerdist.com/the-only-way-to-watch-glass-explode-is-at-300000-frames-per-second/?utm_source=facebook&utm_medium=social&utm_campaign=popsci,2016-07-20 00:00:00,1745,39,417,1607,34,101,3,0,0
60342206410_10154298611751411,Your head and your heart are more connected than you think.,A Spouse's Death Can Make Your Heart Miss A Beat,link,http://bit.ly/29SGGng,2016-07-19 23:05:07,978,22,136,833,8,60,3,73,1
60342206410_10154298448601411,"Should quarantines fail, it could spread to the greater population of the convention",Norovirus Spread Suspected At Republican National Convention,link,http://www.popsci.com/norovirus-spread-suspected-at-rnc?src=SOC&dom=fb,2016-07-19 22:00:00,202,37,82,143,3,7,47,2,0
60342206410_10154298381286411,"The Amazon CEO makes a cameo, though we don't know who he'll play","Jeff Bezos Appears In ""Star Trek Beyond""",link,http://bit.ly/29SoGW5,2016-07-19 21:05:08,92,9,6,91,0,0,1,0,0
60342206410_10154297936661411,If only school buses were like this when we were kids...,Experience A Virtual Trip To Mars In A School Bus,link,http://www.popsci.com/someone-built-mars-vr-experience-like-no-other-in-this-schoolbus?src=SOC&dom=fb,2016-07-19 20:30:01,208,6,36,195,4,8,1,0,0
60342206410_10154297928801411,The Indiana governor has made claims that are easily refuted by science,Trump VP Choice Mike Pence Doesn't Agree With Science,link,http://www.popsci.com/top-5-worst-mike-pence-quotes-on-science?src=SOC&dom=fb,2016-07-19 19:00:00,219,43,85,143,1,4,27,9,35
60342206410_10154297885441411,Which Star Trek doctor is your favorite?,Debate: Who Was The Best Star Trek Medical Officer?,link,http://www.popsci.com/debate-who-was-best-star-trek-medical-officer?src=SOC&dom=fb,2016-07-19 17:00:00,211,198,24,198,3,3,7,0,0
