status_id,status_message,link_name,status_type,status_link,status_published,num_reactions,num_comments,num_shares,num_likes,num_loves,num_wows,num_hahas,num_sads,num_angrys
60342206410_10154306085226411,The science behind the fifth taste.,Put The Science Of Umami To Work For You,link,http://bit.ly/2a0vIME,2016-07-22 23:05:12,42,2,7,42,0,0,0,0,0
60342206410_10154305223991411,The robot maker took its Atlas robot out for a walk in the woods,Watch The Boston Dynamics Robot Take A Surreal Hike In The Woods,link,http://www.popsci.com/boston-dynamics-robot-surreal-hike-in-woods,2016-07-22 22:00:01,40,2,8,36,0,1,1,2,0
60342206410_10154305870146411,Show me the honey!,Birds And Humans 'Talk' To Each Other To Outsmart Bees,link,http://bit.ly/2afjNrm,2016-07-22 21:05:05,40,1,4,39,0,1,0,0,0
60342206410_10154304932941411,These images are mind-blowing,"A Sea-Slug-Powered Robot, Zuckerberg's A.I. Toaster, And Other Amazing Images",link,http://www.popsci.com/slugbot-an-ai-toaster-and-other-amazing-images-week?src=SOC&dom=fb,2016-07-22 19:00:00,47,0,4,45,0,2,0,0,0
60342206410_10154305087756411,A strange plan to save humanity from extinction involves resurrecting the woolly mammoth,Zombie Mammoths To The Rescue,link,http://www.popsci.com/zombie-mammoths-to-rescue?src=SOC&dom=fb,2016-07-22 17:00:00,166,5,35,156,3,7,0,0,0
60342206410_10154305000391411,The results are...shocking,Watch Super-Powerful Electromagnets Shrink Quarters,link,http://www.popsci.com/watch-super-powerful-electromagnets-shrink-quarters?src=SOC&dom=fb,2016-07-22 16:30:00,129,1,25,126,0,3,0,0,0
60342206410_10154304997151411,It will be available for Netflix customers worldwide—except those in the U.S. and Canada,"Netflix Will Stream Every 'Star Trek' Series, Including The New One",link,http://www.popsci.com/netflix-will-stream-new-star-trek-series-worldwide?src=SOC&dom=fb,2016-07-22 16:00:00,517,31,84,420,24,6,2,9,56
60342206410_10154304992216411,"360 camera, smart baseball bats, and more",The Hit List For July 2016,link,http://www.popsci.com/hit-list-for-july-2016?src=SOC&dom=fb,2016-07-22 15:30:00,51,0,2,51,0,0,0,0,0
60342206410_10154304984891411,It maps over 1.2 million galaxies,Largest Map Ever Made Will Unlock The History Of The Universe,link,http://www.popsci.com/scientists-created-enormous-map-to-understand-history-universe?src=SOC&dom=fb,2016-07-22 15:00:00,487,9,82,435,20,32,0,0,0
60342206410_10154304980666411,"The ""Go"" in Pokémon Go isn't mandatory",Pokémon Go's Best Hacks And Cheats,link,http://www.popsci.com/pokemon-gos-best-hacks-and-cheats?src=SOC&dom=fb,2016-07-22 14:30:01,127,29,54,121,0,3,2,0,1
60342206410_10154305024706411,"That's one big gulp for man, one small gulp for drone kind",Watch The First Slurpee Delivery By Drone,link,http://www.popsci.com/watch-first-slurpee-delivery-by-drone?src=SOC&dom=fb,2016-07-22 14:00:01,122,9,23,102,7,3,9,1,0
60342206410_10154304874006411,Which Star Trek captain is your favorite?,Debate: Who Was The Best Captain In Star Trek?,link,http://www.popsci.com/debate-who-was-best-captain-in-star-trek?src=SOC&dom=fb,2016-07-22 13:30:00,328,419,47,310,11,5,1,0,1
60342206410_10154305051476411,"It's a lot more complicated than ""by being sticky"" (via SciShow)",SciShow,video,https://www.facebook.com/SciShow/videos/947941185237908/,2016-07-22 13:25:42,30,1,0,29,1,0,0,0,0
60342206410_10154304960016411,Fluorescent spinach drinks could someday be in the arsenal of methods for doctors to examine the gut,Glowing Green Juice Could Change How We Examine Intestines,link,http://www.popsci.com/glowing-green-juice-could-change-how-we-examine-intestines?src=SOC&dom=fb,2016-07-22 13:00:00,124,4,13,113,3,6,2,0,0
60342206410_10154304894346411,"Scientists know dark matter exists, but they've yet to observe it directly",Update: Dark Matter's Mysteries Remain Elusive,link,http://www.popsci.com/update-dark-matters-mysteries-remain-elusive?src=SOC&dom=fb,2016-07-22 12:30:00,278,10,33,270,1,4,3,0,0
60342206410_10154304868911411,"If rumors are true, we won't see the Apple Car for at least five years",Apple Delays Secretive Car Project,link,http://www.popsci.com/apple-delays-secretive-auto-project?src=SOC&dom=fb,2016-07-22 12:02:00,189,2,21,185,0,2,0,1,1
60342206410_10154304854961411,American special forces may be entering the pickup truck era of warfare,American Military Will Test Toyota Trucks For War,link,http://www.popsci.com/american-military-will-test-toyota-trucks-for-war?src=SOC&dom=fb,2016-07-22 11:42:59,493,107,93,438,5,13,33,1,3
60342206410_10154304785026411,The rover can now autonomously decide which rocks to zap with its onboard laser,The Mars Curiosity Rover Is Starting To Make Its Own Decisions,link,http://www.popsci.com/mars-curiosity-rover-make-own-decisions?src=SOC&dom=fb,2016-07-22 11:03:36,961,13,109,900,25,33,3,0,0
60342206410_10154304715496411,The pens North Korea is building now are for much larger submarines,North Korea Is Building Bigger Pens For Its Submarines,link,http://www.popsci.com/north-korea-is-building-bigger-submarine-pens?src=SOC&dom=fb,2016-07-22 10:31:18,180,22,14,159,4,9,3,2,3
60342206410_10154304631121411,"Elon Musk's new master plan for Tesla is so simple and so, so complicated",Tesla's New 4-Item To-Do List,link,http://www.popsci.com/teslas-new-plan-is-so-simple-and-so-so-complicated?src=SOC&dom=fb,2016-07-22 10:08:13,69,1,12,68,0,1,0,0,0
60342206410_10154304574946411,Conan had to be 3D-scanned to make his Mega Host suit,Conan O'Brien Becomes A Superhero For Comic-Con,link,http://www.popsci.com/see-conans-superhero-sized-transformation?src=SOC&dom=fb,2016-07-22 09:38:44,599,9,41,513,13,1,72,0,0
60342206410_10154304514931411,Some of the most commonplace technology today was inspired by Star Trek,6 'Star Trek' Technologies That Exist Today,link,http://www.popsci.com/6-techs-seen-on-star-trek-available-today?src=SOC&dom=fb,2016-07-22 09:01:25,177,5,49,169,5,3,0,0,0
60342206410_10154304467226411,She was on her way to a wedding on Los Angeles,Homeland Security Demands Access To Journalist's Phone,link,http://www.popsci.com/homeland-security-tries-to-get-into-journalists-phone?src=SOC&dom=fb,2016-07-22 08:33:44,266,17,39,181,1,22,2,5,55
60342206410_10154303060421411,"He giving her all she's got, Captain!","Star Trek's Simon Pegg: A Fanboy Grows Up, Takes Scotty's Chair, And Rethinks The Federation",link,http://www.popsci.com/star-treks-simon-pegg-fanboy-grows-up-takes-scottys-chair-and-rethinks-federation?src=SOC&dom=fb,2016-07-22 08:00:00,214,11,20,200,12,0,2,0,0
60342206410_10154304311341411,"It's notoriously difficult to direct cancer drugs to only the cells you want to target, but it may have just gotten easier",Drugs Disguised As Blood Cells Could Kill Cancer,link,http://bit.ly/29Ylit2,2016-07-22 07:05:08,726,10,131,667,22,33,2,2,0
60342206410_10154303057441411,I can see my house (and the rest of Earth)!,Watch One Year Of Earth From A Million Miles Away,link,http://www.popsci.com/one-year-earth-from-million-miles-away?src=SOC&dom=fb,2016-07-22 06:00:00,107,2,17,103,4,0,0,0,0
60342206410_10154304117286411,"The journey to Mars, told in GIFs",How Lockheed Martin Plans To Set Up A Base Camp In Mars' Orbit,link,http://bit.ly/29Y672N,2016-07-22 05:05:17,193,5,39,185,5,3,0,0,0
60342206410_10154303975981411,It's like fishing in the top two feet of the Mariana Trench,Most Of The Web Is Invisible To Google. Here's What It Contains,link,http://bit.ly/29Y9V8t,2016-07-22 03:05:07,681,20,171,627,6,41,4,2,1
60342206410_10154303051726411,Star Trek predicted and inspired a lot of technology,Status Report: 7 'Star Trek' Technologies Under Development,link,http://www.popsci.com/star-trek-technologies-where-are-they-now?src=SOC&dom=fb,2016-07-22 02:30:00,210,5,36,195,8,7,0,0,0
60342206410_10154303814241411,Neuroscientists identify 100 new regions within the brain's complex cerebral cortex,"This New, Ultra-Detailed Map Of The Brain Could Change Medicine",link,http://bit.ly/29XWQMs,2016-07-22 01:05:06,433,5,86,410,6,17,0,0,0
60342206410_10154297825591411,Recent iPhone leaks have told us more about what's NOT in the phone than what is (via Inverse),New iPhone 7 Leak Shows Apple May Cut More Features,link,https://www.inverse.com/article/18154-new-iphone-7-leak-shows-apple-may-cut-more-features?utm_source=facebook.com&utm_medium=realfuture&utm_campaign=swap,2016-07-22 00:00:01,242,40,25,219,7,3,8,3,2
60342206410_10154303672901411,Sticking it to stress,Acupuncture May Work Like Drugs To Relieve Stress,link,http://bit.ly/29XNz6S,2016-07-21 23:05:08,575,51,71,529,10,16,5,2,13
60342206410_10154303029716411,"Without the partnership, large swaths of the planet might look very different",Ants Have Been Farming Fungi Since The Dinosaurs Died Out,link,http://www.popsci.com/ants-have-been-farming-fungi-since-dinosaurs-died-out?src=SOC&dom=fb,2016-07-21 22:00:00,355,10,26,334,4,17,1,0,0
60342206410_10154303446906411,Five female scientists whose work blasted off,Women of NASA Get LEGO-sized Tribute,link,http://bit.ly/29XD5oh,2016-07-21 21:05:09,881,15,189,777,99,2,3,0,0
60342206410_10154303012926411,The relationship may date back 1.9 million years,Birds And Humans 'Talk' To Each Other To Outsmart Bees,link,http://www.popsci.com/humans-and-birds-collaborate-to-get-honey?src=SOC&dom=fb,2016-07-21 20:30:00,847,11,109,789,22,33,3,0,0
60342206410_10154303001686411,Bringing some modern tech into an old game,Watch A Working Jetpack Imitate A Golf Cart,link,http://www.popsci.com/watch-working-jetpack-imitate-golf-cart?src=SOC&dom=fb,2016-07-21 19:00:01,120,5,14,114,3,0,3,0,0
60342206410_10154302984031411,"I want to be the very best, like no bot ever was...",This Robot Catches Pokemon,link,http://www.popsci.com/robot-catches-pokemon?src=SOC&dom=fb,2016-07-21 17:30:01,170,3,15,155,3,2,9,1,0
60342206410_10154302960231411,Health officials are baffled as to how a Florida woman acquired the mosquito-borne virus,A Zika Patient In Florida May Have Acquired The Virus Locally,link,http://www.popsci.com/zika-infection-in-florida-not-from-sex-or-travel?src=SOC&dom=fb,2016-07-21 17:00:01,147,9,16,134,0,6,1,6,0
60342206410_10154302736286411,"They're the first Earth-sized worlds to crop up in a survey of more than 1,000 nearby red dwarf stars",Two Faraway Planets May Have Atmospheres That Can Support Life,link,http://www.popsci.com/hubble-will-help-study-alien-planet-atmospheres-to-see-if-they-can-support-life?src=SOC&dom=fb,2016-07-21 16:30:00,1046,14,114,970,26,44,4,2,0
60342206410_10154302727546411,All good things must come to an end,Rosetta Spacecraft Heads To Its Final Destination,link,http://www.popsci.com/this-will-be-rosetta-spacecrafts-final-destination?src=SOC&dom=fb,2016-07-21 16:00:00,263,4,20,240,2,13,0,7,1
60342206410_10154302805966411,'Star Trek Beyond' SPOILER FREE Review,,video,https://www.facebook.com/PopSci/videos/10154302805966411/,2016-07-21 15:57:54,383,66,40,342,25,9,3,2,2
60342206410_10154302726011411,The future is now,6 Star Trek Technologies That Exist Today,link,http://www.popsci.com/6-techs-seen-on-star-trek-available-today?src=SOC&dom=fb,2016-07-21 15:30:01,996,17,182,961,24,11,0,0,0
60342206410_10154302702206411,This time lapse is EPIC,Watch One Year Of Earth From A Million Miles Away,link,http://www.popsci.com/one-year-earth-from-million-miles-away?src=SOC&dom=fb,2016-07-21 14:59:28,1741,37,518,1570,90,80,0,1,0
60342206410_10154302515696411,Which of Star Trek's first officers is your favorite?,Debate: Who Was The Best First Officer In Star Trek?,link,http://www.popsci.com/debate-who-was-best-first-officer-in-star-trek?src=SOC&dom=fb,2016-07-21 14:30:00,210,162,19,197,8,3,1,1,0
60342206410_10154300145556411,"Learn to build your own keylogger, automated mobile application security, and more",Become an Ethical Hacker,link,https://shop.popsci.com/sales/ethical-hacking-bundle?utm_source=popsci&utm_medium=social-facebook&utm_campaign=ethical-hacking-bundle_072116_,2016-07-21 14:15:00,125,4,30,122,2,1,0,0,0
60342206410_10154302500531411,Mark wants an A.I. that can do everything Jarvis can in the Iron Man movies,Zuckerberg's A.I. Butler Learns When To Make The Toast,link,http://www.popsci.com/zuckerbergs-ai-pet-project?src=SOC&dom=fb,2016-07-21 14:03:00,204,8,22,197,2,3,2,0,0
60342206410_10154302330086411,Do you know more about NASA than Captain Kirk or Commander Spock?,Watch Star Trek Stars Chris Pine And Zachary Quinto Answer Questions About NASA,link,http://www.popsci.com/watch-star-trek-stars-chris-pine-and-zachary-quinto-answer-questions-about-nasa?src=SOC&dom=fb,2016-07-21 13:30:00,274,13,17,248,12,0,14,0,0
60342206410_10154302338206411,"""History has taught me never to expect too much from a Star Trek movie...but Star Trek Beyond surprised me. I actually left the theater grinning.""",'Star Trek Beyond' Review: Everything We Loved And Hated,link,http://www.popsci.com/star-trek-beyond-review?src=SOC&dom=fb,2016-07-21 12:30:27,468,26,44,444,13,2,8,0,1
60342206410_10154302307486411,"Livestreaming could become the new 9-1-1: an emergency call to the people, rather than the police",How Livestreaming Video Could Change The Face Of Justice,link,http://www.popsci.com/livestreaming-future-justice?src=SOC&dom=fb,2016-07-21 12:12:14,161,8,33,154,6,1,0,0,0
60342206410_10154302267476411,"The Flyboard holds the world record for the ""Farthest hoverboard flight""",Homeland Security Company Wants To Sell Hoverboards To The Military,link,http://www.popsci.com/homeland-security-company-wants-to-sell-hoverboards-to-military?src=SOC&dom=fb,2016-07-21 12:01:06,319,27,44,297,1,8,11,1,1
60342206410_10154302235736411,"NASA is on a quest for lighter, tougher rockets",Watch This New Rocket Material Crack Under Almost A Million Pounds Of Pressure,link,http://www.popsci.com/watch-nasa-test-new-rocket-materials-until-they-crack?src=SOC&dom=fb,2016-07-21 11:30:35,688,11,61,649,12,26,1,0,0
60342206410_10154302192701411,Facebook wants to connect the entire world with a network of drones that beam internet from the sky,Facebook's Internet-Beaming Drone Flies For The First Time,link,http://www.popsci.com/facebooks-internet-drone-flies-for-first-time?src=SOC&dom=fb,2016-07-21 11:06:59,1261,44,198,1163,34,59,1,0,4
60342206410_10154302124486411,The endangered species is getting some hi-tech help from scientists,"To Save Black-Footed Ferrets, Scientists Will Bring Back DNA From Frozen Specimens",link,http://www.popsci.com/to-save-black-footed-ferrets-scientists-will-bring-back-dna-from-frozen-specimens?src=SOC&dom=fb,2016-07-21 10:41:29,316,7,11,294,9,12,1,0,0
60342206410_10154302042381411,"Mmm...tasty, tasty science",New Website Will Reveal The Science Behind Your Favorite Foods,link,http://www.popsci.com/new-website-will-reveal-science-behind-your-favorite-foods?src=SOC&dom=fb,2016-07-21 10:01:32,125,4,11,119,1,4,1,0,0
60342206410_10154301995666411,They successfully conducted the first ever submarine rescue exercise in RIMPAC history,China and USA Train Together at Sub Rescue,link,http://www.popsci.com/china-and-usa-train-together-at-sub-rescue?src=SOC&dom=fb,2016-07-21 09:33:56,526,3,38,516,7,3,0,0,0
60342206410_10154301876621411,"Are you fit to command a spaceship? A new exhibit at the Intrepid Sea, Air & Space Museum will tell you where you'd serve on a ship in the Star Trek universe",You Can Enroll In Starfleet Academy,video,https://www.facebook.com/PopSci/videos/10154301876621411/,2016-07-21 09:15:00,1332,67,511,1186,96,44,4,2,0
60342206410_10154300399501411,An electrifying video,Watch A Sky Surfer Jump Out Of A Plane Into A Lightning Storm,link,http://www.popsci.com/watch-sky-surfer-jump-out-plane-into-lightning-storm?src=SOC&dom=fb,2016-07-21 09:00:00,165,8,30,140,1,24,0,0,0
60342206410_10154301866601411,Some Star Trek tech is closer to science fact than science fiction,Status Report: 7 'Star Trek' Technologies Under Development,link,http://www.popsci.com/star-trek-technologies-where-are-they-now?src=SOC&dom=fb,2016-07-21 08:33:00,1772,43,458,1659,64,46,3,0,0
60342206410_10154300405976411,2016 is off to a bad start,The First Half Of 2016 Saw Some Really Disturbing Climate Trends,link,http://www.popsci.com/first-half-2016-saw-some-really-disturbing-climate-trends?src=SOC&dom=fb,2016-07-21 08:00:00,114,16,33,82,2,11,2,14,3
60342206410_10154301725941411,But there are good reasons why humans have longer nasal passages than their relatives,Your Nose Is Bad At Warming Air,link,http://bit.ly/29VZ0Mu,2016-07-21 07:05:08,171,6,21,165,1,5,0,0,0
60342206410_10154300986626411,Elon Musk completed his master plan for Tesla...so he made a new one,Tesla's New 4-Item To-Do LIst,link,http://www.popsci.com/teslas-new-plan-is-so-simple-and-so-so-complicated?src=SOC&dom=fb,2016-07-21 06:00:01,135,6,10,128,3,4,0,0,0
60342206410_10154301504211411,It could help countries achieve disarmament without spilling secrets,This New Method Could Tell The Difference Between Fake Nukes and Real Ones,link,http://bit.ly/29VwVkl,2016-07-21 05:05:06,249,2,22,241,2,5,0,0,1
60342206410_10154301340946411,Open up that window and let in some fresh air.,"Yes, The Air In Your Office Is Slowing Down Your Brain",link,http://bit.ly/29VkZyX,2016-07-21 03:05:09,353,24,122,326,0,19,4,4,0
60342206410_10154300367166411,Which alien on Star Trek was your favorite?,Who Was The Best Non-Human Character In Star Trek?,link,http://www.popsci.com/debate-who-was-best-non-human-star-trek-character?src=SOC&dom=fb,2016-07-21 02:30:01,237,258,21,227,6,3,1,0,0
60342206410_10154301187716411,Somewhere between a zombie and a cyborg,A Sea Slug's Mouth Muscles Power This 3D-Printed Robot,link,http://bit.ly/29VabRh,2016-07-21 01:05:06,152,4,12,144,3,5,0,0,0
60342206410_10154287930136411,Fertility is very dependent on the individual (via Quartz),The idea that a woman's fertility plummets at age 35 comes from bad science,link,http://qz.com/729821/the-idea-that-a-womans-fertility-plummets-at-age-35-comes-from-bad-science/?utm_source=parPS,2016-07-21 00:00:00,543,28,149,524,4,13,1,1,0
60342206410_10154301052741411,It's why older scotches and bourbons taste better,What Happens As Decades Pass In A Whiskey Barrel?,link,http://bit.ly/29VdNqH,2016-07-20 23:05:07,357,7,66,345,6,6,0,0,0
60342206410_10154300358306411,The first celebrity would be Alexander McQueen,Scientist-Designer Wants to Make Leather Using Celebrity DNA,link,http://www.popsci.com/scientist-designer-wants-to-make-leather-using-celebrity-dna?src=SOC&dom=fb,2016-07-20 22:00:00,135,25,28,106,1,20,6,2,0
60342206410_10154300823051411,"But instills a healthy amount of fear, too","A New Climate Change Documentary Focuses On Solutions, Not Doom",link,http://bit.ly/29V30wG,2016-07-20 21:05:07,181,2,36,179,1,1,0,0,0
60342206410_10154300820491411,"BREAKING: Elon Musk just unveiled Tesla's new master plan, and it's got some surprises...",Tesla's New 4-Item To-Do LIst,link,http://pops.ci/Vg4ATQ,2016-07-20 21:03:08,1439,30,205,1341,73,23,2,0,0
60342206410_10154300308231411,"The set includes Sally Ride, Margaret Hamilton, Katherine Johnson, Mae Jemison, and Nancy Grace Roman.",Women of NASA Get LEGO-sized Tribute,link,http://www.popsci.com/women-nasa-get-lego-sized-tribute?src=SOC&dom=fb,2016-07-20 20:30:01,3918,51,899,3480,392,44,2,0,0
60342206410_10154300321501411,This stunt is truly shocking,Watch A Sky Surfer Jump Out Of A Plane Into A Lightning Storm,link,http://www.popsci.com/watch-sky-surfer-jump-out-plane-into-lightning-storm?src=SOC&dom=fb,2016-07-20 19:00:00,590,35,107,533,14,39,2,2,0
60342206410_10154300318441411,"There have been over 29,000 wildfires this year",Wildfires Have Burned More Than 2.6 Million Acres So Far This Year,link,http://www.popsci.com/climate-change-making-wildfires-worse-department-interior?src=SOC&dom=fb,2016-07-20 17:30:01,269,26,70,195,1,19,2,46,6
60342206410_10154300331661411,"""This is a chance I could not pass up: we can raise awareness of how the U.S. human space program has slowed over the years.""",First Female Commander Of A Space Shuttle To Speak At RNC,link,http://www.popsci.com/first-female-commander-space-shuttle-to-speak-at-rnc?src=SOC&dom=fb,2016-07-20 17:00:00,447,44,39,412,16,13,2,2,2
60342206410_10154300287431411,The 23-year-old penguin can walk more easily thanks to these middle schoolers,Watch Purps The Penguin Get A Sweet New Boot,link,http://www.popsci.com/watch-purps-penguin-get-sweet-new-boot?src=SOC&dom=fb,2016-07-20 16:30:00,226,5,17,216,7,2,1,0,0
60342206410_10154300246511411,Teaching young adults and adolescents about safe sex in their own language,New York City Is Using Emojis To Teach Sex Ed,link,http://www.popsci.com/new-york-uses-emojis-for-sex-ed?src=SOC&dom=fb,2016-07-20 16:03:01,67,15,6,57,0,2,6,0,2
60342206410_10154300214801411,Goodness gracious! Great rings of fire!,Backyard Vortex Cannon Shoots Rings Of Fire,link,http://www.popsci.com/backyard-vortex-cannon-shoots-rings-fire?src=SOC&dom=fb,2016-07-20 15:36:44,169,4,18,159,2,8,0,0,0
60342206410_10154300158786411,"""To make delivery drones work, the drones will either need to fly only short distances, or they'll need places to recharge along the way""",Amazon Patent Lets Drones Perch On Streetlight Recharging Stations,link,http://www.popsci.com/amazon-patent-puts-drones-on-streetlight-recharging-stations?src=SOC&dom=fb,2016-07-20 15:13:32,449,21,95,420,8,18,3,0,0
60342206410_10154300023631411,He runs current through a pencil and it lights on fire,This Guy Is So Hype On Graphite,link,http://www.popsci.com/this-guy-is-so-hype-on-graphite?src=SOC&dom=fb,2016-07-20 14:30:01,344,19,44,293,8,9,33,0,1
60342206410_10154299640371411,"The experiment is inspired by the Tibetan Buddhist meditation practice of ""tummo""",Could Heat Make Depression Melt Away?,link,http://www.popsci.com/could-fever-machines-make-depression-melt-away?src=SOC&dom=fb,2016-07-20 14:00:00,375,38,79,345,4,25,1,0,0
60342206410_10154299881126411,January 2016 to June 2016 is the hottest six-month period on record,The First Half Of 2016 Saw Some Really Disturbing Climate Trends,link,http://www.popsci.com/first-half-2016-saw-some-really-disturbing-climate-trends?src=SOC&dom=fb,2016-07-20 13:30:01,233,3,58,176,0,17,1,32,7
60342206410_10154299820486411,Amazon Prime directive,See Amazon CEO Jeff Bezos In Costume As An Alien in 'Star Trek Beyond',link,http://www.popsci.com/see-amazon-ceo-jeff-bezos-as-an-alien-in-star-trek-beyond?src=SOC&dom=fb,2016-07-20 13:00:01,214,9,25,197,0,3,14,0,0
60342206410_10154299807186411,It reveals 180 new distinct regions in each hemisphere,"This New, Ultra-Detailed Map Of The Brain Could Change Medicine",link,http://www.popsci.com/new-map-brain-is-most-detailed-atlas-yet-of-distinct-regions?src=SOC&dom=fb,2016-07-20 12:30:50,623,10,168,583,15,25,0,0,0
60342206410_10154299701236411,The Viking 1 Lander gave humanity its first look at the Red Planet,Robots Have Been Visiting Mars For 40 Years Today,link,http://www.popsci.com/robots-have-been-visiting-mars-for-40-years-today?src=SOC&dom=fb,2016-07-20 12:00:01,1978,14,193,1865,66,46,1,0,0
60342206410_10154299656896411,"Forty-seven years ago today, Apollo 11 astronauts landed on the moon.",Take A Digital Tour Of The Apollo 11 Command Module,link,http://www.popsci.com/take-digital-tour-apollo-11-command-module?src=SOC&dom=fb,2016-07-20 11:30:00,1015,26,221,964,32,19,0,0,0
60342206410_10154299633591411,X marks the spot,How Two Astronomers On Twitter Discovered The Center Of Our Galaxy,link,http://www.popsci.com/how-two-astronomers-on-twitter-discovered-center-our-galaxy?src=SOC&dom=fb,2016-07-20 11:03:01,804,20,83,760,14,26,4,0,0
60342206410_10154299607141411,"Even though it drinks, the slow loris doesn't get drunk",These Adorable Creatures Just Want A Drink,link,http://www.popsci.com/these-adorable-creatures-just-want-drink?src=SOC&dom=fb,2016-07-20 10:46:04,154,3,9,146,2,5,1,0,0
60342206410_10154299540886411,This past June was the hottest June on record since record-keeping started in 1880,This June Was The Hottest June Ever On Record,link,http://www.popsci.com/this-june-was-hottest-june-on-record?src=SOC&dom=fb,2016-07-20 10:04:38,814,77,415,599,2,83,11,95,24
60342206410_10154299476336411,"Forty-seven years ago, on July 20, 1969, Neil Armstrong and Buzz Aldrin made the first footprints on the Moon, and it was epic.",Here's Our Original Coverage of Apollo 11,link,http://www.popsci.com/article/science/heres-our-original-coverage-apollo-11?src=SOC&dom=fb,2016-07-20 09:31:21,1428,51,463,1326,68,30,4,0,0
60342206410_10154299434626411,Who makes the rules of a virtual world?,Virtualandia: The Hottest New Real Estate Is In The Ether,link,http://www.popsci.com/virtualandia?src=SOC&dom=fb,2016-07-20 09:06:05,103,7,11,97,2,0,4,0,0
60342206410_10154299364581411,"If all goes to plan, humanity will be an interplanetary species by 2028",EXCLUSIVE: How Lockheed Martin Plans To Set Up A Base Camp In Mars' Orbit,link,http://www.popsci.com/lockheed-martins-plan-to-set-up-mars-base-camp?src=SOC&dom=fb,2016-07-20 08:32:01,2081,56,415,1924,78,73,4,1,1
60342206410_10154298500586411,"Motors, models, magnets, and more",How The 'Force Awakens' Crew Filmed BB-8,link,http://www.popsci.com/how-force-awakens-team-filmed-bb-8?src=SOC&dom=fb,2016-07-20 08:00:01,73,6,3,71,1,1,0,0,0
60342206410_10154299235431411,No joke: This scientist spent nine years developing a fish-massage system for cruelty-free caviar.,How To Produce Caviar Without Killing: Sturgeon Massage,link,http://bit.ly/29TgrsR,2016-07-20 07:05:06,222,8,26,201,6,13,2,0,0
60342206410_10154297941591411,Looking to get into astronomy? Here are some tips from McDonald Observatory superintendent Craig Nance.,How To Become An Amateur Astronomer,video,https://www.facebook.com/PopSci/videos/10154297941591411/,2016-07-20 07:00:00,1116,33,473,1061,42,10,3,0,0
60342206410_10154298495966411,Evolve your game,Pokémon Go's Best Hacks And Cheats,link,http://www.popsci.com/pokemon-gos-best-hacks-and-cheats?src=SOC&dom=fb,2016-07-20 06:00:00,123,24,26,117,1,3,2,0,0
