status_id,status_message,link_name,status_type,status_link,status_published,num_reactions,num_comments,num_shares,num_likes,num_loves,num_wows,num_hahas,num_sads,num_angrys
10606591490_10153854348381491,Great advice for recent college grads.,"How One College Grad Paid Off $28,000 in 3 Years on a $30,000 Salary",link,http://ti.me/29U0vdL,2016-07-22 23:30:07,35,7,6,35,0,0,0,0,0
10606591490_10153854315606491,From balaclavas to Pussy riot face masks.,Watch 100 Years of Russian Beauty Trends in Less Than 2 Minutes,link,http://ti.me/29R5o1T,2016-07-22 23:00:28,175,12,24,163,9,3,0,0,0
10606591490_10153854253356491,What would Hodor say if he could talk?,Game of Thrones' Kristian Nairn on What Hodor Would Say to Bran,link,http://ti.me/2af5y5V,2016-07-22 22:30:13,76,16,4,72,1,0,3,0,0
10606591490_10153854195321491,"1. Don't obsess over ""how"" you'll do something.",10 Daily Habits That Will Radically Improve Your Life,link,http://ti.me/2agckI8,2016-07-22 22:00:58,357,14,83,351,6,0,0,0,0
10606591490_10153854161621491,"""Jon does like redheads.""",Here's What Sophie Turner Said About a Jon Snow-Sansa Stark Marriage,link,http://ti.me/2af4hvD,2016-07-22 21:30:10,280,23,13,238,10,1,31,0,0
10606591490_10153854130061491,5. Martha Stewart is not afraid to say it like it is.,7 Reasons Why Martha Stewart Is Living Her Best Life,link,http://ti.me/2afvSwi,2016-07-22 21:00:37,83,4,10,83,0,0,0,0,0
10606591490_10153854091821491,"""Maybe it's a way to make us feel better about ourselves because we don't act this crazy?""",Why Taylor Swift and Kim Kardashian West Act Like Mean Girls,link,http://ti.me/29QQptl,2016-07-22 20:30:14,157,34,9,143,1,1,10,2,0
10606591490_10153854048791491,Zachary Quinto talks to TIME about Star Trek Beyond and how it reflects the world today.,Zachary Quinto on the vision of 'Star Trek',video,https://www.facebook.com/time/videos/10153854048791491/,2016-07-22 20:00:46,167,6,33,156,11,0,0,0,0
10606591490_10153854018096491,Hillary Clinton has picked her running mate.,Hillary Clinton Chooses Tim Kaine as Her Running Mate,link,http://ti.me/2afcm3i,2016-07-22 19:31:36,1374,124,101,1186,114,8,37,2,27
10606591490_10153854016411491,Starring a tongue-tied Tyrion.,This 'Game of Thrones' Blooper Reel Is a Gift from the Gods,link,http://ti.me/29Uq9JN,2016-07-22 19:30:11,1139,67,175,952,55,1,131,0,0
10606591490_10153853979711491,What do you think?,Here's How John Bradley Wants Sam to Die on 'Game of Thrones',link,http://ti.me/29UrAYS,2016-07-22 19:00:03,92,8,2,89,2,0,0,0,1
10606591490_10153853946651491,"""My career has got problems, my publicist tries to solve them.""",These Fake Taylor Swift Songs About Her Feud With Kanye West and Kim Kardashian Are Perfect,link,http://ti.me/2aiYMLU,2016-07-22 18:30:02,92,5,3,87,0,1,4,0,0
10606591490_10153853894661491,"""I'm not sure she thinks Jon is capable of being King of the North.""",Here's Why Sansa Stark Didn't Tell Jon Snow About Littlefinger,link,http://ti.me/2a04QMQ,2016-07-22 17:50:07,260,16,14,243,10,6,1,0,0
10606591490_10153853862856491,He's now back in fourth place—but still doing just fine.,Amazon CEO Jeff Bezos Briefly Became the World's Third-Richest Person,link,http://ti.me/2ajvQU6,2016-07-22 17:30:10,172,10,13,158,5,7,1,1,0
10606591490_10153853815036491,Did Ivanka Trump get her earring back?,Student Starts Social Media Campaign to Return Ivanka Trump's Lost Earring,link,http://ti.me/29Zm9cJ,2016-07-22 17:00:20,177,46,6,148,3,1,24,0,1
10606591490_10153853768296491,Kristen Bell might be a bigger Game of Thrones fan than you.,Kristen Bell on Why Anna From 'Frozen' and Arya Stark Are Basically the Same Person,link,http://ti.me/29QWQwp,2016-07-22 16:30:20,204,12,11,197,3,0,4,0,0
10606591490_10153853721446491,"Amber Rose:  ""Why didn't I get a phone call for using a naked wax figure in your video Kanye? I mean, Taylor Swift gets a call but I don't get a call.""",This Is What Amber Rose Has to Say About the Taylor Swift-Kim and Kanye Feud,link,http://ti.me/2amytYa,2016-07-22 16:00:32,597,74,12,500,16,2,76,0,3
10606591490_10153853680336491,Live from Comic-Con floor in San Diego,,video,https://www.facebook.com/time/videos/10153853680336491/,2016-07-22 15:42:43,1774,316,225,1540,144,47,23,7,13
10606591490_10153853651741491,"""I might have to go drink some water,"" said a former mayor.",This Colorado Town Is at Risk of Getting High on Its Own Water Supply,link,http://ti.me/29Zk5FG,2016-07-22 15:30:14,733,63,160,572,21,17,122,0,1
10606591490_10153853610696491,Talk about living the high life.,Tour the Western Hemisphere's Tallest Residential Tower,link,http://ti.me/2ahurkd,2016-07-22 15:00:46,100,9,14,94,0,2,2,1,1
10606591490_10153853547561491,Middle siblings are a bit of a puzzle.,How Your Birth Order Affects Your Odds of Success,link,http://ti.me/2aeGTOv,2016-07-22 14:30:19,123,21,51,116,5,0,2,0,0
10606591490_10153853461226491,"Just because you're not smoking a pack a day, doesn't mean you're in the clear.",Do Social Smokers Face Real Risks Too?,link,http://ti.me/2aeAcMx,2016-07-22 14:05:09,111,22,18,107,1,2,0,1,0
10606591490_10153853413806491,"Fans of Lost and The Office, this one's for you.",Kristen Bell's New Comedy Is Like 'Lost' Meets 'The Office',link,http://ti.me/2ahdiqy,2016-07-22 13:30:13,182,21,13,170,6,4,2,0,0
10606591490_10153853372601491,"Adele: ""I haven't been kissed by another man in like six years!""",Adele Accidentally Kissed A Fan at Her Concert,link,http://ti.me/2amfRr8,2016-07-22 13:00:32,3693,127,115,3113,166,44,366,2,2
10606591490_10153853318166491,She warns that alcohol has been strongly linked to at least 7 different types of cancer.,Expert Warns That The Alcohol-Cancer Link Is 'Strong',link,http://ti.me/2aenSff,2016-07-22 12:30:15,314,36,193,245,3,49,2,13,2
10606591490_10153853246821491,"""It's a strange feeling to be pretty confident you'll go to sleep happy on election night, while also deeply worried about what you'll wake up to the next morning.""","Even If Donald Trump Loses, the Worst Is Yet to Come",link,http://ti.me/2ah0QXW,2016-07-22 12:02:03,356,60,77,309,2,15,3,24,3
10606591490_10153853211041491,See the most unexpected moments of the Republican convention. http://ti.me/29YTHI5,The RNC's Most Unexpected Moments,video,https://www.facebook.com/time/videos/10153853211041491/,2016-07-22 11:48:31,517,64,89,356,4,13,134,4,6
10606591490_10153853157926491,Team Taylor Swift or Team Kim Kardashian West?,Fergie Weighs In On The Taylor Swift-Kimye Feud,link,http://ti.me/2ae8fEJ,2016-07-22 11:30:20,210,71,3,198,2,0,6,0,4
10606591490_10153853101061491,"Celine Dion and Jimmy Fallon teamed up for Drake's ""One Dance.""","Watch Céline Dion Imitate Cher, Rihanna and Sia on 'The Tonight Show'",link,http://ti.me/29QtUod,2016-07-22 11:00:28,470,7,20,434,23,2,11,0,0
10606591490_10153853040676491,"""As a liberal, I shouldn't feel guilty liking Donald J. Trump's daughter.""",Are You Allowed to Like Ivanka and Still Hate Donald?,link,http://ti.me/2alY2sq,2016-07-22 10:31:03,5776,758,468,5233,154,19,350,2,18
10606591490_10153852991931491,"""A hundred years from now, I wonder how this time in America will be remembered and viewed.""","A Witness to the Characters, Chaos and Colors at the RNC",link,http://ti.me/2agO23J,2016-07-22 10:00:14,87,20,7,82,0,0,0,5,0
10606591490_10153852937796491,"On the 25th anniversary of the ""cannibal-murderer's"" arrest.",This Is How Police Caught Jeffrey Dahmer,link,http://ti.me/29TmU5A,2016-07-22 09:30:09,554,57,111,507,9,30,0,4,4
10606591490_10153852876111491,"Donald J. Trump had previously said that ""if Ivanka wasn't my daughter, perhaps I'd be dating her.""",The Internet Erupted Over Donald Trump's Embrace of Ivanka at RNC,link,http://ti.me/2agF9Hx,2016-07-22 09:00:07,3173,1158,562,1981,44,423,565,38,123
10606591490_10153852828176491,It's like Jon Stewart never left.,"Watch Jon Stewart Skewer the GOP, Trump and Fox News on 'Late Show'",link,http://ti.me/2aAHiKl,2016-07-22 08:30:19,4438,339,930,3585,697,9,130,3,14
10606591490_10153852781476491,"Happy birthday, Prince George!",See Prince George's Cutest Moments as He Turns Three,link,http://ti.me/2adGhc4,2016-07-22 08:00:54,3392,74,107,3113,261,13,4,0,1
10606591490_10153852740631491,Adorable.,See Cute Photos of Prince George As He Turns Three,link,http://ti.me/2ahBndL,2016-07-22 07:30:22,1849,22,31,1753,92,4,0,0,0
10606591490_10153852699231491,"""Not everything is going to pan out perfectly for you or the person whose talent you're fostering.""",A Hollywood Talent Manager on How to Foster Talent,link,http://ti.me/2ahxrK1,2016-07-22 07:01:03,136,2,12,136,0,0,0,0,0
10606591490_10153852645461491,What's taking so long to change the chicken industry?,Why We Need Happier Chickens,link,http://ti.me/2aA8V6h,2016-07-22 06:30:17,106,6,14,105,1,0,0,0,0
10606591490_10153852568431491,"The good, the bad, and the ugly.",Watch 100 Years of Men's Fashion in Under Three Minutes,link,http://ti.me/29XWql5,2016-07-22 05:30:20,383,15,62,367,14,1,1,0,0
10606591490_10153852538086491,The announcement possibly ends all hopes of solving aviation's greatest mystery.,Search for MH370 to Be Suspended,link,http://ti.me/29SJs6C,2016-07-22 05:00:17,135,11,13,109,1,5,1,18,1
10606591490_10153852510661491,Swiss authorities have seized Monet and van Gogh paintings.,Swiss Police Seizes Art Amid Malaysia Corruption Probe,link,http://ti.me/29Rmn4N,2016-07-22 04:30:09,106,4,11,95,1,6,4,0,0
10606591490_10153852477426491,Want to learn how to take better food pictures for your Instagram?,Patrick Janelle's Tips to Take Great Food Photographs,link,http://ti.me/2a50hOK,2016-07-22 04:00:11,148,14,20,142,2,0,4,0,0
10606591490_10153852437176491,It was a defiant show of force after an ultra-Orthodox Jew stabbed a 16-year-old girl to death.,Thousands March in Jerusalem's Pride Parade One Year After Attack,link,http://ti.me/29SrqkL,2016-07-22 03:30:05,195,9,9,174,11,0,0,9,1
10606591490_10153852403686491,Hilarious.,Watch Matt Damon Do His Impression of John Malkovich,link,http://ti.me/29XONin,2016-07-22 03:00:40,222,6,10,212,3,1,6,0,0
10606591490_10153852366611491,"""Trump picked a fight with the wrong 15-pound, 200-year-old-marionette baby!""",Kate McKinnon's Ruth Bader Ginsburg Back to Own Donald Trump,link,http://ti.me/2a4FPNV,2016-07-22 02:30:11,487,12,14,414,24,0,48,0,1
10606591490_10153852315321491,Wild.,Get Sia's Signature Look With New Snapchat Filter,link,http://ti.me/2ah4Apm,2016-07-22 02:00:34,439,29,20,380,21,0,37,0,1
10606591490_10153852283846491,It's Pokemon's home country.,Pokemon Go Launches in Japan,link,http://ti.me/29XG7sB,2016-07-22 01:30:07,940,47,79,849,61,3,20,5,2
10606591490_10153852257051491,"""He was just a little bear with a big problem.""",Baby Bear With Head Stuck in Cheese Balls Jar Gets Rescued,link,http://ti.me/29YQjxT,2016-07-22 01:00:16,189,13,28,165,10,1,10,3,0
10606591490_10153852222591491,Watch Trump's Acceptance Speech http://ti.me/29Xvzpc,Trump's Acceptance Speech,video,https://www.facebook.com/time/videos/10153852222591491/,2016-07-22 00:31:33,492,144,94,273,12,10,64,15,118
10606591490_10153852182931491,"Ivanka Trump: ""When my father says that he will make America great again, he will deliver.""",Ivanka Trump Steals the Show,link,http://ti.me/2afyBZA,2016-07-22 00:00:40,3521,367,200,2890,167,19,372,14,59
10606591490_10153852148436491,"Donald J. Trump: ""Hillary Clinton, I think, is a terrific woman.""",Hillary Clinton Releases Ad Featuring Donald Trump Praising Her,link,http://ti.me/29Xiss5,2016-07-21 23:30:12,4150,323,364,3063,267,16,778,3,23
10606591490_10153852115321491,"""You can't plan everything, and you can't control everything. Embrace that!""",The Secret to My Success Can't Be Taught in Business School,link,http://ti.me/2adIZ4i,2016-07-21 23:00:17,211,5,49,208,3,0,0,0,0
10606591490_10153852057706491,"Though she is a lifelong Republican, she may not support Donald J. Trump.",Meet the First Hispanic Republican Female Governor,link,http://ti.me/29OCZhc,2016-07-21 22:30:06,439,62,23,393,22,3,20,0,1
10606591490_10153852004861491,"""Today I see this moment and feel only love for myself.""",Brie Larson Used to Be Embarrassed of Her Appearance,link,http://ti.me/2agd7si,2016-07-21 22:00:34,204,6,8,193,8,2,1,0,0
10606591490_10153851957141491,"""When I see him, I see the message of grace.""",Meet Donald Trump's Top Pastor,link,http://ti.me/2agRLek,2016-07-21 21:30:28,301,89,36,193,11,6,72,4,15
10606591490_10153851898146491,Watch Delegates Impersonate Donald Trump http://ti.me/29XCgLY,Watch Delegates Impersonate Donald Trump,video,https://www.facebook.com/time/videos/10153851898146491/,2016-07-21 21:00:35,234,61,37,166,8,0,50,2,8
10606591490_10153851853976491,Ever notice how the insects seem to feast on some folks while ignoring the rest?,Why Mosquitoes Bite Some People and Not Others,link,http://ti.me/2axsTyo,2016-07-21 20:30:07,1046,396,761,962,5,48,5,7,19
10606591490_10153851811406491,"""Put clothes on at the convention. We're conservative.""",Conservatives Are Not Happy With Megyn Kelly's Convention Clothing,link,http://ti.me/2aeWeSh,2016-07-21 20:00:23,1541,606,123,771,21,42,568,13,126
10606591490_10153851791021491,The Fox News CEO was undone by his own creation,How Roger Ailes Became the Most Powerful Man in TV News,link,http://ti.me/2agJkQm,2016-07-21 19:46:26,87,7,2,81,1,0,5,0,0
10606591490_10153851732461491,"""When you move a little too fast on the first date.""",The Internet Is Losing Its Mind Over Donald Trump's Air Kiss Fail,link,http://ti.me/29WQ31e,2016-07-21 19:00:19,1278,94,83,818,14,5,432,2,7
10606591490_10153851622256491,Will one glass of wine really hurt?,Is It Risky to Drink While You're on Medication?,link,http://ti.me/2ag0duq,2016-07-21 18:00:44,156,16,48,153,0,3,0,0,0
10606591490_10153851507211491,Officers thought the 27-year-old patient's toy truck was a firearm.,Florida Cop Who Shot Therapist Was Aiming for Autistic Patient and Missed,link,http://ti.me/2agm6K6,2016-07-21 17:00:19,3862,1109,1863,1347,8,179,42,509,1777
10606591490_10153851461951491,"Demi Lovato: ""I joke that I sometimes have PTSD after leaving.""",Demi Lovato and Nick Jonas Reveal What Disney Was Actually Like,link,http://ti.me/2aeNZFN,2016-07-21 16:30:36,397,26,19,369,9,12,1,1,5
10606591490_10153851427021491,Her son survived the shooting.,Chicago Gang Member Sentenced for Shooting Pregnant Teen to Death,link,http://ti.me/29Xa3Fd,2016-07-21 16:09:54,197,51,11,134,1,5,0,34,23
10606591490_10153851350426491,McDonald's learned that even burgers can be offensive.,Here's What Happened When McDonald's Let the Internet Name Its Own Burgers,link,http://ti.me/29X58nQ,2016-07-21 15:30:45,294,20,23,261,4,0,29,0,0
10606591490_10153851291791491,The Force is strong with this one.,A 'Star Wars' Fan Made an 'Episode VIII' Trailer That Will Get You So Excited,link,http://ti.me/2aezH8c,2016-07-21 15:00:24,82,8,13,78,1,0,3,0,0
10606591490_10153851253606491,The Internet is losing its mind over Donald J. Trump and Mike Pence's air kiss fail. http://ti.me/2acYiIO,Trump's Awkward Air Kiss,video,https://www.facebook.com/time/videos/10153851253606491/,2016-07-21 14:45:45,1734,266,223,858,39,14,800,8,15
10606591490_10153851218111491,Starring Detective Pikachu.,There's Already a Pokémon Live Action Movie Coming to Theaters,link,http://ti.me/2afXNMl,2016-07-21 14:30:27,63,5,4,63,0,0,0,0,0
10606591490_10153851153196491,Adele took to Instagram with the black and white shots.,Adele Goes Makeup-Free in Latest Photos,link,http://ti.me/29REQxp,2016-07-21 14:00:20,713,11,21,659,51,3,0,0,0
10606591490_10153851100031491,"""Just remember — at noon the next day, your group expires, your matches disappear and your Uber turns into a pumpkin.""",Tinder Wants to Be About More Than Just Dating,link,http://ti.me/2afQ9S9,2016-07-21 13:30:41,107,3,4,100,2,0,5,0,0
10606591490_10153851049261491,"""Don, you just fell into the shark tank.""",Watch Mark Cuban Bring the Heat in Donald Trump Roast With Stephen Colbert,link,http://ti.me/29ODzf5,2016-07-21 13:00:06,1019,165,149,815,56,5,134,2,7
10606591490_10153851021046491,"At this local shoe shining shop, the owner politely shares his difference of opinion on the RNC with his customers. http://ti.me/2agd006",Shoe Shine and Politics At the RNC,video,https://www.facebook.com/time/videos/10153851021046491/,2016-07-21 12:45:49,106,4,19,96,7,2,1,0,0
10606591490_10153850992821491,"""In an average year, heat kills more people than floods, lightning, tornadoes and hurricanes combined.""",Air Conditioning Is a Human Right,link,http://ti.me/29O4yHn,2016-07-21 12:30:21,1019,104,284,855,16,78,2,56,12
10606591490_10153850929041491,"Hillary Clinton: ""Discover what Donald J. Trump thinks about people like you.""",Hillary Clinton Challenges Supporters to 'Trump Yourself',link,http://ti.me/29YyO0H,2016-07-21 12:00:46,373,66,27,309,23,0,40,0,1
10606591490_10153850875071491,"He said he asked the officer why he fired his weapon, and the officer responded, ""I don't know.""",Therapist Shot by Police Thought 'They're Not Going To Shoot Me',link,http://ti.me/29WayuU,2016-07-21 11:30:31,2356,182,502,1037,1,66,5,426,821
10606591490_10153850821421491,Was it the 1950s or the 1980s?,When Was America Last Great?,link,http://ti.me/2afnAED,2016-07-21 11:00:05,205,94,34,179,3,6,10,3,4
10606591490_10153850763406491,Beyoncé and Michelle Obama are bringing serious squad goals.,Michelle Obama and Beyoncé are the Dynamic Duo We All Need,link,http://ti.me/2adWj8B,2016-07-21 10:30:43,3120,69,60,2837,229,10,35,1,8
10606591490_10153850715821491,"""Delighted by a visit from the ameowzing Adele this eve, who was starstruck by our guy Larry & became an instant fan.""",Adele Makes Unwanted Cat a Local Celebrity in Visit to Vancouver Cat Cafe,link,http://ti.me/2af9YZS,2016-07-21 10:00:48,831,77,196,709,110,1,11,0,0
10606591490_10153850668066491,4. You're setting your thermostat too low.,8 Mistakes You're Making With Your Air Conditioner,link,http://ti.me/2adcZtO,2016-07-21 09:30:36,474,65,187,465,1,7,1,0,0
10606591490_10153850624316491,"""Michelle Obama is the First Lady of Karaoke.""",People Are Loving Michelle Obama's 'Carpool Karaoke',link,http://ti.me/2adIbfE,2016-07-21 09:00:43,9841,302,1340,8399,1229,30,170,2,11
10606591490_10153850575636491,Skip the Starbucks line.,5 Ways to Make a Better Cup of Coffee at Home,link,http://ti.me/2au5aiu,2016-07-21 08:30:21,445,18,75,428,13,0,4,0,0
10606591490_10153850508426491,"""This policy is leading to ongoing opioid abuse.""",How Obamacare Is Fueling America's Opioid Epidemic,link,http://ti.me/29NyGmt,2016-07-21 08:00:31,152,22,26,137,1,8,6,0,0
10606591490_10153850471911491,2. Only eat high quality dark chocolate.,5 Ways to Improve Your Skin Through Food,link,http://ti.me/2ad3aPF,2016-07-21 07:30:07,417,16,59,412,3,2,0,0,0
10606591490_10153850421701491,Michelle Obama was the star on the latest Carpool Karaoke.,Michelle Obama Crushes Beyoncé's 'Single Ladies' on 'Carpool Karaoke',link,http://ti.me/2acW8dS,2016-07-21 07:00:14,11623,328,1753,9877,1405,32,287,5,17
10606591490_10153850363661491,About 500 women are killed in honor killings every year in Pakistan.,Pakistan Moves to Ban 'Honor Killings' after Social Media Star's Murder,link,http://ti.me/29VvPt2,2016-07-21 06:30:16,3184,139,379,2490,33,21,4,358,278
10606591490_10153850296481491,"From ""a new kind of pickup truck"" to buses.",Elon Musk Unveils Tesla 'Master Plan',link,http://ti.me/2ae6I0P,2016-07-21 06:00:55,488,5,39,459,18,9,2,0,0
10606591490_10153850256146491,It's the most popular site for file sharing.,Man Behind the World's Biggest File-Sharing Site Arrested,link,http://ti.me/29NmnGS,2016-07-21 05:30:17,986,106,325,662,4,78,6,204,32
10606591490_10153850216166491,Four nuns are suspected of helping to hide $9 million.,Argentinian Nuns Probed for Helping Ex-Minister Hide Wads of Cash,link,http://ti.me/29Xevkh,2016-07-21 05:00:11,129,13,12,108,0,14,6,1,0
10606591490_10153850182546491,Does aromatherapy actually have health benefits?,You Asked: Does Aromatherapy Really Work?,link,http://ti.me/2a8Fg6l,2016-07-21 04:30:17,86,4,17,83,2,1,0,0,0
10606591490_10153850150041491,"""Going to be such a beautiful historic day and I can't believe I have the immense honor of being part of it.""",Chloe Grace Moretz Is Speaking at the Democratic National Convention,link,http://ti.me/2adSWvn,2016-07-21 04:00:20,711,49,18,647,44,5,15,0,0
10606591490_10153850121821491,He's got the moves.,Idris Elba Shows Off His Dance Moves on The Tonight Show,link,http://ti.me/2aw7dms,2016-07-21 03:30:04,264,19,31,235,21,1,7,0,0
10606591490_10153850081606491,Rihanna dedicated her song to the victims of the Nice attack.,Watch Rihanna Honor the Victims of Nice With a Tribute,link,http://ti.me/2adSfCb,2016-07-21 03:00:12,694,35,91,611,73,6,1,3,0
10606591490_10153850050011491,Hackers are planning to hit Pokemon Go.,Hackers Just Issued a Huge Threat to 'Pokémon Go' Players,link,http://ti.me/29OIGYR,2016-07-21 02:30:07,1322,269,550,1012,16,36,152,8,98
10606591490_10153850017851491,Wild.,The 90s Are Back in a Big Way with Clothing by Lisa Frank,link,http://ti.me/2adStsV,2016-07-21 02:00:33,232,25,33,208,15,6,2,1,0
10606591490_10153849963476491,Someone has built a grey concrete wall around Trump's Hollywood star.,Artist Builds Concrete Wall Around Donald Trump's Hollywood Star,link,http://ti.me/29NaPmN,2016-07-21 01:30:15,11440,376,1097,8130,398,48,2838,4,22
10606591490_10153849936051491,"""They're losers, they have no lives of their own, they can probably barely pay for the wifi they're using.""",Dan Aykroyd Fires Back at Leslie Jones Twitter Haters,link,http://ti.me/2acBvOQ,2016-07-21 01:00:26,1747,76,103,1466,165,10,104,1,1
10606591490_10153849908946491,Team Taylor gets some support.,Uzo Aduba Defends Taylor Swift in the T. Swift – Kimye Feud,link,http://ti.me/2aaJDOp,2016-07-21 00:30:13,292,25,20,267,17,1,4,1,2
10606591490_10153849876281491,Reese's lovers may need to sit down for this.,Reese's Pieces-Stuffed Reese's Cups Are Coming to Fulfill Your Candy Dreams,link,http://ti.me/29X2uLI,2016-07-21 00:00:09,887,103,140,768,75,40,4,0,0
10606591490_10153849862336491,Ted Cruz Doesn't Endorse Trump at RNC http://ti.me/2adY42i,Ted Cruz Doesn't Endorse Trump at RNC,video,https://www.facebook.com/time/videos/10153849862336491/,2016-07-20 23:49:19,3025,420,477,2265,174,46,499,5,36
10606591490_10153849806266491,"Miranda Kerr: ""I said yes!""",Model Miranda Kerr Engaged to Snapchat Boss Evan Spiegel,link,http://ti.me/29Vc4Bx,2016-07-20 23:00:07,2454,98,70,2218,121,83,23,7,2
10606591490_10153849748346491,"""Once you've become aware of it, all of a sudden it's every where.""",This Woman Wants to Make You See Invisible People,link,http://ti.me/2abtjhL,2016-07-20 22:30:37,289,10,28,268,9,11,1,0,0
10606591490_10153849692411491,She also admitted to forcing her preteen daughter to take heroin.,Ohio Mom Sentenced for Allowing Her Daughter to Be Raped for Drugs,link,http://ti.me/2abNSuF,2016-07-20 22:00:09,2098,245,153,609,6,50,2,260,1171
10606591490_10153849658086491,"One person does a spot-on impression of President Bill Clinton, too.",SNL Asked People in Cleveland to Do Their Best Donald Trump Impersonations,link,http://ti.me/29MtnDU,2016-07-20 21:30:38,164,5,12,155,2,0,7,0,0
10606591490_10153849613441491,Oops.,Woman Gets Stuck in Tree While Playing 'Pokémon Go' in a Cemetery,link,http://ti.me/2ad06zT,2016-07-20 21:00:52,683,61,116,476,3,16,183,3,2
10606591490_10153849556376491,Your iPhone may be vulnerable to snooping.,This Is Why You Should Update Your iPhone Right Away,link,http://ti.me/29M5FHy,2016-07-20 20:30:07,181,13,59,175,1,4,1,0,0
10606591490_10153849504816491,"Anne Hathaway said the late director's advice ""changed my life even more than the film did.""",Anne Hathaway Remembers 'The Princess Diaries' Director Garry Marshall,link,http://ti.me/29MyO5y,2016-07-20 20:00:14,1848,23,102,1578,101,1,0,168,0
10606591490_10153849414316491,She repeatedly hit the offender over the head with a packet of bacon.,86-Year-Old Woman Successfully Uses Bacon for Self-Defense,link,http://ti.me/29OTa9W,2016-07-20 19:00:51,1198,119,388,894,59,5,238,1,1
10606591490_10153849314961491,"Like mother, like daughter.",Blue Ivy Is Already a Flawless Diva Just Like Beyoncé,link,http://ti.me/29UBlfa,2016-07-20 18:00:38,1421,132,30,1316,76,9,11,1,8
10606591490_10153849266651491,"Gwen Stefani: ""I feel like I almost got it.""",Gwen Stefani 'Almost' Played Angelina Jolie's Role in 'Mr. & Mrs. Smith',link,http://ti.me/29Pt3zv,2016-07-20 17:30:13,337,39,6,305,3,14,14,0,1
10606591490_10153849215601491,"Ruby Rose: ""There is a reason Khloé Kardashian and I still follow each other on Twitter...its called not judging someone.""",Ruby Rose Says There's No Beef With Khloé Kardashian,link,http://ti.me/29WmU7E,2016-07-20 17:00:16,342,31,7,327,12,0,3,0,0
10606591490_10153849141496491,Totally different.,Democratic Party Interns' Selfie Is the Complete Opposite of Paul Ryan's Photo,link,http://ti.me/2avgACN,2016-07-20 16:30:29,9572,336,1139,8048,1264,43,206,2,9
10606591490_10153849076356491,"Ivanka Trump: ""Of course daughters often disagree with things their fathers say.""","Ivanka Trump Calls Herself a 'Daughter, Not a Clone'",link,http://ti.me/29VT3vZ,2016-07-20 16:00:55,531,79,17,449,18,10,49,0,5
10606591490_10153849052711491,Cruz! Newt! Pence! What to Watch for Tonight at the Republican Convention,,video,https://www.facebook.com/time/videos/10153849052711491/,2016-07-20 15:46:52,685,134,55,638,20,1,5,5,16
10606591490_10153848978331491,Gotta catch a date.,There's Now a Dating Service For Pokémon Go Players,link,http://ti.me/2a9vosY,2016-07-20 15:00:33,431,93,99,325,7,11,87,0,1
10606591490_10153848882911491,Selena Gomez's posts are worth how much?,Selena Gomez Could Be Making Bank On Her Instagram Fame,link,http://ti.me/2a9zPnK,2016-07-20 14:30:20,232,2,6,225,3,3,0,0,1
