status_id,status_message,link_name,status_type,status_link,status_published,num_reactions,num_comments,num_shares,num_likes,num_loves,num_wows,num_hahas,num_sads,num_angrys
13652355666_10153692679890667,,USA TODAY College,link,http://college.usatoday.com/2016/07/18/columbia-and-barnard-are-the-latest-schools-to-drop-sat-and-act-requirements/,2016-07-23 07:01:15,3803,118,0,3693,59,45,4,1,1
13652355666_10153692605970667,"BREAKING: Suspected shooter had no ties to Islamic state or the asylum seeker community, police say.",Munich police: Shooter had no connections to Islamic State,link,http://www.usatoday.com/story/news/world/2016/07/23/munich-shooting-attack-german-police/87471572/,2016-07-23 06:23:49,2865,112,35,2817,14,13,4,15,2
13652355666_10153690627020667,"Raise a glass to freedom and Lin-Manuel Miranda explaining Alexander Hamilton on ""Drunk History.""",Raise a glass: Lin-Manuel Miranda will explain Hamilton on 'Drunk History',link,http://www.usatoday.com/story/life/tv/2016/07/22/lin-manuel-miranda-hamilton-drunk-history/87433010/,2016-07-23 06:20:00,3591,109,301,3442,110,7,32,0,0
13652355666_10153688710245667,"The new  International Cloud Atlas includes one new species: Volutus, a solitary roll cloud, known in Australia as the morning glory cloud.",Revamped atlas to give clouds their day in the sun,link,http://www.usatoday.com/story/weather/2016/07/21/international-cloud-atlas-update/87387794/,2016-07-23 05:22:00,2875,84,54,2842,16,15,2,0,0
13652355666_10153692453785667,"The attack, which killed nine people and injured 16 others, was the third to target civilians in Europe in just over a week.","German police calls for public to submit video, pictures of attack",link,http://www.usatoday.com/story/news/world/2016/07/23/munich-shooting-attack-german-police/87471572/,2016-07-23 04:43:01,3025,77,37,2944,11,4,2,59,5
13652355666_10153692420795667,"Hillary Clinton and her VP pick Tim Kaine are expected to campaign together Saturday ahead of next week's Democratic National Convention. 

(Photo: AP)

More news you need to know this weekend: usat.ly/2a4MIfw",Timeline Photos,photo,https://www.facebook.com/usatoday/photos/a.100797840666.101835.13652355666/10153692420795667/?type=3,2016-07-23 04:15:00,3491,213,65,3363,71,9,18,2,28
13652355666_10153691967930667,"Tiffany Thompson told police that the Dallas Cowboys rookie running back assaulted her in Columbus, Ohio.",Cowboys' Ezekiel Elliott denies domestic assault accusation,link,http://www.usatoday.com/story/sports/nfl/cowboys/2016/07/22/ezekiel-elliott-assault-accusation-dallas/87439428/,2016-07-23 03:21:00,3039,111,49,3012,9,5,3,1,9
13652355666_10153691924890667,The instructions include a flight plan that detailed celestial bodies and geographical landmarks during the nearly five-hour mission.,"Astronaut John Glenn's orbit the Earth in-flight instructions fetch $67,000",link,http://www.usatoday.com/story/news/2016/07/22/astronaut-john-glenns-orbit-earth--flight-instructions-fetch-67000/87437254/,2016-07-23 02:15:00,2974,86,23,2954,11,7,2,0,0
13652355666_10153691999400667,The oak tree has been one of the most popular tourist sites tied to the critically acclaimed movie.,Iconic oak in 'The Shawshank Redemption' felled in wind gust,link,http://www.usatoday.com/story/life/nation-now/2016/07/22/shawshank-redemption-tree/87461740/,2016-07-23 01:09:00,3883,184,322,3426,12,89,7,348,1
13652355666_10153692028470667,"Donald J. Trump appeared in Oliver Stone's 'Wall Street: Money Never Sleeps', but his scene never made it into the final cut.",Oliver Stone says Trump was a bad (but supremely confident) actor,link,http://www.usatoday.com/story/life/movies/2016/07/22/oliver-stone-donald-trump-acting-stint-wall-street/87436896/,2016-07-23 00:05:00,3208,187,31,3144,13,3,45,1,2
13652355666_10153692105960667,Rick Welts didn't feel comfortable attending the All-Star Game in Charlotte if the law remained as is.,How one NBA team exec influenced the ASG decision,link,http://www.usatoday.com/story/sports/nba/2016/07/22/golden-state-warriors-executive-influenced-nbas-2017-charlotte-all-star-game/87458518/,2016-07-22 23:18:00,3159,120,18,3125,23,3,7,0,1
13652355666_10153689361675667,"Since there are no legal recreational or medical marijuana stores, facilities or grows in the small town, it's not known how THC appeared in the water supply.",Officials: Colo. town's drinking water tainted with THC,link,http://www.usatoday.com/story/news/nation-now/2016/07/21/officials-colo-towns-drinking-water-tainted-thc/87419730/,2016-07-22 22:33:01,3591,217,321,3439,20,42,82,4,4
13652355666_10153689075295667,The order does not address whether the federal judge would refer Sheriff Joe and his aides for criminal contempt of court.,Judge strips Arpaio of some internal affairs oversight,link,http://www.usatoday.com/story/news/nation-now/2016/07/21/judge-strips-arpaio-internal-affairs-oversight/87412472/,2016-07-22 21:55:00,3145,100,35,3088,21,15,18,2,1
13652355666_10153691746530667,"Tim Kaine is the first to say he's boring. That doesn't sound bad after months of Hillary Clinton's emails and Donald Trump's bombast, writes the USA TODAY Opinion editorial board.",Tim Kaine is the right pick for veep: Our view,link,http://www.usatoday.com/story/opinion/2016/07/22/tim-kaine-hillary-clinton-vice-president-right-pick-our-view/87458426/,2016-07-22 21:15:00,3319,206,47,3238,47,4,10,1,19
13652355666_10153691738975667,"Tim Kaine is one of just 20 people to have served as a mayor, governor and U.S. senator.",6 things to know about Tim Kaine,link,http://www.usatoday.com/story/news/politics/onpolitics/2016/07/22/who-is-tim-kaine/87145838/,2016-07-22 20:50:00,3221,188,62,3136,50,7,20,1,7
13652355666_10153691761390667,"Tim Kaine is considered a safe pick, a swing-state moderate who appeals to independent voters.",Who is Tim Kaine? A closer look at the Virginia senator,link,http://www.usatoday.com/story/news/politics/elections/2016/2016/07/22/tim-kaine-hillary-clinton-running-mate/86982178/,2016-07-22 20:22:00,3497,466,154,3292,92,8,67,10,28
13652355666_10153691690390667,"While Hillary Clinton's vetting process included a range of options, Tim Kaine always had the best odds.",Clinton goes with her heart on Kaine VP pick,link,http://www.usatoday.com/story/news/politics/elections/2016/2016/07/22/clinton-goes-her-heart-kaine-vp-pick/87447416/,2016-07-22 19:56:07,3246,304,67,3063,96,3,50,3,31
13652355666_10153691690610667,"Hillary Clinton announced Virginia Sen. Tim Kaine as her pick for vice president, days ahead of the Democratic convention in Philadelphia. http://usat.ly/29RZb6r",Hillary Clinton announces Tim Kaine as running mate,video,https://www.facebook.com/usatoday/videos/10153691690610667/,2016-07-22 19:35:35,5475,447,480,4961,253,22,141,15,83
13652355666_10153691680935667,BREAKING: Hillary Clinton has announced Virginia Sen. Tim Kaine as her running mate. http://usat.ly/2a6NLPU,,status,,2016-07-22 19:24:54,1617,81,20,1563,33,3,11,2,5
13652355666_10153691611000667,Miss Teen USA drew praise last month for announcing the pageant would eliminate its swimsuit competition.,See what Miss Teen USA contestants will wear instead of bikinis,link,http://www.usatoday.com/story/life/entertainthis/2016/07/22/miss-teen-usa-contestants-fitnesswear-competition-apparel-tapout/87446676/,2016-07-22 19:10:00,2053,50,16,2031,15,2,4,0,1
13652355666_10153691625265667,"BREAKING: Munich shooter apparently killed himself and looks to have acted alone, according to reports. The latest: usat.ly/29SFThj","At least 9 dead in Munich shooting rampage, 1 may be attacker",link,http://usat.ly/29SFThj,2016-07-22 18:49:54,1872,73,60,1775,8,4,0,60,25
