status_id,status_message,link_name,status_type,status_link,status_published,num_reactions,num_comments,num_shares,num_likes,num_loves,num_wows,num_hahas,num_sads,num_angrys
13652355666_10153684688960667,"The world has lost Garry Marshall, the witty comedian who brought us ""Happy Days,"" ""Pretty Woman"" and ""The Princess Diaries."" usat.ly/29Xw05b",Garry Marshall has died at 81,video,https://www.facebook.com/usatoday/videos/10153684688960667/,2016-07-20 03:16:00,13060,669,6031,8051,296,47,10,4645,11
13652355666_10153683775575667,Now you can bring personalized emojis into your Snapchat.,Bitmoji is now on your Snapchat,link,http://usat.ly/2a8FuMw,2016-07-20 02:15:00,1845,85,6,1833,10,0,0,0,2
13652355666_10153683325360667,Chinese archaeologists are breaking ground in more ways than one.,China strives to become leader in world archeology,link,http://www.usatoday.com/story/news/world/2016/07/19/china-leader-world-archeology/86679930/,2016-07-20 01:44:00,2130,88,26,2090,26,6,4,1,3
13652355666_10153684687870667,"A hiccup with the Alaska delegation's votes, Chris Christie's case for charges against Hillary Clinton and a one-two punch from Trump's kids.",Top takeaways from Day 2 of the GOP convention,link,http://www.usatoday.com/story/news/politics/onpolitics/2016/07/20/top-takeaways-day-two-republican-convention-trump/87306730/,2016-07-20 01:15:00,2139,113,16,2086,29,2,3,3,16
13652355666_10153683320245667,Diamonds aren't always a girl's best friend.,Locks of love (and big bucks) for Marilyn Monroe hair auction,link,http://www.usatoday.com/story/news/2016/07/19/marilyn-monroe-auction/87282304/,2016-07-20 00:42:00,2168,73,16,2117,40,3,5,0,3
13652355666_10153684622165667,"From his New York accent to his ability to connect with the public through comedy, Marshall hardly seemed like the Hollywood type.","Appreciation: Garry Marshall, auteur of odd couples",link,http://www.usatoday.com/story/life/movies/2016/07/20/appreciation-garry-marshall-auteur-odd-couples/87326340/,2016-07-20 00:12:00,2122,77,24,2040,25,1,2,52,2
13652355666_10153684409795667,It's getting heated.,Protester challenges police to shoot him like Tamir Rice,link,http://www.usatoday.com/story/news/politics/onpolitics/2016/07/19/protester-challenges-police-shoot-him-like-tamir-rice/87305740/,2016-07-19 23:30:00,2291,293,66,2140,10,15,48,16,62
13652355666_10153684469140667,Garry Marshall has inspired and entertained generations.,"TV, film legend Garry Marshall dies at 81",link,http://www.usatoday.com/story/life/people/2016/07/19/garry-marshall-dies-obituary/87325512/,2016-07-19 22:26:53,8757,965,10727,4295,207,54,2,4190,9
13652355666_10153684459590667,"Marshall leaves behind a legacy as a hitmaker on television and in films, a comedian with impeccable delivery and a warm personality to those he encountered.","TV, film legend Garry Marshall dies at 81",link,http://www.usatoday.com/story/life/people/2016/07/19/garry-marshall-dies-obituary/87325512/,2016-07-19 22:22:13,3388,130,493,2534,23,35,1,792,3
13652355666_10153684455710667,Day 2 of Trump Fest: USA TODAY Washington Bureau Chief Susan Page has the highlights. #RNCinCLE,,video,https://www.facebook.com/usatoday/videos/10153684455710667/,2016-07-19 22:19:46,2191,197,53,2092,39,8,8,6,38
13652355666_1665760990415089,"Tiffany Trump may not be as famous as her half-sister Ivanka, but she shed more light on Donald J. Trump as a dad.",Tiffany Trump: Dad helped me through my darkest times,video,https://www.facebook.com/usatoday/videos/1665760990415089/,2016-07-19 22:07:43,3465,292,220,3156,120,19,140,5,25
13652355666_10153683593705667,"President Obama ""again strongly condemned last week's attempt to violently remove"" President Erdogan.",Obama calls Turkey's Erdogan to offer support after failed coup attempt,link,http://usat.ly/29SkjIx,2016-07-19 22:03:00,1512,63,24,1483,11,4,9,0,5
13652355666_10153683266465667,"""If you are a member of a group that causes you to have to hide your face, then you probably need a different cause.""",Cleveland police to protesters: don't hide your faces,link,http://www.usatoday.com/story/news/politics/elections/2016/07/19/cleveland-police-protesters-dont-hide-your-faces/87287352/,2016-07-19 21:33:00,4641,365,543,4386,89,21,112,11,22
13652355666_1665664660424722,Meet the Trumps.,Take a look at the Trump family tree,video,https://www.facebook.com/usatoday/videos/1665664660424722/,2016-07-19 21:00:00,2263,223,245,2014,37,12,114,5,81
13652355666_10153683679860667,"""It takes two parties to make a healthy relationship.""",Kansas Black Lives Matter holds picnic with police instead of protest,link,http://usat.ly/2a8Eecg,2016-07-19 20:40:00,14235,263,3772,12796,1349,76,12,1,1
13652355666_10153684265045667,,Enquirer - Cincinnati and Kentucky,video,https://www.facebook.com/Enquirer/videos/10155109353704698/,2016-07-19 20:22:37,1400,70,0,1379,6,9,4,0,2
13652355666_10153684254305667,"Tuesday's fatal shooting comes just on the heels of three police officers being fatally shot in Baton Rouge, La., last Sunday, and five police officers in Dallas being shot fatally July 7.","Kansas City, Kansas, police officer shot dead",link,http://www.usatoday.com/story/news/2016/07/19/kansas-city-kansas-police-officer-killed-drive--shooting/87319828/,2016-07-19 20:15:00,2944,411,1036,1763,21,6,21,820,313
13652355666_10153684134610667,You know taking it off is the best part of your day.,Why Millennials are going braless,link,http://www.usatoday.com/story/life/2016/07/19/braless-millenials-bralette/87111292/,2016-07-19 19:45:00,1764,145,87,1686,39,15,20,1,3
13652355666_1665699357087919,This was the moment that put Donald J. Trump over the top -- and it was a family affair.,Donald Trump Jr. announces New York's delegates,video,https://www.facebook.com/usatoday/videos/1665699357087919/,2016-07-19 19:15:48,2157,129,123,1955,74,7,27,12,82
13652355666_10153683500505667,Woods said he wasn't ready to return to competitive golf after two back surgeries last fall.,Tiger Woods won't play PGA Championship at Baltusrol,link,http://usat.ly/29S2zgl,2016-07-19 19:15:00,1025,36,20,1005,6,3,2,8,1
13652355666_10153683553885667,A girl not chosen to be a high school cheerleader has threatened legal action against the school district if she isn't put on the team.,"Teen fails to make cheerleader, threatens to sue",link,http://usat.ly/29PuBcu,2016-07-19 18:45:00,2929,884,841,1822,21,338,534,46,168
