status_id,status_message,link_name,status_type,status_link,status_published,num_reactions,num_comments,num_shares,num_likes,num_loves,num_wows,num_hahas,num_sads,num_angrys
13652355666_1666566220334566,"The National Rifle Association's top lobbyist, Chris Cox, tells USA TODAY's Susan Page why Hillary Clinton is the wrong candidate for lawful gun owners. usat.ly/2abEQOc",NRA's Chris Cox: Hillary wants to take away your guns,video,https://www.facebook.com/usatoday/videos/1666566220334566/,2016-07-21 11:00:00,1728,166,91,1621,27,6,9,3,62
13652355666_10153687857445667,"Trump faces the same demands as previous nominees, as well as unique challenges brought on by his unusual campaign.",5 things Trump needs to accomplish in his acceptance speech,link,http://usat.ly/2adAYfy,2016-07-21 10:28:00,1485,95,21,1436,32,1,10,2,4
13652355666_10153686647580667,"Lori Doyle, 55, was charged with vehicular assault, DUI first offense and implied consent, according to a police affidavit.",Wife charged with DUI after fatal golf cart accident,link,http://www.usatoday.com/story/news/nation-now/2016/07/20/wife-charged-dui-fatal-golf-cart-accident/87362650/,2016-07-21 10:00:00,1540,95,77,1465,27,32,3,10,3
13652355666_10153688002295667,"BREAKING: The Obama administration has moved to block mega health-care mergers, saying deals would drive medical costs higher.",Obama admin seeks to block health-care deals,link,http://usat.ly/2adGIWG,2016-07-21 09:42:19,1621,78,57,1555,39,16,5,2,4
13652355666_10153687582770667,"The words ""Nadia"" or ""Perfect 10"" can mean only one person.","40 years after perfect 10, gymnast Nadia Comaneci remains an Olympic icon",link,http://usat.ly/2ac3r5j,2016-07-21 09:30:01,5009,93,534,4694,265,49,0,0,1
13652355666_10153687941155667,Oklahoma City Mayor Mick Cornett urges Donald J. Trump to reach out to mayors on urban issues. http://usat.ly/2akGSLu,Newsmakers interview with Mick Cornett,video,https://www.facebook.com/usatoday/videos/10153687941155667/,2016-07-21 09:10:40,1528,94,44,1480,37,1,6,3,1
13652355666_10153687940295667,"Susan Page: ""I've covered a lot of conventions, and this hasn't been the 4-day infomercial that we're used to."" From the Day 1 unrest about forcing a vote to plagiarism to Ted Cruz boos, ""it's been more like a reality show."" Here's what we are watching for on Day 4:",USA TODAY,video,https://www.facebook.com/usatoday/videos/10153687920485667/,2016-07-21 09:05:15,1138,62,0,1103,25,0,7,1,2
13652355666_10153687559170667,"""We're dealing with a presidential candidate that is openly hostile toward the governor,"" said Matt Borges, chairman of the Ohio Republican Party.",Donald Trump's puzzling Ohio convention strategy,link,http://usat.ly/2acPcgF,2016-07-21 09:00:00,1333,134,39,1244,35,9,33,8,4
13652355666_10153687920485667,"Day 4 at the Republican convention, time for the grand Trump finale.",Donald Trump speaks tonight at the Republican convention,video,https://www.facebook.com/usatoday/videos/10153687920485667/,2016-07-21 08:58:46,1076,74,69,1014,33,2,5,4,18
13652355666_10153687901170667,"Phil Robertson had much to say in this entertaining interview with Susan Page.  He was joined by David Bossie, President of Citizen's United, an conservative advocacy group.",USA TODAY,video,https://www.facebook.com/usatoday/videos/10153687802825667/,2016-07-21 08:43:35,939,66,0,895,21,1,4,0,18
13652355666_10153687871910667,"Our illustrator, Jeff Dionise, draws Ted Cruz from his speech at the Republican National Convention on Wednesday night.",USA TODAY art director Jeff Dionise draws Ted Cruz,video,https://www.facebook.com/usatoday/videos/10153687871910667/,2016-07-21 08:42:23,1536,143,112,1390,54,8,74,0,10
13652355666_10153686794250667,Some good news out of Cleveland:,"In Cleveland, handshakes and hugs for cops",link,http://www.usatoday.com/story/news/politics/elections/2016/07/20/cleveland-police-handshakes-hugs-protesters/87362342/,2016-07-21 08:25:00,1514,47,85,1470,40,0,4,0,0
13652355666_10153687802825667,"Phil Robertson of Duck Dynasty on A&E fame has a message for Ted Cruz: ""It's time to move on."" http://usat.ly/2akHwst",Phil Robertson talks with Susan Page,video,https://www.facebook.com/usatoday/videos/10153687802825667/,2016-07-21 08:02:47,2359,743,406,2048,178,11,39,6,77
13652355666_10153687639210667,"""It's time for the IOC to make the hard, but right choice, and ban Russia from Rio.""","Armour: Time to make tough call on Russia, IOC",link,http://usat.ly/2adkBzz,2016-07-21 08:00:00,1027,44,18,990,28,6,2,0,1
13652355666_10153687745495667,"""I was thinking as long as I have my hands up ... they're not going to shoot me,"" said Charles Kinsey, a behavioral therapist.",Fla. man says his hands were up when police shot him,link,http://usat.ly/29X5J2D,2016-07-21 07:06:14,3487,477,1023,2046,19,83,5,460,874
13652355666_10153687300460667,"As the Republican National Convention comes to a close Thursday, the focus shifts to one man: Donald Trump.

(Photo: Getty) 

More news you need to know: usat.ly/2aaBp7N",Timeline Photos,photo,https://www.facebook.com/usatoday/photos/a.100797840666.101835.13652355666/10153687300460667/?type=3,2016-07-21 06:14:00,1821,154,52,1724,49,2,25,6,15
13652355666_1666141753710346,"First Lady Michelle Obama hops in the passenger seat on ""The Late Late Show with James Corden.""",Michelle Obama crushes Carpool Karaoke,video,https://www.facebook.com/usatoday/videos/1666141753710346/,2016-07-21 06:00:00,13846,600,2741,11654,1561,56,522,18,36
13652355666_10153686034520667,"When you look at a full moon, do you see a face or a rabbit -- or maybe something else?",How did the 'man in the moon' get there?,link,http://usat.ly/2abi6xE,2016-07-21 05:30:00,1479,39,15,1447,30,1,1,0,0
13652355666_10153687039395667,"The greater the level of force (think Tasers and guns vs. batons), the less racial bias seemed to be a factor in police actions, according to the report.","Cop bias is real, study shows. So is pessimism about race relations.",link,http://www.usatoday.com/story/opinion/policing/data-casualties/2016/07/20/cop-bias-real-study-shows-so-pessimism-race-relations/87155132/,2016-07-21 05:00:00,1770,178,66,1694,37,5,3,12,19
13652355666_10153687527490667,The court's decision means Russia's track and field team will probably not compete in the Summer Olympics in Rio.,CAS upholds ban of Russian track and field team from Rio,link,http://usat.ly/29Pe09Y,2016-07-21 04:47:30,1507,52,18,1475,22,8,1,1,0
13652355666_10153685762225667,NFL Commissioner Roger Goodell announced in a memo that Dr. Elliot Pellman is retiring.,Controversial NFL Dr. Elliott Pellman forced into retirement by Roger Goodell,link,http://usat.ly/29UTGmj,2016-07-21 04:31:00,1303,38,11,1279,17,4,2,1,0
13652355666_10153687157620667,"Yep, she's a Jersey girl.",The oldest American is a 113-year-old Jersey girl,link,http://www.usatoday.com/story/news/nation-now/2016/07/21/oldest-american-year-old-jersey-girl/87373424/,2016-07-21 04:00:00,1954,74,70,1876,46,25,4,3,0
13652355666_10153686787745667,"Gavin Long's mother said she urged him to seek help from the Department of Veterans Affairs after he left the Marine Corps, but he returned unhappy with the care.",Mother of vet who killed police in Baton Rouge feared he suffered fom PTSD,link,http://www.usatoday.com/story/news/nation/2016/07/20/mother-vet-who-killed-police-baton-rouge-feared-he-suffered-fom-ptsd/87343896/,2016-07-21 03:30:00,1598,133,60,1524,33,12,2,23,4
13652355666_10153687168180667,"Kasich could have been in charge of domestic and foreign policy, while Trump would have been tasked with making America great again, a report said.","Trump-Kasich feud continues: Reports of boycott, wooing Kasich for VP",link,http://www.usatoday.com/story/news/politics/onpolitics/2016/07/20/trump-kasich-feud-convention/87346240/,2016-07-21 03:00:00,1827,314,116,1696,37,12,77,2,3
13652355666_10153686721380667,Back so soon?,Manny Pacquiao to return from retirement Nov. 5 at UNLV's Thomas & Mack Center,link,http://boxingjunkie.usatoday.com/2016/07/20/manny-pacquiao-return-retirement-nov-5-thomas-mack-center/?utm_source=feedblitz&utm_medium=FeedBlitzRss&utm_campaign=usatodaycomsports-topstories,2016-07-21 02:30:00,1568,33,26,1545,13,3,7,0,0
13652355666_10153686806800667,"If you're a Saturday Night Live cast member, chances are you're conditioned to read not-so-nice tweets about yourself.",Leslie Jones' 'SNL' colleagues address ugly tweets,link,http://www.usatoday.com/story/life/people/2016/07/20/leslie-jones-snl-colleagues-address-ugly-tweets/87345328/,2016-07-21 02:00:00,1570,64,18,1535,28,3,2,2,0
13652355666_10153687088345667,"Watch out, automakers.","Elon Musk: Tesla expanding into pickups, heavy trucks",link,http://www.usatoday.com/story/tech/news/2016/07/20/musk-sees-tesla-energy-company---plus-cars/87363390/,2016-07-21 01:30:00,1838,62,74,1786,35,12,5,0,0
13652355666_1666395317018323,Donald Trump and Mike Pence shared an awkward moment after Pence formally accepted the vice presidential nomination at the Republican National Convention. usat.ly/2ae2Hts,Trump and Pence awkwardly air kissed at the RNC,video,https://www.facebook.com/usatoday/videos/1666395317018323/,2016-07-21 00:56:00,3067,345,313,2516,60,10,437,3,41
13652355666_10153687153570667,No one has deeper Republican credentials than Dole.,Bob Dole: 'Trump's going to make a great president',link,http://www.usatoday.com/story/news/politics/elections/2016/07/20/bob-dole-says-trump-will-make-great-president/87340048/,2016-07-21 00:30:00,2179,222,78,1982,45,11,104,16,21
13652355666_10153687103245667,"Indiana Gov. Mike Pence, a Christian, conservative and Republican, accepted the Republican nomination for vice president Wednesday night. usat.ly/2adWY6L",Mike Pence officially accepts VP nomination Capture,video,https://www.facebook.com/usatoday/videos/10153687103245667/,2016-07-20 23:49:16,2801,171,141,2588,96,5,31,7,74
13652355666_10153687065730667,"""Donald Trump is right,"" the former House speaker said. ""We are at war with radical Islamists, we are losing the war, and we must change course to win the war."" usat.ly/2aigyle",Gingrich: We are at war and Hillary Clinton doesn't get it,video,https://www.facebook.com/usatoday/videos/10153687065730667/,2016-07-20 23:11:55,3890,347,589,3609,68,15,66,4,128
13652355666_1666341570357031,Eric Trump praised Donald J. Trump as a businessman at the GOP convention.,Eric Trump: My dad truly loves America,video,https://www.facebook.com/usatoday/videos/1666341570357031/,2016-07-20 22:50:00,2651,251,131,2382,87,12,130,6,34
13652355666_10153686983375667,Republican convention Day 3: Here's what you missed,,video,https://www.facebook.com/usatoday/videos/10153686983375667/,2016-07-20 22:27:21,2125,268,58,2022,46,5,21,8,23
13652355666_1666321597025695,"Lynne Patton, vice president of the The Eric Trump Foundation said ""historically, black lives have mattered less ... and whether we like it or not there are still people out there who believe this to be true."" http://usat.ly/2a0upM5",Trump family friend gets emotional on RNC stage,video,https://www.facebook.com/usatoday/videos/1666321597025695/,2016-07-20 22:20:00,2194,170,217,1987,62,44,68,7,26
13652355666_1666324380358750,It went from a standing O to boos pretty quickly for Ted Cruz. http://usat.ly/2adM2pP,Ted Cruz gets booed at the GOP convention,video,https://www.facebook.com/usatoday/videos/1666324380358750/,2016-07-20 21:50:44,3320,493,348,2605,65,39,460,10,141
13652355666_10153686887710667,Ted Cruz had the audience in the palm of his hand ... until they realized he wasn't explicitly endorsing Donald Trump. usat.ly/2ai4GzR,Timeline Photos,photo,https://www.facebook.com/usatoday/photos/a.100797840666.101835.13652355666/10153686887710667/?type=3,2016-07-20 21:20:15,1653,144,26,1543,19,5,60,2,24
13652355666_1666315137026341,"For radio host Laura Ingraham, it was all about R-E-S-P-E-C-T at the Republican National Convention.",Laura Ingraham: Trump will restore respect for America,video,https://www.facebook.com/usatoday/videos/1666315137026341/,2016-07-20 21:19:21,2408,201,224,2221,94,19,48,6,20
13652355666_10153686871310667,We're on the Star Trek Beyond red carpet (and here's what we thought of the movie http://usat.ly/2ai3nkh).,USA TODAY Life,video,https://www.facebook.com/USATODAYlife/videos/1157294377667185/,2016-07-20 21:06:42,1896,35,0,1847,30,15,3,0,1
13652355666_10153686022650667,"The Iowa State Fair's butter cow not only celebrates its 105th anniversary this August, but gets to help the television and movie series Star Trek toast its 50th year.",Iowa State Fair's butter cow celebrates 105th anniversary,link,http://usat.ly/2abpN7k,2016-07-20 21:00:00,1354,27,37,1336,9,9,0,0,0
13652355666_10153686818590667,"""We Will Have So Much Winning""","#RNCinCLE Day 3: What you've missed, what's ahead",link,http://www.usatoday.com/story/news/politics/onpolitics/2016/07/20/republican-convention-wednesday-live-blog/87355134/,2016-07-20 20:40:00,1360,49,5,1320,33,0,6,0,1
13652355666_10153686798120667,"The Butter Cow is set to be unveiled at the Iowa State Fair for the 105th time. This year, a Star Trek compilation goes with it. http://www.desmoinesregister.com/story/news/local/iowa-state-fair/2016/07/20/butter-cow-star-trek-iowa-state-fair/87337490/",Butter Cow at Iowa State Fair,video,https://www.facebook.com/usatoday/videos/10153686798120667/,2016-07-20 20:19:40,1476,46,118,1414,24,30,7,1,0
13652355666_10153685303685667,Welcome to the jungle.,Hardwired for Happy Hour: Primates choose booze,link,http://www.usatoday.com/story/news/2016/07/19/study-monkeys-like-drink-booze/87311314/,2016-07-20 19:30:00,1408,44,18,1366,23,7,11,0,1
13652355666_10153683624585667,"Google Fiber no longer a moonshot — it's a ""real business.""","Google Fiber speeds up expansion as consumers, rivals raise pressure",link,http://usat.ly/2a8sab1,2016-07-20 19:00:00,1280,34,19,1262,16,0,2,0,0
13652355666_10153685287200667,29-year-old Michelle Hadley could face life in prison if she is convicted.,Authorities: Woman posed as ex-boyfriend's wife in Craigslist 'rape fantasy' ads,link,http://www.usatoday.com/story/news/nation-now/2016/07/20/authorities-woman-posed-ex-boyfriends-wife-craigslist-rape-fantasy-ads/87330510/,2016-07-20 18:35:00,1596,114,135,1382,18,98,5,10,83
13652355666_10153686512550667,"The buzz may still be about Melania Trump and her speech, but attention should shift to Mike Pence, the Indiana governor picked as Donald Trump's VP candidate.","OK, OK, Trump camp admits: Michelle Obama 'inspired' Melania's speech",link,http://www.usatoday.com/story/news/2016/07/20/evening-news-roundup-wednesday/87337518/,2016-07-20 17:59:00,1364,178,56,1239,20,11,83,5,6
13652355666_10153686443670667,"Ahead of his speech tonight, who is Eric Trump?","Who is Eric Trump? Big game hunter, philanthropist",link,http://www.usatoday.com/story/news/politics/onpolitics/2016/07/20/who-is-eric-trump/87358332/,2016-07-20 17:30:00,1319,282,42,1215,22,4,32,2,44
13652355666_10153686006610667,It's going to be so hot that even President Obama tweeted a warning about the heat.,"'Dangerous' heat wave to broil central, eastern U.S.",link,http://usat.ly/29V8oKg,2016-07-20 17:00:00,1554,114,264,1464,19,59,2,9,1
13652355666_10153686412695667,BREAKING: 14 international anti-doping agencies call for IOC to ban Russia from Rio Olympics.,Anti-doping leaders call on IOC to ban Russia from Rio Olympics,link,http://usat.ly/2abXLsd,2016-07-20 16:56:30,1338,86,40,1275,27,23,12,0,1
13652355666_10153685712665667,A driver playing Pokemon-Go slams into a Baltimore police car. http://usat.ly/2acqk5m,Pokémon Go is not all fun and games,video,https://www.facebook.com/usatoday/videos/10153685712665667/,2016-07-20 16:21:00,2526,523,2773,1852,14,254,309,18,79
13652355666_10153686263520667,Ask questions to American Idol star Ayla Brown who is singing the National Anthem tomorrow at the Republican National Convention in Cleveland.,,video,https://www.facebook.com/usatoday/videos/10153686263520667/,2016-07-20 15:55:57,1637,169,71,1556,53,12,4,5,7
13652355666_10153686251055667,"""Like seeing the bride before she gets to the altar."" Listen to the full Cup of Politics podcast on day 3 in Cleveland: a twist in the plagiarism scandal and the risk Donald Trump takes of diluting his appearance this Thursday at the Republican National Convention.
More info: http://www.clammr.com/app/clammr/228754?extendedInfoAutoplay=1",,video,https://www.facebook.com/usatoday/videos/10153686251055667/,2016-07-20 15:48:22,908,69,14,886,7,8,4,1,2
13652355666_10153686240790667,BREAKING: State-run media: Turkish president declares 3-month state of emergency following failed coup.,Turkey widens crackdown after failed coup,link,http://usat.ly/2aaWt0L,2016-07-20 15:43:01,954,81,39,931,4,4,5,2,8
13652355666_10153686229000667,"BREAKING: U.S. Rep. Mark Takai, a Democrat from Hawaii, dies at 49.",Congressman Mark Takai dies at 49,link,http://usat.ly/29Vsq7g,2016-07-20 15:36:07,2159,182,119,1290,7,61,3,797,1
13652355666_10153686218520667,Police making arrests outside GOP convention site. http://usat.ly/2acTEss,,video,https://www.facebook.com/usatoday/videos/10153686218520667/,2016-07-20 15:30:15,1492,175,140,1372,27,26,11,15,41
13652355666_10153686134685667,"""The district court must ensure that any remedy enacted ameliorates (the law's) discriminatory effect,""",Appeals court strikes down Texas voter ID law,link,http://usat.ly/2abF6fZ,2016-07-20 15:30:00,1878,541,479,1622,81,13,17,7,138
13652355666_10153686211835667,Police making arrests outside GOP convention site. http://usat.ly/2acTEss,,video,https://www.facebook.com/usatoday/videos/10153686211835667/,2016-07-20 15:26:58,1495,248,211,1314,43,62,34,13,29
13652355666_1666136887044166,Hollywood legend Garry Marshall passed away at the age of 81. He was known for the timeless movies and TV shows he created.,5 classics Garry Marshall brought us,video,https://www.facebook.com/usatoday/videos/1666136887044166/,2016-07-20 14:45:00,2985,116,350,2348,98,4,2,533,0
13652355666_10153686009575667,,Reviewed.com,video,https://www.facebook.com/Reviewedcom/videos/10157130962455632/,2016-07-20 14:04:21,1133,41,0,1113,12,7,1,0,0
13652355666_10153685807400667,All press is good press.,The single most insightful tweet about the Trump campaign,link,http://usat.ly/29UP7Zj,2016-07-20 14:00:01,1383,92,21,1314,30,8,16,3,12
13652355666_10153685790885667,"Sorry Lego Batman, you're not the only star of The Lego Batman Movie.","Sneak peek: 'Lego Batman Movie' reveals Joker, Robin",link,http://usat.ly/29UXjsk,2016-07-20 13:26:00,1308,41,24,1284,16,2,6,0,0
13652355666_10153685899715667,"Donald J. Trump makes grand entrance in Cleveland, complete with Air Force One theme. http://usat.ly/2ad4nTZ",,video,https://www.facebook.com/usatoday/videos/10153685899715667/,2016-07-20 13:07:36,4109,1049,257,3257,271,35,78,39,429
13652355666_10153685720720667,"""On all of these counts, Trump is the anti-Bush candidate,""","For Trump, the GOP is no longer the party of Bush",link,http://usat.ly/29UQRld,2016-07-20 13:00:00,1293,95,23,1251,21,7,8,4,2
13652355666_10153685703090667,"""Anyone who cares about free speech has been sent a clear message: you're not welcome on Twitter.""",Twitter boots Breitbart columnist as part of wider crackdown,link,http://usat.ly/2aaW2mS,2016-07-20 12:45:00,1462,172,73,1369,20,22,17,2,32
13652355666_10153685712960667,"Chris Cox of the National Rifle Association says it's ""a lie"" that Hillary Clinton won't take your guns. http://usat.ly/2ahqlrO",NRA exec at the GOP Convention,video,https://www.facebook.com/usatoday/videos/10153685712960667/,2016-07-20 11:59:05,1798,226,88,1706,39,5,9,3,36
13652355666_10153685745470667,"A Trump aide has taken responsibility for the controversy over Melania Trump's speech, saying she offered to resign but the campaign rejected it.",Trump aide takes responsibility for Melania speech,link,http://www.usatoday.com/story/news/politics/elections/2016/07/20/trump-aide-takes-responsibility-melania-speech/87340850/,2016-07-20 11:53:13,2128,425,235,1861,32,46,161,6,22
13652355666_10153685255045667,Lady Gaga is clearing the air.,Lady Gaga says she and Taylor Kinney are 'taking a break',link,http://www.usatoday.com/story/life/people/2016/07/20/lady-gaga-taylor-kinney-on-a-break/87331006/,2016-07-20 11:06:00,1372,51,21,1343,8,4,3,14,0
13652355666_10153685574950667,,Humankind,video,https://www.facebook.com/humankindvideos/videos/1145855598783421/,2016-07-20 10:46:01,6043,198,0,4940,358,721,11,11,2
13652355666_10153685252255667,"If it weren't for Melania, we might be talking about all the other things people said. via USA TODAY Opinion",Melania Trump saved her man: Nancy Kaffer,link,http://www.usatoday.com/story/opinion/nation-now/2016/07/20/melania-trump-donald-republican-national-convention-nancy-kaffer/87322780/,2016-07-20 10:28:10,1540,146,64,1454,24,4,39,2,17
13652355666_10153685497355667,Activists build Trump his wall in Cleveland. http://cin.ci/2ad6JCp,Enquirer - Cincinnati and Kentucky,video,https://www.facebook.com/Enquirer/videos/10155111057159698/,2016-07-20 10:10:23,1383,106,0,1301,21,5,40,3,13
13652355666_10153685475995667,BREAKING: NASCAR champ Jeff Gordon will replace Dale Earnhardt Jr. at Indianapolis and Pocono.,"Out of retirement, Jeff Gordon to replace Dale Earnhardt Jr. at Brickyard 400",link,http://www.usatoday.com/story/sports/nascar/2016/07/20/jeff-gordon-return-brickyard-400-dale-earnhardt-jr/87335172/,2016-07-20 09:59:38,2426,131,743,2213,128,65,2,6,12
13652355666_10153685325065667,"Dr. Ben Carson loosely links Hillary Clinton and her ""mentor"" Saul Alinsky to Lucifer. http://usat.ly/2abXimF","Ben Carson rails against Hillary Clinton, Lucifer",video,https://www.facebook.com/usatoday/videos/10153685325065667/,2016-07-20 09:34:37,4998,780,9239,4225,152,224,249,31,117
13652355666_10153685419135667,What to watch for at RNC Day 3. http://usat.ly/2ad6Iy9,Susan Page catches you up on all things GOP convention,video,https://www.facebook.com/usatoday/videos/10153685419135667/,2016-07-20 09:28:42,1471,282,53,1374,37,6,12,4,38
13652355666_10153685247770667,"She's also a Penn grad, just like dad.",Who is Tiffany Trump? Donald's younger daughter spoke out tonight,link,http://www.usatoday.com/story/news/politics/onpolitics/2016/07/19/who-is-tiffany-trump/87321708/,2016-07-20 09:02:00,2004,232,43,1881,68,7,34,3,11
13652355666_10153685160245667,KFC and Apple are really feeling the heat in China.,"Chinese consumers smash iPhones, mob KFCs over the South China Sea spat",link,http://www.usatoday.com/story/news/world/2016/07/20/kfc-apple-china-hit-south-china-sea-spat/87330092/,2016-07-20 08:45:00,1230,106,78,1145,3,32,36,9,5
13652355666_10153685168605667,Only in America.,Krispy Kreme: Time to drink the doughnuts,link,http://www.usatoday.com/story/money/2016/07/19/krispy-kreme-glazed-donut-flavored-soda/87302934/,2016-07-20 08:11:00,1361,76,156,1291,13,32,19,4,2
13652355666_10153685176525667,"""I am not politically correct.""","Ben Carson rails against Hillary Clinton, Lucifer",link,http://www.usatoday.com/story/news/politics/onpolitics/2016/07/19/donald-trump-ben-carson-republican-convention/87322298/,2016-07-20 07:32:00,1896,256,77,1741,53,12,66,12,12
13652355666_10153685183205667,Our illustrator's take on Tiffany Trump's speech last night,USA TODAY art director Jeff Dionise draws Tiffany Trump,video,https://www.facebook.com/usatoday/videos/10153685183205667/,2016-07-20 07:08:52,1889,245,124,1718,67,16,71,3,14
13652355666_10153683308110667,Two miles and a handful of mutual friends was all that separated Kim and Evan Leach from reconnecting after 25 years.,Couple finds each other on Match.com 25 years after being camp crushes,link,http://www.usatoday.com/story/news/nation-now/2016/07/19/couple-finds-each-other-reconnects-match-dating-site-25-years-later-teenage-crushes/87249056/,2016-07-20 06:39:01,1789,66,113,1700,58,26,4,0,1
13652355666_10153685066675667,"The three police officers killed in Sunday's ambush will be remembered at a vigil at Louisiana State University today. (Photo: AP)

More things to know: http://usat.ly/2abwtPD",Timeline Photos,photo,https://www.facebook.com/usatoday/photos/a.100797840666.101835.13652355666/10153685066675667/?type=3,2016-07-20 06:02:41,1920,119,80,1618,38,1,1,259,3
13652355666_10153684183470667,"""Our goal is to help the public realize that this is not a place about yesterday,"" said director Lonnie G. Bunch III. ""It's about yesterday, today and tomorrow.""","From slavery to Black Lives Matter, Smithsonian's new black history museum links past with present",link,http://www.usatoday.com/story/news/2016/07/19/advance-preview-national-museum-of-african-american-history-and-culture/87278412/,2016-07-20 05:32:00,2142,132,140,2071,43,17,3,2,6
13652355666_10153684756555667,"""He encouraged me to think of myself not as a female athlete, but a businessperson. In everything you do, be fearless, he reminded me. Be fearless.""",LPGA golfer Natalie Gulbis credits Trump for encouraging her to stand up to gender injustices,link,http://ftw.usatoday.com/2016/07/natalie-gulbis-trump,2016-07-20 05:00:00,1716,105,21,1677,11,2,22,1,3
13652355666_10153684760650667,"From ""Happy Days"" to ""Pretty Woman,"" these were some of Garry Marshall's best work.",5 top hits from Garry Marshall's legendary career,link,http://www.usatoday.com/story/life/people/2016/07/20/garry-marshall-greatest-hits-career-television-film/87328880/,2016-07-20 04:30:00,2338,88,64,2213,42,4,2,75,2
13652355666_10153684696755667,Donald Trump's a flamethrower. These leaders want him to tone it down.,These Tennessee leaders want more positive Trump campaign,link,http://www.usatoday.com/story/news/politics/elections/2016/07/20/tenn-leaders-positive-trump-campaign/87329108/,2016-07-20 03:45:00,1745,119,16,1720,5,2,13,1,4
