status_id,status_message,link_name,status_type,status_link,status_published,num_reactions,num_comments,num_shares,num_likes,num_loves,num_wows,num_hahas,num_sads,num_angrys
13652355666_10153692105960667,Rick Welts didn't feel comfortable attending the All-Star Game in Charlotte if the law remained as is.,How one NBA team exec influenced the ASG decision,link,http://www.usatoday.com/story/sports/nba/2016/07/22/golden-state-warriors-executive-influenced-nbas-2017-charlotte-all-star-game/87458518/,2016-07-22 23:18:00,303,28,4,294,4,1,4,0,0
13652355666_10153689361675667,"Since there are no legal recreational or medical marijuana stores, facilities or grows in the small town, it's not known how THC appeared in the water supply.",Officials: Colo. town's drinking water tainted with THC,link,http://www.usatoday.com/story/news/nation-now/2016/07/21/officials-colo-towns-drinking-water-tainted-thc/87419730/,2016-07-22 22:33:01,788,83,144,718,4,19,45,3,1
13652355666_10153689075295667,The order does not address whether the federal judge would refer Sheriff Joe and his aides for criminal contempt of court.,Judge strips Arpaio of some internal affairs oversight,link,http://www.usatoday.com/story/news/nation-now/2016/07/21/judge-strips-arpaio-internal-affairs-oversight/87412472/,2016-07-22 21:55:00,821,43,9,806,2,3,8,2,0
13652355666_10153691746530667,"Tim Kaine is the first to say he's boring. That doesn't sound bad after months of Hillary Clinton's emails and Donald Trump's bombast, writes the USA TODAY Opinion editorial board.",Tim Kaine is the right pick for veep: Our view,link,http://www.usatoday.com/story/opinion/2016/07/22/tim-kaine-hillary-clinton-vice-president-right-pick-our-view/87458426/,2016-07-22 21:15:00,1212,108,21,1177,19,2,4,1,9
13652355666_10153691738975667,"Tim Kaine is one of just 20 people to have served as a mayor, governor and U.S. senator.",6 things to know about Tim Kaine,link,http://www.usatoday.com/story/news/politics/onpolitics/2016/07/22/who-is-tim-kaine/87145838/,2016-07-22 20:50:00,1401,112,37,1348,27,5,16,1,4
13652355666_10153691761390667,"Tim Kaine is considered a safe pick, a swing-state moderate who appeals to independent voters.",Who is Tim Kaine? A closer look at the Virginia senator,link,http://www.usatoday.com/story/news/politics/elections/2016/2016/07/22/tim-kaine-hillary-clinton-running-mate/86982178/,2016-07-22 20:22:00,1611,221,76,1504,44,5,40,5,13
13652355666_10153691690390667,"While Hillary Clinton's vetting process included a range of options, Tim Kaine always had the best odds.",Clinton goes with her heart on Kaine VP pick,link,http://www.usatoday.com/story/news/politics/elections/2016/2016/07/22/clinton-goes-her-heart-kaine-vp-pick/87447416/,2016-07-22 19:56:07,1717,218,47,1599,53,1,36,2,26
13652355666_10153691690610667,"Hillary Clinton announced Virginia Sen. Tim Kaine as her pick for vice president, days ahead of the Democratic convention in Philadelphia. http://usat.ly/29RZb6r",Hillary Clinton announces Tim Kaine as running mate,video,https://www.facebook.com/usatoday/videos/10153691690610667/,2016-07-22 19:35:35,2902,326,353,2574,164,10,88,12,54
13652355666_10153691680935667,BREAKING: Hillary Clinton has announced Virginia Sen. Tim Kaine as her running mate. http://usat.ly/2a6NLPU,,status,,2016-07-22 19:24:54,873,64,18,831,24,3,10,2,5
13652355666_10153691611000667,Miss Teen USA drew praise last month for announcing the pageant would eliminate its swimsuit competition.,See what Miss Teen USA contestants will wear instead of bikinis,link,http://www.usatoday.com/story/life/entertainthis/2016/07/22/miss-teen-usa-contestants-fitnesswear-competition-apparel-tapout/87446676/,2016-07-22 19:10:00,901,28,12,889,10,1,1,0,0
13652355666_10153691625265667,"BREAKING: Munich shooter apparently killed himself and looks to have acted alone, according to reports. The latest: usat.ly/29SFThj","At least 9 dead in Munich shooting rampage, 1 may be attacker",link,http://usat.ly/29SFThj,2016-07-22 18:49:54,819,47,45,751,1,4,0,42,21
13652355666_10153690568750667,Who let the bulls out?,Two bulls escape Baltimore slaughterhouse,link,http://usat.ly/29RP8yo,2016-07-22 18:30:00,858,41,29,815,3,10,29,1,0
13652355666_10153690739820667,'Queer' means many things. usat.ly/1I1dwvz,What does the Q in LGBTQ stand for?,video,https://www.facebook.com/usatoday/videos/10153690739820667/,2016-07-22 18:00:00,683,52,13,676,3,2,2,0,0
13652355666_10153691343045667,The Republican convention was a family affair for the Trumps.,Trump kids talk about father Donald at GOP convention,video,https://www.facebook.com/usatoday/videos/10153691343045667/,2016-07-22 16:36:27,1485,148,58,1396,31,6,21,4,27
13652355666_10153691304885667,Jeff Bezos is now slightly richer than Warren Buffett.,Amazon's Bezos now world's 3rd richest person,link,http://www.usatoday.com/story/tech/news/2016/07/22/amazons-bezos--worlds-3rd-richest-person/87434788/,2016-07-22 16:18:00,1045,67,23,1024,6,14,0,1,0
13652355666_10153691319540667,"Preliminary ratings for Donald J. Trump's acceptance speech -- 
- Fox News  9.4 million viewers
- CNN  5.5 million
- NBC  4.6 million
Full list: usat.ly/29SV0HF",Early ratings: 30 million watch Trump speech,link,http://www.usatoday.com/story/life/tv/2016/07/22/early-ratings-30-million-watch-trump-speech/87445014/,2016-07-22 16:13:55,1358,239,70,1264,44,10,27,5,8
13652355666_10153691259055667,BREAKING: The death toll has risen to eight in an apparent terror attack in Munich. Up to three gunmen remain on the loose.,Munich shooting rampage: What we know,link,http://www.usatoday.com/story/news/world/2016/07/22/munich-shooting-rampage-what-we-know/87446558/,2016-07-22 15:40:01,3080,808,2476,1677,7,39,9,847,501
13652355666_10153691170915667,"""The suspects are still on the run,"" Munich police said in a statement. ""Please avoid public places."" More: usat.ly/29SFThj",Shooting in Munich: What we know,video,https://www.facebook.com/usatoday/videos/10153691170915667/,2016-07-22 14:57:47,1853,111,285,1434,9,17,3,238,152
13652355666_10153691145540667,"What we know about the shooting in Munich, Germany:
- As many as six people were killed Friday at a shopping mall
- One or more gunmen remained on the run
- Munich police are using the term ""suspected terrorism""

Photo: Mark Mueller, Getty Images usat.ly/29SJ34F",Timeline Photos,photo,https://www.facebook.com/usatoday/photos/a.100797840666.101835.13652355666/10153691145540667/?type=3,2016-07-22 14:51:49,1195,96,52,1095,8,3,1,60,28
13652355666_10153691010450667,"Raw video: Outside a shopping center in Munich, where a shooting rampage left as many as six people dead on Friday. usat.ly/29SFThj",Shots fired at shopping center in Munich,video,https://www.facebook.com/usatoday/videos/10153691010450667/,2016-07-22 14:30:00,1542,151,172,1295,12,13,2,153,67
13652355666_10153689329025667,Gas prices have plunged to their lowest July level in 12 years.,"As summer heats up, gas prices stay cool",link,http://www.usatoday.com/story/money/2016/07/21/summer-heats-up-gas-prices-stay-cool/87388482/,2016-07-22 14:01:00,1713,84,55,1679,21,11,1,1,0
13652355666_10153689426820667,The three children were wandering the desert without shoes or water for about an hour as temperatures climbed to 100 degrees.,"Mom, boyfriend get 8 months jail after leaving kids in desert",link,http://www.usatoday.com/story/news/nation-now/2016/07/21/children-left-in-desert/87421708/,2016-07-22 13:22:00,2581,181,90,2225,20,20,3,72,241
13652355666_10153689282050667,"Police departments across the U.S. have received public complaints about the personal postings of some officers, both black and white.",Ohio city reviewing black officer's Facebook post about white cops,link,http://www.usatoday.com/story/news/nation-now/2016/07/21/cincinnati-police-officer-facebook/87410650/,2016-07-22 12:50:00,1907,63,46,1854,21,2,2,7,21
13652355666_10153690818575667,BREAKING: At least one dead in shooting at Munich shopping center.,Reports: Shooting at Munich shopping center,link,http://usat.ly/2ambSuP,2016-07-22 12:27:40,2972,609,1307,2104,13,27,3,522,303
13652355666_10153689351880667,"""I think a lot of African-American police officers are caught between what's going on — with issues toward blackness and issues toward police officers.""",Black police officers move through two different worlds,link,http://www.usatoday.com/story/news/nation-now/2016/07/21/black-police-officers-move-through-two-different-worlds/87418584/,2016-07-22 12:15:00,1852,53,29,1818,13,1,1,17,2
13652355666_10153690723610667,BREAKING: President Obama says America is not on the verge of collapse despite rhetoric at the GOP convention.,Obama disputes Trump's criticism of U.S.,link,http://www.usatoday.com/story/news/politics/elections/2016/2016/07/22/barack-obama-donald-trump-enrique-pena-nieto-hillary-clinton/87437538/,2016-07-22 11:38:43,2543,346,138,2401,71,10,50,1,10
13652355666_10153690720745667,,Humankind,video,https://www.facebook.com/humankindvideos/videos/1145957505439897/,2016-07-22 11:36:44,1728,31,0,1624,72,19,1,11,1
13652355666_10153690534370667,"""They're really gonna miss me,"" says a Wisconsin teen who has chosen to die in hospice care. She plans to live out her final wishes, including going to a prom held in her honor on Friday night. http://usat.ly/2acV4Dk",14-year-old from Wisconsin says she's ready to die,video,https://www.facebook.com/usatoday/videos/10153690534370667/,2016-07-22 11:23:00,1559,79,45,1411,41,3,0,103,1
13652355666_10153690633170667,Larry the lobster lives another day.,Centenarian lobster saved from pot at last minute,link,http://www.usatoday.com/story/news/nation/2016/07/22/centenarian-lobster-saved-pot-last-minute/87431450/,2016-07-22 11:02:01,1400,57,24,1369,18,8,3,0,2
13652355666_10153690647940667,"BREAKING: David Duke, ex-KKK leader, plans to run for U.S. Senate in Louisiana.",Ex-KKK leader David Duke announces Senate run for La. seat,link,http://ux.usatoday.com/story/news/politics/elections/2016/07/22/david-duke-senate-run/87437334/,2016-07-22 10:56:45,1998,434,915,1391,19,69,155,33,331
13652355666_10153690618545667,REPORTS: Former NFL coach Dennis Green dies at age 67.,"Reports: Former Vikings, Cardinals coach Dennis Green dies at 67",link,http://www.usatoday.com/story/sports/nfl/2016/07/22/dennis-green-dead-minnesota-vikings-arizona-cardinals/87436784/,2016-07-22 10:42:01,1639,78,138,1392,6,27,0,214,0
13652355666_1667281676929687,The future king of England is turning 3 years old and quickly maturing in front of the whole world.,Prince George's birthday makes him a 'threenager',video,https://www.facebook.com/usatoday/videos/1667281676929687/,2016-07-22 10:30:00,4722,117,268,4339,352,12,19,0,0
13652355666_10153689198145667,The NBA's decision to relocate the All-Star Weekend will cost the state an estimated $100 million.,North Carolina governor fires back at NBA decision over All-Star Game,link,http://www.usatoday.com/story/sports/nba/2016/07/21/north-carolina-governor-pat-mccrory-nba-all-star-game-relocation/87413340/,2016-07-22 10:00:00,2216,296,128,1919,31,34,198,14,20
13652355666_10153690527695667,Factchecking Donald Trump's speech with FactCheck.org's Lori Robertson,,video,https://www.facebook.com/usatoday/videos/10153690527695667/,2016-07-22 09:47:35,1968,728,170,1769,65,16,24,6,88
13652355666_10153690384945667,FactCheck.org breaks down Donald Trump's acceptance speech.,Fact check: Trump's big acceptance speech,link,http://www.usatoday.com/story/news/politics/elections/2016/07/22/fact-check-republican-convention-trump-speech/87420076/,2016-07-22 09:30:00,1440,158,125,1372,16,5,36,1,10
13652355666_10153690356970667,"""What the officer didn't know (were) the white individual's intentions. He thought Mr. Kinsey was about to be killed.""",Police union says officers accidentally shot Miami man,link,http://usat.ly/29YJiKA,2016-07-22 09:00:00,2126,575,435,1698,11,66,19,55,277
13652355666_10153690337585667,Princess Kate and Prince William celebrate Prince George's third birthday with adorable new photos.,"Happy birthday, Prince George! See the new birthday photos",link,http://usat.ly/29RF7kO,2016-07-22 08:30:00,5331,285,322,4958,352,17,2,0,3
13652355666_10153690250655667,The campaign isn't over for some Bernie Sanders supporters.,'Bernie or Bust' backers to flock to Philly to protest,link,http://usat.ly/29Y1La9,2016-07-22 07:30:00,1865,121,64,1778,23,5,42,5,12
13652355666_10153690166950667,Our illustrator's take on Donald Trump's acceptance speech at the RNC last night,USA TODAY art director Jeff Dionise draws Donald Trump,video,https://www.facebook.com/usatoday/videos/10153690166950667/,2016-07-22 07:03:55,2210,243,101,2043,34,17,58,6,52
13652355666_10153683293625667,Danny Troupe was angry about getting a ticket for running a red light.,Ticked-off pickup driver drags traffic cop up exit ramp,link,http://www.usatoday.com/story/news/nation-now/2016/07/19/man-angry-officer-injured/87287026/,2016-07-22 07:00:01,1676,177,185,1450,4,45,5,21,151
13652355666_1667190663605455,ICYMI: Here's the moment Donald J. Trump accepted the Republican Party's presidential nomination last night.,Trump 'humbly' accepts,video,https://www.facebook.com/usatoday/videos/1667190663605455/,2016-07-22 06:35:00,2107,151,79,1897,65,6,27,23,89
13652355666_10153690129730667,BREAKING: The IOC says 45 more athletes have been caught for doping in retesting of samples from the 2008 and 2012 Olympics.,"IOC: 45 more positive cases in retests of 2008, 2012 samples",link,http://usat.ly/29ZPEZO,2016-07-22 06:18:15,1552,51,25,1507,13,21,0,4,7
13652355666_10153689713985667,"Baton Rouge continues to mourn as police officer Matthew Gerald is laid to rest on Friday.

(Photo: EPA)

More news you need to know: usat.ly/29PEkEK",Timeline Photos,photo,https://www.facebook.com/usatoday/photos/a.100797840666.101835.13652355666/10153689713985667/?type=3,2016-07-22 05:59:06,1884,62,33,1726,20,0,2,135,1
13652355666_10153689128790667,"""Discovering new things is so much more dope than 'I'm going to sit at home and swipe left or swipe right.'""","Watch out, Tinder: Pokémon Go is the new dating scene",link,http://www.usatoday.com/story/tech/news/2016/07/21/watch-out-tinder-pokmon-go-new-dating-scene/87401376/,2016-07-22 05:16:00,1510,53,9,1495,8,1,5,0,1
13652355666_10153689103065667,Roger Ailes' exit accelerates the day of reckoning that Fox News and its corporate parent have been pondering for years.,Ailes' departure poses unexpected challenges for Fox,link,http://www.usatoday.com/story/money/2016/07/21/ailes-departure-poses-unexpected-challenges-fox/87390286/,2016-07-22 04:41:00,1673,77,16,1642,12,2,16,0,1
13652355666_10153689125850667,"""Rihanna's part is so crazy, it's so awesome.""",Rihanna glimpse in 'Valerian' wows Comic-Con crowd,link,http://www.usatoday.com/story/life/entertainthis/2016/07/21/rihanna-valerian-comic-con/87412548/,2016-07-22 04:14:00,1774,58,15,1757,12,5,0,0,0
13652355666_10153689113030667,Walter Palmer closed his dental practice and went into hiding after being vilified worldwide for killing the popular lion.,"Police: Man steals, crashes boat belonging to hunter who killed Cecil the lion",link,http://www.usatoday.com/story/news/nation-now/2016/07/21/police-stolen-boat-belonged-dentist-killed-cecil-lion/87414466/,2016-07-22 03:23:00,2397,117,63,2233,41,18,99,2,4
13652355666_10153689238930667,"Guess who's joining the dreaded ""threenagers"" club?","Happy birthday, Prince George, and good luck, Kate",link,http://www.usatoday.com/story/life/people/2016/07/21/happy-3rd-birthday-prince-george/87384860/,2016-07-22 02:21:00,3690,113,66,3554,108,8,20,0,0
13652355666_1146571148711866,"This woman does photoshoots for families who have children with special needs. She never takes a penny for it, but she asks for one thing in return.",Photographer donating free photoshoots for special needs,video,https://www.facebook.com/usatoday/videos/1146571148711866/,2016-07-22 01:42:00,22817,454,7724,17916,4743,118,8,26,8
13652355666_10153689669375667,Donald J. Trump's solution for what ails America can be summed up in two words: Donald Trump.,Top takeaways from the GOP convention's final night,link,http://www.usatoday.com/story/news/politics/onpolitics/2016/07/22/takeaways-republican-national-convention-trump-speech/87393802/,2016-07-22 01:13:00,1858,159,19,1802,12,3,29,2,10
13652355666_10153689654185667,Donald J. Trump's speech was as long as Mitt Romney's and President Obama's speeches combined in 2012.,Was Trump's speech the longest ever?,link,http://www.usatoday.com/story/news/politics/onpolitics/2016/07/21/donald-trump-longest-convention-speech/87425842/,2016-07-22 00:36:00,2389,365,61,2196,42,13,121,8,9
13652355666_10153689207085667,"Charles Kinsey, a behavioral therapist, was trying to comfort an autistic patient who wandered away from his group home before being shot by police.",Fla. man says his hands were up when police shot him,link,http://www.usatoday.com/story/news/nation-now/2016/07/21/fla-man-says-his-hands-were-up-when-police-shot-him/87377306/,2016-07-21 23:47:00,2258,282,313,1953,12,12,3,70,208
13652355666_10153689505085667,"Tyrek Coger, a junior college transfer from Raleigh, N.C., was hoping to help Oklahoma State for the upcoming season.","Oklahoma State basketball player Tyrek Coger collapses, dies after team workout",link,http://www.usatoday.com/story/sports/ncaab/big12/2016/07/21/oklahoma-state-tyrek-coger-dead-collapses-workout/87423586/,2016-07-21 23:08:00,2156,83,210,1867,7,26,1,255,0
13652355666_10153689522550667,It's not so easy to leave an arena full of balloons. See the aftermath at the Republican National Convention.,,video,https://www.facebook.com/usatoday/videos/10153689522550667/,2016-07-21 23:04:01,2840,660,162,2483,132,34,70,13,108
13652355666_10153689497310667,"The kind of stuff that might be good for attracting ratings, but bad for reassuring voters?",Analysis: The Republican convention as reality TV. Not in a good way,link,http://www.usatoday.com/story/news/politics/elections/2016/07/21/republican-convention-reality-tv-trump/87377826/,2016-07-21 22:47:42,2018,280,84,1851,21,7,82,9,48
13652355666_1666993836958471,"Donald Trump: ""I am your voice."" http://usat.ly/2ah1ba4",Donald Trump: I am your voice,video,https://www.facebook.com/usatoday/videos/1666993836958471/,2016-07-21 22:32:17,3582,568,335,3103,174,6,192,14,93
13652355666_10153689393955667,Donald Trump has officially accepted the GOP Presidential nomination. Watch live as balloons fall.,,video,https://www.facebook.com/usatoday/videos/10153689393955667/,2016-07-21 22:13:07,4585,1890,317,3274,408,44,84,80,695
13652355666_1666980700293118,Ivanka Trump targeted women in her Republican National Convention speech.,Ivanka Trump: My father is 'color blind and gender neutral',video,https://www.facebook.com/usatoday/videos/1666980700293118/,2016-07-21 21:55:29,3362,332,258,2914,205,9,89,10,135
13652355666_10153689338255667,Donald Trump has officially accepted the GOP Presidential nomination. Watch live right here.,,video,https://www.facebook.com/usatoday/videos/10153689338255667/,2016-07-21 21:39:48,5356,2716,380,3783,508,50,109,120,786
13652355666_1666969986960856,"""Who cares"" about the transgender bathroom issue, Peter Thiel asked at the Republican National Convention.","Peter Thiel: I'm proud to be gay, Republican, American",video,https://www.facebook.com/usatoday/videos/1666969986960856/,2016-07-21 21:21:39,1645,139,120,1522,46,13,10,7,47
13652355666_10153689302705667,The chorus of this song playing in the arena of the Republican National Convention in Cleveland is Donald Trump's campaign tag line: Make America Great Again. http://usat.ly/2agvk9a,Trump campaign tag put in song,video,https://www.facebook.com/usatoday/videos/10153689302705667/,2016-07-21 21:16:50,1224,69,25,1168,26,5,17,0,8
13652355666_1666951333629388,Reince Priebus says Americans are sick of cronyism and corruption and Donald J. Trump will put an end to it. http://usat.ly/2akE6WG,RNC Chair Priebus: America has had enough corruption,video,https://www.facebook.com/usatoday/videos/1666951333629388/,2016-07-21 20:48:02,1953,206,99,1712,42,10,137,3,49
13652355666_1666927330298455,"""Truuuuump!"" http://usat.ly/2akE6WG",Shouting pastor wants your help electing Donald Trump,video,https://www.facebook.com/usatoday/videos/1666927330298455/,2016-07-21 19:45:55,3902,469,844,3391,207,43,192,20,50
13652355666_10153688274130667,Facebook CEO Mark Zuckerberg was on hand for the first full-scale flight of Aquila.,Facebook's Aquila completes first test flight,link,http://usat.ly/2ae3IVv,2016-07-21 19:00:00,1560,76,110,1512,20,28,1,0,0
13652355666_10153688228775667,There's little doubt that Stephen Colbert and Trevor Noah are in need of a reset.,"Review: In late-night comedy, live thrives against conventional GOP coverage",link,http://usat.ly/2ae0pxr,2016-07-21 18:35:00,1259,64,17,1229,15,1,14,0,0
13652355666_10153688992310667,"""We do not believe we can successfully host our All-Star festivities in Charlotte in the climate created by HB2.""",NBA plans to move 2017 All-Star Game from Charlotte due to anti-LGBT bill,link,http://www.usatoday.com/story/sports/nba/allstar/2016/07/21/nba-to-move-all-star-game-charlotte-anti-lgbt-bill/87395090//www.usatoday.com/story/sports/nba/allstar/2016/07/21/nba-to-move-all-star-game-charlotte-anti-lgbt-bill/87395090/,2016-07-21 18:04:00,1789,116,99,1683,63,8,13,0,22
13652355666_10153688477725667,Not all snacks were created equal.,"In honor of National Junk Food Day, try these not-so-junky foods",link,http://www.usatoday.com/story/news/2016/07/21/national-junk-food-day-try-these-healthy-junk-foods/87360830/,2016-07-21 17:24:00,1068,48,28,1061,3,4,0,0,0
13652355666_10153685745840667,A Black Lives Matter protest became a picnic with police. http://usat.ly/2agQiaO,Kansas Black Lives Matter turns into something else,video,https://www.facebook.com/usatoday/videos/10153685745840667/,2016-07-21 17:00:01,5110,169,1185,4577,472,50,10,0,1
13652355666_10153688234120667,Wonder Woman is having her Comic-Con moment.,Comic-Con: Wonder Woman's legacy on display,link,http://www.usatoday.com/story/life/movies/2016/07/21/wonder-woman-75th-anniversary-comic-con/87376554/,2016-07-21 16:26:49,1281,41,79,1246,31,4,0,0,0
13652355666_10153688095810667,You don't have to catch 'em all by yourself.,Catch your Pokemate with Pokemon Go dating app,link,http://usat.ly/29XBHvP,2016-07-21 16:00:00,1187,74,89,1153,12,3,18,1,0
13652355666_10153688732555667,,USA TODAY Money and Tech,link,http://www.usatoday.com/story/money/2016/07/21/ailes-steps-down-fox-news-ceo-after-sexual-harassment-lawsuit/87402864/,2016-07-21 15:48:26,1104,71,0,1079,9,2,13,0,1
13652355666_10153688088315667,The paper suggests police departments increase punishment for excessive use of force in non-lethal incidents.,Paper finding no racial bias in shootings by police criticized,link,http://www.usatoday.com/story/news/nation-now/2016/07/21/paper-finding-no-racial-bias-shootings-police-criticized/87301632/,2016-07-21 15:35:01,1188,57,8,1166,5,9,0,0,8
13652355666_10153688071120667,Shannen Doherty posted a series of emotional photos on Instagram that show her shaving her head as part of her ongoing battle with breast cancer.,Shannen Doherty shaves head in breast-cancer battle,link,http://usat.ly/2acotkq,2016-07-21 15:00:00,2824,325,269,2223,123,16,1,459,2
13652355666_10153687974215667,Beijing isn't happy with the United States.,"As GOP trashes China, Beijing warns of potential war with U.S.",link,http://usat.ly/2adL4gA,2016-07-21 14:33:00,2928,489,1049,2432,22,221,73,30,150
13652355666_10153687837345667,Social activism is coming at a cost for WNBA players.,"WNBA fines 3 teams, players for shirts in wake of shootings",link,http://usat.ly/2acEG9c,2016-07-21 14:00:01,1738,170,185,1589,21,17,17,3,91
13652355666_10153688441120667,"Our illustrator has been drawing caricatures every morning, off of the previous night's Republican National Convention speeches. On Thursday night, Ivanka and Donald Trump will speak. What will tomorrow's look like?",Photos from USA TODAY's post,photo,https://www.facebook.com/usatoday/photos/a.100797840666.101835.13652355666/10153688435865667/?type=3,2016-07-21 13:37:57,1586,78,40,1518,14,2,50,1,1
13652355666_1481504608542343,"You could strain your neck trying to see the top of Sequoia National Park's giant trees, but don't miss all the wonders down below. http://usat.ly/2a476SI",Marvel at Sequoia National Park's massive sights,video,https://www.facebook.com/usatoday/videos/1481504608542343/,2016-07-21 13:29:00,4190,117,894,3889,200,98,3,0,0
13652355666_10153688025590667,The last movie in the franchise is diverging from movie theaters to TV.,'Divergent' finale will be a TV movie instead of theatrical release,link,http://usat.ly/29XrjUM,2016-07-21 13:00:01,1831,183,385,1663,21,84,41,5,17
13652355666_1666630066994848,"In honor of National Junk Food Day, here are five salads with more calories than your favorite cheat meals.",5 salads with more calories than most daily limits,video,https://www.facebook.com/usatoday/videos/1666630066994848/,2016-07-21 12:30:00,1817,87,441,1708,17,83,6,1,2
13652355666_1666610246996830,This is what happens when a young kangaroo gets stuck in flood waters.,Watch a kangaroo hop through flood water,video,https://www.facebook.com/usatoday/videos/1666610246996830/,2016-07-21 12:01:31,2393,110,296,2004,29,43,60,251,6
13652355666_10153687021395667,"So far there have been few arrests and few injuries. But the Rust Belt Street Medics are there, just in case.","In Cleveland, street medics prowl to help demonstrators",link,http://www.usatoday.com/story/news/politics/elections/2016/07/20/cleveland-street-medics-help/87371540/,2016-07-21 11:30:01,1424,44,9,1402,18,4,0,0,0
